Tweet,Category,,
Jadi  masalahnya bukan hanya apakah perekonomian tumbuh atau tidak. Masalah utamanya adalah kualitas dan ketahanan pertumbuhan. Pertumbuhan sebesar 5 61% memang positif  namun pelemahan rupiah  tekanan terhadap IHSG,Economy,,
Kudengar musim 3 akan segera hadir,Entertaiment,,
Daftar HP Samsung yang Dukung AirDrop untuk Transfer Foto ke iPhone,Technology,,
Apakah saya perlu menonton musim pertama?,Entertaiment,,
Dengan kecepatan yang sama dengan pesawatâ¦,Entertaiment,,
Di #NVIDIAGTC di #COMPUTEX2026  desain semikonduktor  fisika AI  dan banyak lagi.  jelajahi sesi yang membahas perkembangan terbaru dalam komputasi akselerasi,Technology,,
Apa yang kami sebut genre karakter ini,Entertaiment,,
Anda akan memberi nama atau menjadi tas douche itu?,Entertaiment,,
Silakan tonton Fullmetal Alchemist All-Star dengan animasi Granblue Fantasy.,Entertaiment,,
Donghua > Anime,Entertaiment,,
Sangat setuju,Entertaiment,,
tidak ada nama yang disebutkan di postingan jadi siapa yang peduli,Entertaiment,,
Unboxing iPhone 17e Soft Pink  Warnanya Bikin Kepincut Harga Rp 13 Jutaan,Technology,,
Google Gagalkan Eksploitasi Zero-Day yang Diciptakan Pakai AI,Technology,,
Fitur Keamanan Baru Lindungi HP Android dari Copet dan Penipu,Technology,,
Iblis mungkin menangis manusia puncak,Entertaiment,,
Indonesia sekarang aneh sekali ya? Semuanya tentang pelemahan rupiah MBG korupsi PHK massal dan kenaikan harga bahan bakar. Dulu jauh lebih seru ada manusia babi hutan yang bisa berubah bentuk nenek dengan sendok sayur Ponari UFO di GBK kiamat 2012 gua langsung ke Mekah Wewe Gombel. Sekarang berita hanya membuat semua orang khawatir.,Economy,,
"Oke, dikonfirmasi oleh Denia. Arsitek Agung adalah seorang wanita.",Entertaiment,,
Dalam normal memang injeksi 200T ke himbara akan membantu dengan asumsi asumsi ideal  tapi dgn,Economy,,
Cara dia menenangkan diri setelah mendengar 10 anak,Entertaiment,,
Film apa ini!?,Entertaiment,,
Saya pikir ini pemutih.,Entertaiment,,
Keserakahan akan menghabisinya,Entertaiment,,
Ramalan Teknologi Masa Depan Ini Ternyata Meleset Jauh,Technology,,
Reaksi Penggemar Genshin Impact Atas Model Sandrone yang Didesain Ulang,Entertaiment,,
Indonesia mengumumkan perusahaan milik negara untuk mengendalikan ekspor komoditas penting. Hal ini juga akan mengharuskan eksportir untuk menyimpan pendapatan mereka di bank-bank milik negara. âSetiap harga [komoditas ini] harus kita tentukan. Kalau tidak mendukung  mereka tidak perlu membeli. Kita pakai,Economy,,
Era AI membutuhkan CPU baru. Perkenalkan NVIDIA Vera  penyelesaian tugas agen 80% lebih cepat daripada x86.,Technology,,
"Pertumbuhan ekonominya tinggi tapi yang tumbuh tinggi konsumsi Sektor industri pengolahan sektor stagnan Ibarat orang yang makannya banyak  tapi memasaknya sedikit atau ""Rajin Belanja"" belanjanya pakai utang pula oh",Economy,,
Integrasi Jaringan XLSmart Capai 70%  Sinyal 5G Makin Dikebut,Technology,,
itulah yang saya rasakan tentang The Sandman,Entertaiment,,
Apakah ini foto dari musim terbaru?,Entertaiment,,
TEMAN-TEMAN... SAYA BARU TAHU,Entertaiment,,
SpaceX Ternyata Bakar Duit Besar-besaran dan Rugi Raksasa,Technology,,
