Tweet,Category,,
Baru tadi pagi digoreng narasi 'Rupiah stabil'  sore ini langsung loyo lagi ke Rp17.667. BI sudah berkorban naikkan bunga ke 5 25% demi nahan modal kabur  tapi langsung rusak sama sentimen negatif pasar yang ngeri liat aturan monopoli ekspor BUMN. Kebijakan sektoral ugal-ugalan,Economy,,
PV Karakter Irene Dirilis,Entertaiment,,
'Gerbang Internet' di Wamena Bikin Internet Papua Pegunungan Stabil,Technology,,
disiplin kebijakan fiskal selama lebih dari 2 dekade (defisit anggaran dibatasi sebesar 3% - Anda lihat India dapat mengalami defisit anggaran sebesar 7-8% dari PDB jika digabungkan antara federal + negara bagian) merupakan penyangga yang sangat besar bagi pemerintahan ini. Jadi menurut saya akan tetap maju secara ekonomi,Economy,,
Saat Anies Baswedan menyebut daya beli masyarakat melemah  data BPS justru mencatat konsumsi rumah tangga tumbuh 5 56%. Kritik boleh  tapi tetap harus berdasarkan fakta yang utuh dan obyektif.,Economy,,
"Jujur saja, gambar diam selalu terlihat lebih baik daripada gerakan sebenarnya. Apakah ini benar-benar puncak atau sekadar screensaver beranggaran besar?",Entertaiment,,
RI Kini Satu Circle dengan Raksasa Prakiraan Cuaca Dunia,Technology,,
"ANIME TV Drama Fantasi Baru ""Apakah Anda Ingin Menjadi Tanuki?"" PENGUNGKAPAN TEASER",Entertaiment,,
"Jika Anda tidak mencantumkan nama di postingan Anda, Anda sedang bertani pertunangan",Entertaiment,,
Seiring dengan perubahan lanskap komputasi yang dipengaruhi oleh AI berbasis agen  Rene akan berbagi mengapa Arm berada di pusat perubahan ini.,Technology,,
pekerjaan rumah yang paling laki-laki dilakuin apa?,Entertaiment,,
Satu bulan untuk ujianku juga,Entertaiment,,
Saya yakin itu Penguasa Misteri. Saya menonton episode pertama dan tidak dapat melanjutkan.,Entertaiment,,
Di #COMPUTEX2026  @SKhynix memamerkan inovasi yang mendorong era komputasi AI berikutnya.,Technology,,
Kredit bermasalah hanya berkisar 2%  dan permodalan perbankan (CAR) kuat di atas 25%. Bank kami memiliki benteng yang kokoh. 5 Pernafasan Perekonomian Masih Panjang. Ingat '98? Perekonomian kita mengalami kontraksi hingga -13% dan inflasi menjadi sangat gila  melonjak hingga di atas 77%! Harga dari,Economy,,
Harga MacBook Neo RI Bikin Kaget  Lebih Murah dari Singapura & Malaysia,Technology,,
Elon Musk & Komisi Sekuritas AS Diduga Main Mata Senilai USD 1 5 Juta,Technology,,
Seorang pria memotret matahari dari tempat yang samaâ¦ pada waktu yang samaâ¦ selama 3 tahun dan membuat video yang luar biasa ini.,Entertaiment,,
Viral UFO di Natuna  Mirip Objek Misterius di Rekaman Pentagon,Technology,,
Menteri Keuangan Purbaya Yudhi Sadewa menanggapi anjloknya Indeks Harga Saham Gangguan (IHSG) ke level 6.100 setelah pemerintah mengumumkan kebijakan ekspor baru di sektor sumber daya alam (SDA). Pemerintah akan mewajibkan ekspor tiga komoditas utama SDA yakni kepala sawit batu,Economy,,
Tidak Sedang Runtuh  Sedang Diuji Oleh: Abdullah Rasyid Mahasiswa Doktoral Ilmu Pemerintahan IPDN Dolar boleh naik. Dunia boleh bergejolak. Tetapi tidak sedang berdiri di titik rapuh seperti tahun 1998. Kita harus jujur ââââmelihatnya,Economy,,
sayang! cw // spoiler pencarian archon,Entertaiment,,
Perekonomian sedang runtuh. Tidak ada investor  PHK massal karena pabrik mangkrak dan tidak mampu membeli bahan baku produksi  tidak mampu mengimpor pangan sehingga krisis pangan  kelaparan  kemiskinan,Economy,,
Memposting acara secara tidak jelas dan tidak pernah memberikan judul berarti akun langsung dibungkam. Perlambatan pekerjaan yang bagus!,Entertaiment,,
iPhone 16 Pro Max Kirana Larasati Ikut Diving 150 Meter  Begini Nasibnya,Technology,,
anime 3d. Tidak akan melewatkan.,Entertaiment,,
Kalo benar begini berarti ada permainan antar petinggi bumn penguasa listrik ini di Sumatra uda padam dari minggu2 lalu sampai sekarang ini pulau Jawa mulai juga.. Bayangin aja kalau indonesia seluruhnya mobil listrik apa ga lumpuh ekonomi kita karena disarankan pakai mobil ev,Economy,,
Intel Kabarnya Mulai Produksi Chip iPhone,Technology,,
musim baru?,Entertaiment,,
"Kalau dipikir-pikir, ketika Anda menyadari Gojo melakukan ini, itu gila bukan? Tanpa Kekosongan Tanpa Batas itu, Anda tidak akan bisa menang melawan hal seperti ini, tidak mungkin.",Entertaiment,,
TIDAK MUNGKIN DEVS INI MENAMBAHKAN EFEK SUARA FUCKASS INI KE IDLE DIA,Entertaiment,,
Saya sangat ingin tahu berapa anggaran untuk setiap episodenya,Entertaiment,,
mau jadi anak bos tambang yang kalo pindahan mau ngekos gausah bw barag banyak karena tinggal beli disana aja meski lebih mahal jd litereli bawa baju aja,Economy,,
Semuanya keluar dari dunia ini. Aku membuat Anda bertanya-tanya,Entertaiment,,
"Berantemlah Bennix vs Reinald K  rakyat nonton saja. Bursa terkoreksi serius   nilai tukar Rupiah terus melepem. Saat ini jelas berbeda dengan tahun 1998 sebab andalan ekspor hanya SDA  utang BUMN sudah melonjaki ambang kebangkrutan.1998 BUMN 100% milik negara. Rupiah anjlok disebut âstrategiâ. Itu sama kayak orang kelaparan karena gak punya duit  tapi gengsi terus bilang: ""Gua lagi strategi diet ketat kok",Economy,,
Sayangnya  Indonesia memiliki Presiden yang sikapnya terkesan sulit menerima masukan dan kritik dari luar lingkarannya. Situasi perekonomian saat ini sudah mulai merah. Batasannya sangat tipis sebelum krisis terjadi. Presiden harus menyadari atau didesak Dari á¶â±á¶Ø§Ú¯ áµâ± á´°â±â¿áµâ±â¿áµ,Economy,,
Omong kosong belaka videoin biar narik pelanggan...huiii..preeetttt... dibohongin truz ya rakyat kecil padahal aslinya negara ini kaya raya dan tiap penduduknya bisa mendapat penghasilan 2jt/BLN  meskipun TDK kerja. Ini rezim busuk dan bau. Semua hanya omong kosong.,Economy,,
Di mana kita bisa menonton ini,Entertaiment,,
Apa Saja 5 Keunggulan Telkomsel 5G Powered by AI? Simak di Sini!,Technology,,
Tahun Depan  Indonesia Luncurkan Dua Satelit Buatan Anak Bangsa,Technology,,
Apakah itu film?,Entertaiment,,
Pemutih belum keluar,Entertaiment,,
Twitter benar-benar memberi tahu saya bahwa game ini adalah game mid-slop yang tidak boleh saya mainkan dan itu sangat menyenangkan & keren,Entertaiment,,
Senang melihat tren 'postingan samar' masih hidup dan sehat.,Entertaiment,,
Apa yang kami sebut genre karakter ini,Entertaiment,,
Apa acaranya?,Entertaiment,,
dia benar-benar menjadi ibunya.,Entertaiment,,
Dimana kita bisa nonton anime donghua di website atau channel telegram mana saja,Entertaiment,,
Spesifikasi Garmin Forerunner 70 dan 170  Buat Pelari Pemula,Technology,,
"Sialan! Ya, aku akan menonton ini",Entertaiment,,
Ayo ambil!!! Tidak sabar menunggu cerita si Bodoh.,Entertaiment,,
Teh! Eh kok jumlahnya sama,Entertaiment,,
SAYA HIPERVENTILASI DENGAN HYPE,Entertaiment,,
5G Bukan Lagi Teknologi 'Orang IT'  Kini Dekat dengan Aktivitas Harian,Technology,,
"Kepala Studio Ufotable telah membuat pernyataan berani yang mengatakan ""Ai tidak akan pernah bisa menciptakan kembali apa yang kita lakukan"".",Entertaiment,,
"Lucu sekali bagaimana semua orang memposting hal-hal seperti ""ini adalah episode atau acara terbaik"" atau apa pun itu. Kemudian semua orang setuju tetapi tidak ada yang menyebutkan pertunjukan sebenarnya.",Entertaiment,,
Film (serial) jenis apa?,Entertaiment,,
Saya sangat setuju! Visualnya sungguh menakjubkan!,Entertaiment,,
Kompilasi video kecepatan 4x dari sesi gacha 480 tarikan ini akan saya simpan sebagai kenang-kenangan untuk diri saya sendiri.,Entertaiment,,
Sangkar Ling bagus,Entertaiment,,
Pemberitahuan Pembakaran?,Entertaiment,,
Film sinematik,Entertaiment,,
jelaskan ini?,Entertaiment,,
WhatsApp Web Down   Malah Muncul Facebook Bikin Netizen Heboh,Technology,,
Jamin Prediksi Cuaca Makin Akurat di Indonesia  Ini Sumber Data BRIN,Technology,,
Udah diganti sama AI flop kayak gini soalnya,Entertaiment,,
Aduh! SEKALI LAGI SENDER MEMOHON KURO UNTUK MENGEMBALIKAN STRINGMASTER AAAAAAA SENDER BUTUH STRINGMASTER ARHAKJSHKD,Entertaiment,,
Ya tolong jangan tambahkan judul film/acara,Entertaiment,,
Ryuk terlalu OP hahahahahahahaha,Entertaiment,,
Kami sedang membangun Pangkalan Bulan!,Entertaiment,,
Anime apa.,Entertaiment,,
ini game atau film?,Entertaiment,,
Urusan Foto Deepfake Lingerie yang Ditanggapi Santai PM Italia,Technology,,
Bitcoin Senilai Rp 6 4 Miliar Selamat Berkat AI Claude,Technology,,
Apakah kalian siap untuk apa yang akan datang??!! Sampai jumpa di COMPUTEX 2026!!,Technology,,
"Oooo aku menontonnya, PEAK show.. Aku baru di ep 3 tapi aku terkunci!",Entertaiment,,
"Astaga, berita ini membuatku marah. Mereka melewatkan sebagian besar musim 1 dan sekarang mereka membuat episode khusus seolah memperbaiki segalanya? Mustahil. Animasinya terlihat murahan dan ceritanya terasa terburu-buru. Buku LOTM jauh lebih baik. Ini hanya perampasan uang tunai untuk penggemar. Saya tidak menontonnya.",Entertaiment,,
Xiaomi 17T Series Dipastikan Rilis Akhir Mei  Speknya Gahar,Technology,,
Apple Bocorkan Agenda WWDC 2026   Ada Gebrakan AI Baru?,Technology,,
Di mana saya bisa menontonnya,Entertaiment,,
Keadilan untuk Kapten Dunn!,Entertaiment,,
Bro tidak hanya menghindari serangannyaâ¦ dia juga menghindari percikan darah,Entertaiment,,
"Saya benar-benar tidak dapat mengetahui nama filmnya hanya dengan melihatnya, tetapi sinematografinya sangat mengesankan",Entertaiment,,
DJI Pamer Osmo Pocket 4P di Festival Film Cannes,Technology,,
Normalisasikan penyebutan nama acara di postingan. Umpan sialan,Entertaiment,,
"Sutradara 'Re:Zero' Masaharu Watanabe baru-baru ini mengatakan bahwa Episode Tersulit yang dia kerjakan adalah EP 15 yang mengklarifikasi bahwa dia menghabiskan begitu banyak waktu untuk fokus pada cara menggambarkan ""kegilaan"".",Entertaiment,,
Apple Ingin Ganti Aluminium iPhone Pro  Pakai Titanium Lagi?,Technology,,
Ling sangkar favoritku,Entertaiment,,
Dengan kecepatan yang sama dengan pesawatâ¦,Entertaiment,,
Ngeri! Dua Jet Tempur Angkatan Laut AS Bertabrakan di Udara,Technology,,
Animasi tahun 2026. Berapa umurmu nak?,Entertaiment,,
Fundamental perekonomian Indonesia saat ini jauh lebih kuat dibandingkan krisis-krisis sebelumnya. Dengan cadangan devisa yang memadai dan inflasi yang terkendali  pemerintah dan Bank Indonesia memiliki instrumen yang memadai untuk menjaga stabilitas pasar.,Economy,,
Isekai Tingkat Atas akan hadir kembali pada Juli 2026,Entertaiment,,
Fundamentalnya masih terlihat kuat  meski rapuh. Bila belanja pemerintah dinormalkan  maka pertumbuhan Q1 masih di 4 86%. Belum resesif  apalagi 2 kuartal. Masih surplus exim,Economy,,
Tidak ada kata-kata untuk memberi kami judul sialan itu juga,Entertaiment,,
Kritik yang disampaikan sejalan dengan situasi perekonomian Indonesia saat ini.,Economy,,
TUHAN MISTERI,Entertaiment,,
Honor Janjikan Harga X7d Bakal Stabil,Technology,,
Spotify Rilis Party of the Year(s)  Fitur Ala Wrapped untuk Kilas Balik dari Awal,Technology,,
Kejutan 50 bps kenaikan suku bunga menandakan kecenderungan hawkish terhadap pertahanan mata uang,Economy,,
663 Saham Anjlok ke Level Terendah IHSG Ditutup Turun 3 54 Persen ke 6.094,Economy,,
Saat ini Indonesia sedang mengalami KEJADIAN EKONOMI  dan para pemimpinnya dengan percaya diri mengutarakan OPTIMISME PALSU. Maksudku  ayolahâ¦,Economy,,
5 Alasan iPhone 17e Rp 13 Jutaan Layak Dibeli Tahun Ini,Technology,,
AI Kamera Sony Xperia 1 VIII Jadi Bahan Meme Kocak Netizen,Technology,,
dia benar-benar menjadi ibunya.,Entertaiment,,
di mana saya bisa menonton acara ini,Entertaiment,,
"Percayalah, ini pertunjukan puncak. Baca novelnya puncak banget",Entertaiment,, 
Selamat pagi warga negara Indonesia. Bangun tidur lalu mengecek berita: - Harga bahan bakar naik - RUU Polri telah disahkan - Rupiah melemah Siapkan dana darurat dan kurangi pengeluaran impulsif teman-teman. Situasi mungkin akan semakin memburuk di kemudian hari.,Economy,,
Bandingkan dengan Indonesia: Pertumbuhan kita hanya ilusi karena didorong oleh belanja pemerintah (APBN) dan bukan ekspor manufaktur. Ketika Rupiah melemah hingga Rp17.700  kita akan segera menghadapi pendarahan fiskal karena industri dalam negeri sangat bergantung pada bahan baku impor.,Economy,,
Tak sabar menunggu,Entertaiment,,
bro akhirnya nonton. musim 2 terutama menjadi kelas atas yang gila,Entertaiment,,
"Sebagai pemula yang lebih mengutamakan karakter daripada senjata, memang menyenangkan. Saya suka perjudian dan kejutan",Entertaiment,,
Bandar Antariksa Biak Diklaim Lebih Strategis dari Cape Canaveral,Technology,,
IHSG melemah di tengah masih tingginya tekanan di pasar global. Ketidakpastian perekonomian global  ketegangan geopolitik  dan arah suku bunga global telah menyebabkan banyak investor mengambil pendekatan yang lebih hati-hati.,Economy,,
"Masahiro Itosugi, author di balik seri terkenal ini baru saja membagikan kabar kalau akun Google pribadinya resmi diterima permanen. Penyebabnya? Hanya karena dia bermaksud mengarsipkan file manga lamanya ke dalam Google Drive!",Entertaiment,,
Saya perlu menonton ulang season 1,Entertaiment,,
"Ya, Ling Cage benar-benar salah satu acara animasi fiksi ilmiah terbaik yang pernah dibuat.",Entertaiment,,
Apa acaranya?,Entertaiment,,
PERBANDINGAN SERANGAN BIAYA SANDRONE & NEUVI,Entertaiment,,
Belum lagi kenaikan suku bunganya. Saat IHSG sedang jelek Bank harus menaikkan suku bunga menjadi kurang lebih 5%. Sepanjang hidup kamu bekerja hanya untuk membayar cicilan berbunga ganda.,Economy,,
Akhir dari Episode 6 adalah hal paling emosional dan menyentuh yang pernah saya lihat selama bertahun-tahun. Pertunjukan ini benar-benar menetapkan standar baru bagi saya.,Entertaiment,,
"Hoyoverse benar-benar memberi kami konsep paling keren untuk pertarungan Pulonia, pukulan jarak dekat, rudal pelacak, dan sinar laser, hanya untuk menghapusnya",Entertaiment,,
Banyak yang mengira streaming ilegal lewat Telegram lebih aman dibanding website. Padahal  keduanya tetap punya risiko yang nggak bisa dianggap sepele.,Technology,,
"Saya akan menontonnya dari awal lagi, saya membatalkannya setelah episode 3. Saya suka menonton pesta.",Entertaiment,,
Seorang pemain CN menata ulang Himeko Nova dengan desain Vermilion Knight,Entertaiment,,
Penguasa misteri??,Entertaiment,,
Sony Xperia 1 VIII Meluncur  Bawa Desain Baru dan Kamera AI,Technology,,
"Pertama Najwa bertanya kepada Prabowo ""Bagaimana Anda akan menangani korupsi jika terpilih sebagai presiden?"" Kemudian Prabowo menjawab ""Saya akan menaikkan gaji para pejabat karena para pejabat yang korup melakukannya karena gaji mereka terlalu rendah."" Dari situ saya berpikir ohh ada yang salah dengan orang ini. Dia dan para pemilihnya memiliki logika yang tidak masuk akal.",Economy,,
Pastinya salah satu donghua terbaik yang pernah saya tonton dengan senang hati. Puncak Mutlak.,Entertaiment,,
"Pastinya tonton dalam bahasa Inggris, saya orang Tionghoa dan membuat saya pusing menonton pidato bahasa Mandarin dan subtitle bahasa Inggris. Hanya di episode 1 animasinya cukup menegangkan untuk ditonton terlalu kacau dan penggunaan pencahayaan yang buruk...dll. Saya akan menonton lagi untuk melihat apakah menjadi lebih baik.",Entertaiment,,
Pertumbuhan ekonomi secara luas dianggap dangkal  sebagian besar didorong oleh belanja sosial dan konsumsi musiman dibandingkan dengan investasi padat modal. Akibatnya  perekonomian tidak memiliki jangkar yang cukup kuat untuk menahan meningkatnya spekulasi valuta asing.,Economy,,
â Menteri Keuangan (Menkeu) Purbaya Yudhi Sadewa mengadu ke Presiden Prabowo Subianto. Bahwa ada ekonom yang aneh-aneh ngomong mau resesif. Padahal menurut dia  kondisi ekonomi nasional kita di atas rata-rata global,Economy,,
"Saat ini perekonomian kita masih tumbuh positif sebesar 5 61% dan inflasi sangat terkendali sebesar 2 41%. Daya beli kita di akar rumput masih terjaga. ""Dompet"" Negara Jauh  Tahun '98  Bank Indonesia Mundur Karena Devisa",Economy,,
Apakah acara ini memiliki versi sulih suara bahasa Inggris,Entertaiment,,
Penguasa misteri kan?,Entertaiment,,
Anime apa?,Entertaiment,,
Tak disangka seorang pengembara bisa melakukan hal seperti ini...,Entertaiment,,
Melemahnya IHSG menjadi bagian dari dinamika pasar global yang masih diwarnai ketidakpastian. Investor cenderung mengambil langkah hati-hati di tengah berbagai faktor eksternal seperti perlambatan ekonomi global dan volatilitas pasar internasional. Situasi ini menunjukkan,Economy,,
Profesor Ryuk telah menjadi karakter terkuat.,Entertaiment,,
Ohh jadi kita mendapatkan season 2 secepat ini?,Entertaiment,,
Visualnya luar biasa,Entertaiment,,
"Tentu saja, jangan mencantumkan nama di judulnya jadi orang HARUS mengklik postingan untuk bertani pertunangan....sialan",Entertaiment,,
Teknologi Pelacak Bus Haji Pantau Jemaah Indonesia 24 Jam,Technology,,
Akhir cerita terbaru Wuthering Waves,Entertaiment,,
SAP Autonomous Enterprise: Kolaborasi Manusia dan Agen AI di Dunia Bisnis,Technology,,
Sumpah muak bgt liat kelakuan presiden dan kabinetnya   dpr ga guno pisan  Market remuk   apa apa naik   sumpah serapah dari 283 juta penduduk indo buat pemerintahan saat ini.,Economy,,
Linknet Garap CCTV Berbasis AI di Kawasan Industri EJIP,Technology,,
Hoax dan Deepfake Jadi Ancaman Baru Ketahanan Nasional,Technology,,
Saya sebenarnya membuat kentang goreng dari trailer Denia,Entertaiment,,
Indonesia di ambang krisis ekonomi akibat kebijakan sembrono Pemerintahan Prabowo di ambang kebangkrutan. Namun situasi ini tetap tidak membuat Prabowo menyadari kesalahannya,Economy,,
Ini animasi yang luar biasa?,Entertaiment,,
"Pengungkapan wajah terbesar sepanjang masa, secara harfiah tidak tahu apakah itu karena rasa takut atau kasihan",Entertaiment,,
APINDO optimis tumbuh sampai 5 0.04  yuk sambut masa depan cerah!,Economy,,
YOOOO AKU PERASAAN INI ADALAH LING CAGE,Entertaiment,,
âPertumbuhan kuartal I-2026 menembus 5 61%!â Di atas kertas  angka ini adalah sinyal optimisme. Tapi di dunia nyata  jutaan kelas menengah justru harus menghitung ulang isi dompet mereka setiap pagi.,Economy,,
Video Samsung Tanggapi Gugatan Dua Lipa Senilai Rp263 Miliar,Technology,,
Purbaya Yudhi Sadewa menilai kritik The Economist harus dilihat secara objektif. Indonesia disebut masih memiliki ketahanan ekonomi yang kuat  pasar domestik yang besar  dan peluang pertumbuhan yang menjanjikan dibandingkan banyak negara Eropa.,Economy,,
dalam game cutscene menjadi lebih baik setiap patch saya sangat suka betapa ekspresifnya karakter akhir-akhir ini,Entertaiment,,
Semua karakter KV dari Kimetsu terinspirasi oleh sampul manga,Entertaiment,,
Gak sabar nunggu mahn Episode Spesialnya..,Entertaiment,,
Apakah ini seperti cerita linier atau setiap episodenya berbeda-beda seperti di Black Mirror,Entertaiment,,
The Boys resmi berakhir setelah 7 tahun.,Entertaiment,,
"Video musik Dungeon Fighter Online ""Pilih Racun Anda"".",Entertaiment,,
Apakah ini animenya??,Entertaiment,,
Pertunjukan apa ini,Entertaiment,,
Coba tonton dalam dubbing bahasa Inggris,Entertaiment,,
Yo anime apa ini?,Entertaiment,,
Cobalah cerita tentang menggiring dewa setelahnya. Tim animasi menjadi gila,Entertaiment,,
3.4 Paket baru: Pilihan Karakter / Paket Rantai Resonansi,Entertaiment,,
Tidak tertarik sampai jap dub.,Entertaiment,,
Kok bisa dia Segede ini,Entertaiment,,
TEMAN-TEMAN... SAYA BARU TAHU,Entertaiment,,
Pertunjukan yang mana itu!?????,Entertaiment,,
KRIMINAL DIREMEHKAN adalah istilah yang saya gunakan saat mendeskripsikan pertunjukan! Ini PUNCAK! Bioskop murni!,Entertaiment,,
Gambar terlihat bagus,Entertaiment,,
Penguasa Misteri,Entertaiment,,
Kata Siapa Minyak Bumi dari Fosil Dino  Ilmuwan Tak Bilang Begitu,Technology,,
Jika saat ini 95% orang percaya kinerja pemerintah jelek melihat rupiah yg terus menerus melemah  maka dr 5% nya ada gw yang percaya presiden sedang berjuang mempertahankan kedaulatan negara. Jika melihat pola yang terstruktur  sistematis dan masif tentu bisa,Economy,,
Bukankah season 2 hanya keluar pada tahun 2027?,Entertaiment,,
Pameran Ekosistem NVIDIA AI Factory MGX di #COMPUTEX2026 memiliki jawabannya.,Technology,,
Seri apa ini?,Entertaiment,,
Pertunjukan tingkat atas,Entertaiment,,
Senjata Laser Makin Menjamur di Timur Tengah  Ini Alasannya,Technology,,
Membantah pengamat yg sarat pesan sponsor yg mengatakan akan tamat jika nilai tukar rupiah jatuh ke 22 rb dan harga minyak dunia tembus 200 USD per barel Krn belum pada level resesi apalagi krisis,Economy,,
Bisakah kita berbicara tentang seni percikan karakter standar???Wuwa tidak pernah melewatkan bruh.,Entertaiment,,
Menteri Koordinator (Menko) Bidang Perekonomian Airlangga Hartarto mengungkapkan pemerintah tengah mematangkan berbagai aturan jelang pemberlakuan kebijakan Devisa Hasil Ekspor (DHE) yang mulai berlaku pada 1 Juni 2026.,Economy,,
"Nemu bapak ini di fesnuk lagi menjual soft copy materi pembelajaran bahasa Jepang yang beliau susun. Aseli nyata guru bahasa Jepang, karena beliau membuka les juga. Siapa pun yang butuh kontak tau, bisa langsung bapaknya atau mampir ke fesnuknya beliau",Entertaiment,,
15 Studio Anime Teratas & Animenya yang Paling Kontroversial / Dilarang,Entertaiment,,
Dasco datang  IHSG tumbang. Apakah itu dalangnya? Berhenti. Ini cocoklogi kelas penerimaan. Fakta waktu Rombongan Dasco dan Danantara baru tiba di BEI jam 10.27 WIB. Sementara IHSG sudah ambrol ke 6.565 sejak pasar buka. Biang keroknya jelas: - Rebalancing MSCI & FTSE coret belasan,Economy,,
yup tidak ada jalan keluarnya  perekonomian indonesia sudah rapuh dan hampir kolaps. mereka terlalu optimis  ketika itu runtuh!,Economy,,
Penguasa Misteri,Entertaiment,,
Pembacaan situasi perekonomian mengenai bahaya tekanan fiskal dan semakin sempitnya ruang gerak negara telah divalidasi oleh analisis majalah terkemuka Inggris  The Economist. Outlet media tersebut memperingatkan pembelanjaan yang terlalu agresif,Economy,,
Nama dan di mana saya bisa menonton donghua dalam kualitas tinggi.,Entertaiment,,
"Buat yg ngumpulin coral mungkin di pullnya di situ, kalo aku tetep di wp std si biar r5 eog sama static mist.",Entertaiment,,
Presiden Prabowo Subianto menyoroti global. Menurut Prabowo di tengah kebijakan tarif dari Presiden AS Donald Trump kepada banyak negara membuat,Economy,,
Anda pernah ke Blackreach?,Entertaiment,,
"sejumlah teman yang nonton naruto juga pernah menyebut desa kelahiranku di magelang ini sebagai negeri kirigakure. kalau pas musim hujan, kabut tebal gini bisa bertahan seharian. suhu pagi 14 derajat, malam kira-kira 20 derajat.",Entertaiment,,
â¢ Perekonomian kita buruk â¢ Daya beli menurun â¢ Rupiah anjlok â¢ Utang menumpuk â¢ Pengangguran merajalela â¢ Korupsi merajalela â¢ Kemiskinan terus menurun (turun ke cucu!) â¢ Investor lari,Economy,,
Apa itu dan di mana saya bisa menontonnya,Entertaiment,,
âsetiap episode terasa sinematikâ sementara Hollywood menghabiskan anggaran 4x lipatnya untuk membuat sampah,Entertaiment,,
"Sah, acara ini tidak mendapat cukup sensasi.",Entertaiment,,
Kesimpulannya  perekonomian Indonesia belum tentu memasuki krisis  namun jelas memasuki fase hati-hati. Pemerintah melihat fundamental makroekonomi tetap kuat. Namun  pasar dan beberapa ekonom membaca sinyal bahaya dari rupiah,Economy,,
Setiap frame tampak seperti milik layar bioskop. Visualnya tidak nyata.,Entertaiment,,
Ada apa dengan perekonomian Indonesia? Apakah hanya di Indonesia yang perekonomiannya seperti ini? Atau global juga  semua orang mengalaminya? Saya sedang mengalami penurunan omzet ekonomi separah ini. Setiap kali saya pergi ke mana pun  saya mendengar orang mengeluh tentang hal yang sama dengan,Economy,,
WIT STUDIO DIMASAK DENGAN ANIMASI INI.,Entertaiment,,
Visual! .. Animasi..,Entertaiment,,
Meta Latih AI Pakai Gerak-gerik Karyawan  Bikin Suasana Tak Nyaman,Technology,,
Dimana untuk menonton??,Entertaiment,,
Ketika orang IT dari perusahaan datang untuk memperbaiki satu baris di layar Anda.,Entertaiment,,
Show Bangun Platform Film Berbasis Kripto dan AI,Technology,,
"Benar-benar sinematik!  Kualitas animasi Ling Cage berada pada level lain â setiap episode terasa seperti film blockbuster fiksi ilmiah Hollywood yang lengkap. Visualnya, pencahayaannya, pembangunan dunia... Donghua Tiongkok sedang makan saat ini.",Entertaiment,,
âoh lagunya mungkin akan lembut dan sedihâ,Entertaiment,,
Nama Donghua,Entertaiment,,
Donghua adalah yang terbaik,Entertaiment,,
doa terbaik untuk perekonomian Indonesia semoga ada yang bisa mengambil tindakan dan menyelamatkan keadaan,Economy,,
Ling Cage (2019) Seri Lengkap | Tonton Daring | Streaming Itu,Entertaiment,,
Kondisi Indonesia sangat bagus... Perekonomian tumbuh subur  pemerintah dengan kebijakannya menyerap jutaan lapangan kerja Program Presiden untuk modernisasi kapal penangkap ikan mampu menyerap 500.000 lapangan kerja. Ini baru sisi ini  bahkan belum mencetak sawah,Economy,,
Cristian Chivu Panen Pujian Usai Bawa Inter Milan Raih Double Winner,Technology,,
Masa depan yang berorientasi pada agen membutuhkan jenis komputasi baru,Technology,,
Seekor kucing yang terancam terjatuh dari atap stadion diselamatkan oleh bendera yang dikibarkan oleh para penggemar.,Entertaiment,,
Video: NVIDIA Luncurkan Tekonologi Baru Untuk Pengembangan AI,Technology,,
Jadwal MPL ID S17 Week 8: Dewa United Esports Vs Evos,Technology,,
Meski Purbaya sering mengklaim semuanya baik-baik saja  namun perekonomian Indonesia berada dalam mode bertahan.,Economy,,
Kondisi perekonomian Indonesia saat ini sangat kritis  banyak dari kondisi tersebut yang dipoles dan ditutup-tutupi oleh buzzer pemerintah yang menggunakan argumen dan informasi yang membuat segalanya tampak baik-baik saja. Tujuannya untuk menenangkan situasi dan menghibur warga  namun jika,Economy,,
"Dan nama sialan itu, apakah aku hanya membayangkannya atau bagaimana?",Entertaiment,,
Kapan musim ke-2 datang?,Entertaiment,,
"Saya berharap rasa lapar yang menjalar akan terbelah di tengah, bukan di telapak tangan saya sendiri. Tapi secara keseluruhan saya senang dengan ini :3",Entertaiment,,
