Tweet,Category,,
Selamat pagi. Bangun tidur dan mendapati $1 sekarang setara dengan 18.100 rupiah. Pertamax naik dari Rp12.300 menjadi Rp16.250 dan 5kg beras dari Rp75.000 menjadi Rp90.000. Jika Anda tidak melihat ada yang salah dengan situasi Indonesia yang kacau saat ini Anda mungkin anak nepotisme atau orang-orang bodoh yang memilih O2.,Economy,,
"Saat Anda berbicara tentang sebuah serial, sebutkan namanya",Entertaiment,,
Bisnis apa yang aman untuk dimulai ketika perekonomian Indonesia sedang terpuruk seperti saat ini? Apakah toko permen masih bisa bertahan? Karena orang tua saya mempunyai toko permen kecil  saya ingin meminjam ke bank untuk memperluas toko permen orang tua saya untuk membantu perekonomian keluarga kami.,Economy,,
Meski Purbaya kerap mengklaim keadaan baik-baik saja  namun perekonomian Indonesia sudah memasuki mode bertahan hidup. Maksudnya itu apa?,Economy,,
Dia tertipu trik tertua dan diculik,Entertaiment,,
Patch resmi Wuthering Waves 3.5: Para suster akhirnya bersatu kembali!,Entertaiment,,
"Ini jelas bukan misi segue, ini terasa seperti misi cerita utama 10/10 setara dengan 2.6, 3.1, dan 3.3",Entertaiment,,
masalahnya  dosanya selama 32 tahun itu dampaknya masih diwariskan sampai kini: budaya KKN yg gabisa ilang  orang2 kaya warisan zaman soeharto sampai skrg masih terus mengeruk kekayaan lewat tambang2  dll,Economy,,
"Sangkar Ling luar biasa! Donghua lebih unggul dari anime dan saya suka anime. Anda tidak dapat membandingkan animasi, tempo, cerita, atau durasinya dengan apa pun di anime.  Ada beberapa 300+ episode anime tetapi mereka memiliki 100 pengisi yang jelek untuk mencapainya. One piece jelek jadi jangan mau mendengarnya!",Entertaiment,,
SALAH SATU PENYEBAB KEMISKINAN BUKAN KARENA KEKURANGAN REZEKI TAPI KARENA KEBANYAKAN UTANG. kita sering salah menyalahkan seperti gaji kecil sulit hidup tidak adil. padahal tanpa sadar sebagian besar rezeki yang datang sudah habis bahkan sebelum sempat,Economy,,
Saatnya melihat Penguasa Misteri,Entertaiment,,
"Trailernya besok, gaang!",Entertaiment,,
Google Search Berubah Total Setelah 25 Tahun  AI Kini Ambil Alih,Technology,,
Kupikir ini Diablo sebentar - terlihat sangat menarik,Entertaiment,,
Di mana saya bisa menontonnya?,Entertaiment,,
PERTUMBUHAN 5 6% TAPI RUPIAH & IHSG TERBURUK: PARADOKS EKONOMI INDONESIA? Pemerintah senang memamerkan pertumbuhan PDB kuartal pertama tahun 2026 sebesar 5 61% tahun-ke-tahun  melampaui Jepang dan Eropa  ditambah ekspor yang naik tipis 0,Economy,,
Telah menyebarkan cinta untuk serial ini selama beberapa bulan. Saya menontonnya 3 kali berturut-turut. Ini sangat bagus.,Entertaiment,,
Selamat ulang tahun Denia,Entertaiment,,
"Pedang juga merupakan sinematografi yang epik, lihatlah secepatnya!",Entertaiment,,
Dia melipat begitu keras sehingga seluruh fandom merasakan sakit yang tidak dirasakan.,Entertaiment,,
Di mana saya bisa menontonnya?,Entertaiment,,
apa hubungannya dengan gambar tersebut?,Entertaiment,,
"Pada versi 6.5.50, Manajer Login akun Nintendo Switch telah ditambahkan ke game, setidaknya secara internal",Entertaiment,,
Punya presiden halu bikin sengsara rakyatnya gara2 MBG negara harus efesiensi yg berakibat ASN nakes kayak kita2 yg gaji gk seberapa tapi kerja gk kenal tanggal merah terancam di stop tukin nya. Hidup 1 bulan cuma dngn modal gaji 3 jtan + udah punya anak bener2 survival ini mah,Economy,,
Perebutan 'Kue' Internet Satelit RI Memanas  PSN Tantang Starlink,Technology,,
The Economist baru saja menulis sesuatu yang jarang mereka lakukan mengenai negara berkembang. Mereka menulis briefing bukan sekadar artikel biasa. Judulnya: Presiden Indonesia Membahayakan Perekonomian dan Demokrasi. Dan setelah membaca semuanya sulit untuk membantahnya.,Economy,,
film Cina?,Entertaiment,,
"LIHAT FAKTA Video Anies Baswedan tentang Situasi Terkini di Indonesia ""Rupiah telah jatuh ke titik terendah sepanjang sejarah. Harga-harga meningkat  kesempatan kerja semakin menyempit  daya beli rumah tangga melemah  tabungan terkikis. Dan ini berdampak pada penghidupan masyarakat",Economy,,
EPISODE TAHUN INI?,Entertaiment,,
Hanya Tartaglia yang membidik Raiden Shogun.,Entertaiment,,
dalam game cutscene menjadi lebih baik setiap patch saya sangat suka betapa ekspresifnya karakter akhir-akhir ini,Entertaiment,,
"Saya benar-benar belum pernah melihat pertunjukan ini sebelumnya, hanya melihatnya seperti trailer sejak lama, jadi saya tidak tahu bagaimana saya langsung tahu itu adalah Lord of Mysteries.",Entertaiment,,
Ayah bilang rasio utang Indonesia 40%  paling disiplin di ASEAN Pak  rasio utang yang rendah itu bagus  tapi itu bukan satu-satunya tolak ukur kesehatan perekonomian. Rupiah di Rp17.700 terendah sepanjang masa  IHSG turun 30% dari ATH-nya,Economy,,
MANDIRI DI BULAN RAMADAN BAZNAS DAN AKSESMU PERKUAT UMKM ZMART Zmart telah membantu banyak warung UMKM di untuk lebih berdaya dan stabil secara . Semoga di,Economy,,
CEO Qualcomm Cristiano Amon berbagi bagaimana AI akan mengubah masa depan otomotif di Computex 2026.,Technology,,
Xi Jinping Janjikan 'Karpet Merah' Bagi Raksasa Teknologi AS,Technology,,
bagian ini?? halo kuro??? Saya tidak bisa berkata-kata.,Entertaiment,,
Media internasional kembali menyoroti keadaan Indonesia di bawah pemerintahan Prabowo. The Economist menilai Indonesia berada pada jalur yang berisiko  baik secara ekonomi maupun demokrasi. Melemahnya rupiah  kebijakan belanja negara dinilai terlalu agresif.,Economy,,
global sarat tidak pasti  namun dapat mewujudkan ketahanan dengan fondasi yang solid. Faktor penentunya: pemerataan  UMKM maju  & gotong royong. STRATEGI,Economy,,
Harga MacBook Neo di RI Mulai Rp 10 749 Juta,Technology,,
The Economist yang mengungkap belanja pemerintah Indonesia yang tidak masuk akal tidak boleh diabaikan hanya karena mereka didukung oleh borjuis. Faktanya adalah investasi asing tidak lagi percaya pada perekonomian dan pemerintah tidak melakukan pengendalian kerusakan.,Economy,,
Narasi bahwa daya beli masyarakat melemah ternyata tidak sepenuhnya sesuai fakta. Di tengah kritik Anies Baswedan terhadap pemerintah  data BPS justru mencatat konsumsi rumah tangga tumbuh 5 56%. Ini menunjukkan aktivitas masyarakat masih bergerak positif dan menjadi,Economy,,
Saya masih tidak percaya kami memiliki karakter yang dapat dimainkan dengan kualitas dan kebebasan seperti itu dan hal ini belum menjadi lebih baik,Entertaiment,,
"KSJDKSJDKJS Saya terhipnotis di depan adegan ini, betapa baiknya penanganan airnyaâkonyol sekali",Entertaiment,,
Di media cuman memberitakan perekonomiannya maju pesat  pendapatan negara semakin membesar dibandingkan tahunÂ² sebelumnya  TAPI DIBALIK ITU ANGGARAN BELANJA NEGARA JAUH LEBIH BESAR DIBANDINGKAN PENDAPATAN NEGARA.,Economy,,
Wujud Honor X6c  HP Rp 2 Jutaan Bawa Baterai Besar,Technology,,
Acara Web,Entertaiment,,
Prosesor Masa Depan Diprediksi Punya 512 Core,Technology,,
Bro dimana nonton acara ini,Entertaiment,,
semoga algo menghukum semua poster yang tidak jelas,Entertaiment,,
Kudengar musim 3 akan segera hadir,Entertaiment,,
jadi berapa banyak permen karet yang kamu konsumsi hari ini?,Entertaiment,,
Mengapa rencana Indonesia untuk mempertahankan ekspor komoditas terbesarnya membuat dunia usaha dan investor terguncang,Economy,,
Heboh! Donald Trump Posting Foto Bareng Alien  AI atau Nyata?,Technology,,
Ramalan Teknologi Zaman Dulu Ini Bikin Tercengang,Technology,,
Fitur Baru HP Samsung Bisa Blokir Aplikasi yang Spam Notifikasi Iklan,Technology,,
Talenta Digital ASEAN Bersaing Sengit di 10th Huawei ICT Competition,Technology,,
Apa judul film ini? Mengapa ada lingkaran Dr. Strange?,Entertaiment,,
Dr aneh melakukannya lagi,Entertaiment,,
âoh lagunya mungkin akan lembut dan sedihâ,Entertaiment,,
Saya tidak sabar menunggu penguasa misteri,Entertaiment,,
air kotor Cina,Entertaiment,,
HBO Max Indonesia  Disney Hotstar Indonesia  dan Netflix Indonesia harus lebih peka terhadap situasi perekonomian Indonesia saat ini. Dengan membuat paket berlangganan mingguan. CC:,Economy,,
Di tengah membanjirnya informasi dan kegelisahan global  ada satu ukuran ekonomi yang sering diabaikan: apakah masyarakat awam masih mampu untuk hidup layak? Karena inti stabilitas ekonomi terlihat ketika petani masih mampu membeli pupuk  maka nelayan masih bisa keluar,Economy,,
"Anggaran produksi untuk setiap episode adalah sekitar $1,4 Juta",Entertaiment,,
Liburan Panjang  Puas-puasin Movie Marathon Harga Hemat,Technology,,
Jajaran PlayStation State of Play 2026 bocor,Entertaiment,,
Dia benar-benar menipu si penipu,Entertaiment,,
Ohh jadi kita mendapatkan season 2 secepat ini?,Entertaiment,,
Seorang YouTuber Jepang menjadi viral setelah menghabiskan tiga tahun melakukan latihan One Punch Man yang terkenal dari Saitama setiap hari,Entertaiment,,
// 3.3 spoiler segue,Entertaiment,,
Adegan yang satu ini saja sudah bisa memenangkan Oscar.,Entertaiment,,
Pria Ini Rakit Komputer Setipis Kartu Kredit  Tebalnya Cuma 1 mm,Technology,,
Sebelum asal klik link atau download file  coba pahami dulu bedanya di visual berikut ini!,Technology,,
bayangkan jika setiap serial animasi meningkatkan standar seperti ini,Entertaiment,,
Gada!!!yg Ada indon tambah bobrok  punya tambang tapi di kelola ama dinasti oligarki  punya banyak partai tapi di isi oligarki culas yg kerjanya nyari proyek. Sistem demokrasi yg di agung2kan oleh pejuang reformasi gada  yg Ada sekrng jadi negara bergntung pada pajak,Economy,,
Apakah kamu suka ikan salmon?,Entertaiment,,
Ditanya kenapa sih IHSG bisa anjlok  begini singkatnya penjelasannya  namun bila update data terakhir  tak tambahin anjlok karena pidato presiden yang akan membentuk badan baru  badan Ekspor,Economy,,
Materi Kenaikan Lucy dan Rebecca,Entertaiment,,
kalian semua apa dialognya jika Anda memilih untuk tidak meletakkan kuenya,Entertaiment,,
Guys  Yanuar Rizky memberikan analogi yang menurut saya paling hits dan terasa paling relevan dengan situasi perekonomian Indonesia saat ini. Katanya pemerintah saat ini punya banyak gaya meski bangkrut dan egonya meroket. Dan analoginya super,Economy,,
VaguepostÂ®,Entertaiment,,
Itu sangat berharga,Entertaiment,,
Sejauh ini  situasi perang menunjukkan tanda-tanda bisa diselesaikan. Namun ketegangan juga muncul di tempat lain. Meski begitu  ia optimistis kondisi perekonomian Indonesia dalam kondisi baik.,Economy,,
"Maksudku, aku tidak tahu tentang episode tahun ini. Cukup yakin akhir dari rezero, atau akhir dari kursus 1 MT akan berlangsung jika bukan episode topi penyihir.",Entertaiment,,
Syarat Berat Gemini Intelligence: RAM 12GB dan Chip Flagship,Technology,,
EP1 sub bahasa Inggris,Entertaiment,,
Bro percayalah pada seluruh dunia,Entertaiment,,
TIDAK MUNGKIN DEVS INI MENAMBAHKAN EFEK SUARA FUCKASS INI KE IDLE DIA,Entertaiment,,
Lowkey menggugat Hoyoverse karena saya membuat oc ini pada tahun 2023 dan sepertinya 75% dari segala sesuatu tentangnya benar-benar sama dengan Sandrone yang dapat dimainkan,Entertaiment,,
Rupiah melemah  IHSG anjlok  dan pasar keuangan Indonesia tertekan. Meski demikian  pemerintah menyatakan fundamental perekonomian masih baik karena pertumbuhan ekonomi mencapai 5 61%. Lantas,Economy,,
"saus ASLI adalah satu potong, selamat datang para pencari saus.",Entertaiment,,
Bisakah kita berbicara tentang seni percikan karakter standar???Wuwa tidak pernah melewatkan bruh.,Entertaiment,,
aduh! ayo sedih bareng sender pagi-pagi..,Entertaiment,,
Minat investor asing terhadap Indonesia tetap tinggi meskipun dunia sedang dilanda ketegangan geopolitik dan ketidakpastian perekonomian global. âTerlepas dari situasi saat ini  perang  geopolitik global  dan geoekonomi global  ternyata kepentingan dan kepentingan mereka,Economy,,
"""Lord of Mid"" adalah nama acaranya",Entertaiment,,
Mantan Bos Google Dicemooh Saat Sebut AI di Pidato Wisuda  Kenapa?,Technology,,
Unboxing MacBook Neo: Laptop Apple Rp 10 Jutaan Warna Citrus Bikin Kepincut,Technology,,
Ini bukan musim 2,Entertaiment,,
Mereka membuat Weeping Angels di Wuwa WTF,Entertaiment,,
Data Satelit Jadi Andalan Mitigasi Bencana  Telkomsat Gaet Nara Space Korsel,Technology,,
Luar biasa,Entertaiment,,
Pertumbuhan Indonesia tertahan di kisaran 5%. Bank Dunia dan IMF pesimistis. Reformasi terhenti  SDM buruk  infrastruktur di luar Jawa buruk  birokrasi korup  kualitas investasi rendah. Mau 8% dengan ICOR tinggi,Economy,,
Tidak menyebutkan nama acara tersebut pada tahun 2026 seharusnya merupakan pelanggaran yang dapat dilarang. Orang-orang benar-benar berpikir bahwa menjaga gerbang adalah sebuah mahakarya membuat mereka istimewa.,Entertaiment,,
Khususnya di Indo: â¢ Lowongan kerja menurun drastis dibandingkan beberapa tahun terakhir. â¢ Pekerjaan pemerintah berantakan total  hanya menghambur-hamburkan dana negara untuk sektor-sektor yang tidak penting  dan pada akhirnya merugikan rakyat kecil juga. â¢ Nilai tukar rupiah sudah super lemah,Economy,,
15 Studio Anime Teratas & Animenya yang Paling Kontroversial / Dilarang,Entertaiment,,
Salah satu pertunjukan terbaik yang pernah saya lihat dalam hidup saya. Tidak ada anime saat ini yang mendekati tingkat puncak seperti ini...,Entertaiment,,
Pertunjukan apa ini,Entertaiment,,
Cara BRIN Ramal Cuaca Dulu vs Sekarang  Bakal Makin Akurat,Technology,,
benar-benar salah satu poster drama terindah yang pernah saya lihat,Entertaiment,,
Singapura kini melampaui pasar saham terbesar di Asia Tenggara  untuk pertama kalinya dalam lebih dari satu dekade.__** Kapitalisasi pasar SGX mencapai $645 miliar  sementara IHSG turun menjadi $618 miliar. -Dari sini saja kita sudah tau kemana larinya IDR kita.,Economy,,
Masuk Gedung Diminta KTP dan Foto? Ternyata Ada Risiko Keamanan Siber,Technology,,
Jenius! RTX 3070 Disulap Jadi Pakai VRAM 16GB  Kanibal dari GPU AMD ,Technology,,
"Siapa yang mengira kalau acara penutupan ""Marapthon: The Last Tale"" akan membawa kejutan semewah ini?",Entertaiment,,
Kesehatan fiskal Indonesia kuat dan aman! Menteri Keuangan menepis kekhawatiran media asing mengenai stabilitas perekonomian nasional. Dengan rasio utang terhadap PDB yang dijaga ketat di kisaran 40%  kondisi keuangan kami terbukti jauh lebih kuat dan lebih baik.,Economy,,
Keadaan ekonomi saudara ini mewakili banyak lulusan sarjana di Indonesia. Banyak dari mereka yang telah susah payah menyelesaikan kuliah namun gagal mendapatkan pekerjaan yang sesuai  dan terpaksa melakukan pekerjaan apa pun hanya untuk memenuhi kebutuhan hidup. Tak jarang  banyak juga yang kesulitan melakukannya,Economy,,
Rencana pemerintah untuk membentuk BUMN Khusus Ekspor menimbulkan kekhawatiran akan dominasi negara yang berlebihan dalam sektor perdagangan internasional.,Economy,,
Instagram Luncurkan Fitur Instants  Apa Bedanya dengan Stories?,Technology,,
Memang benar bahwa segala sesuatunya harus berdasarkan skenario terburuk juga  dan pilihan untuk menanggung kondisi tersebut nampaknya cukup sulit untuk situasi saat ini  dimana perekonomian benar-benar berada pada level yang bahkan lebih buruk dibandingkan krisis moneter 25-30 tahun yang lalu. Semoga kita,Economy,,
"Read more: Amid the weakening rupiah and IHSG correction  Finance Minister Purbaya Yudhi Sadewa speaks out regarding concerns about a crisis like 1998. He emphasized that Indonesia's current economic condition is still in a state of growth. ""We're not in 8/14150791/purbaya-pastikan-kondisi-indonesia-berbeda-dengan-krisis-1998-meski-rupiah?utm_campaign=twitter_newsplay",Economy,,
Akibat dari rasa frustasi para pengusaha. Tanya pengusaha di Negeri Konoha  70% pasti billing pemerintah buruk di semua sektor  takut memulai usaha baru  bisa bertahan saja sudah berkah. Semua indeks ekonomi memburuk namun ditolak,Economy,,
MEREKA MENGHAPUS TITIK JALAN TELEPORT,Entertaiment,,
Saya sangat menentang gagasan ini. Game ini bukan Genshin Impact dan Fractsidus bukanlah kelompok penjahat seperti Fatui.,Entertaiment,,
Fitur Baru WhatsApp: Bisa Curhat dan Bahas Hal Rahasia ke Meta AI,Technology,,
Ini mungkin salah satu anime isekai yang paling diremehkan di luar sana,Entertaiment,,
"Dengan teks bahasa Inggris, itu adalah ""Mommy hold me.""",Entertaiment,,
"""tgl 10 Juni 2026"" ""jika dijumlahkan angkanya ini benar"" ""10 Juni. Juni adalah bulan ke-6 kan?"" ""jadi jika 10+6 =17"" DAN PENONTON BERTEPUK TANGAN",Economy,,
Visual! .. Animasi..,Entertaiment,,
Tolong nama animenya?,Entertaiment,,
TREMOOOORRRRRR MAKASIH BANYAK KUROOOOOO,Entertaiment,,
Tingkat sinkronisasi Oguri sangat tinggi,Entertaiment,,
TUNGGU ACARA SAYA KEMBALI????,Entertaiment,,
Bingkai ini meneriakkan Gambar A-1,Entertaiment,,
Tempat menonton,Entertaiment,,
Klarifikasi dulu fakta di balik ambruknya IHSG beberapa hari terakhir ini karena banyak pakar plagiarisme yang senang mengkambinghitamkan kunjungan Sufmi Dasco ke BEI. Jauh sebelum itu pasar sudah berada dalam tekanan berat. MSCI menghapus 6 orang WNI,Economy,,
Galaxy Z Flip8 Kabarnya Tak Punya Penerus  Jadi HP Flip Terakhir Samsung?,Technology,,
Sobat  gajian belum tiba  nanti kalau gajian  orang-orang masih keluar belanja  ke kedai kopi,Economy,,
Kayanya Purbaya OJK dan piranti keuangan negara harus mulai jujur ââpd rakyat ttg kondisi saat ini. Krn hanya pemerintah saja yg mengatakan,Economy,,
"Gaes kalian ada yang tau Fripside? Saranin laguÂ² mereka dong selain yg jadi ost anime black bullet, to aru kagaku dan owari no seraph. Makasihhh.",Entertaiment,,
"lah gua tuh pengguna ""tab"" ini. males belanja ke wp karena udah pada sign. lg semangat ngumpulin sequence char standar",Entertaiment,,
Menteri Keuangan Purbaya langsung terbang ke Amerika untuk meluruskan keadaan. Ternyata semua itu ulah para pengkhianat bangsa yang sengaja menyebarkan kabar buruk mengenai perekonomian Indonesia. Setelah mendengar klarifikasinya Bank Dunia akhirnya paham dan resmi,Economy,,
Pertarungan terakhir musim 2 sungguh keren!,Entertaiment,,
Ingin tahu lebih detail bagaimana Pak Habibie berhasil menghidupkan kembali perekonomian Indonesia di masa krisis + perjalanan karirnya? Anda dapat membaca buku biografinya. Harganya hanya setara dengan secangkir kopi di kafe,Economy,,
Digitalisasi UMKM Kian Masif  Koneksi Internet Stabil Jadi Andalan,Technology,,
Rotasi Tim Fusion Burst Aemeath :),Entertaiment,,
Kita ngomongin tentang pemutih tybw kan??,Entertaiment,,
Sayangnya  Indonesia memiliki Presiden yang sikapnya terkesan sulit menerima masukan dan kritik dari luar lingkarannya. Situasi perekonomian saat ini sudah mulai merah. Batasannya sangat tipis sebelum krisis terjadi. Presiden harus menyadari atau didesak á¶â±á¶Ø§Ú¯ áµâ± á´°â±â¿áµâ±â¿áµ,Economy,,
S2 hanyalah orang gila. Ini tingkat film barat yang sah. Saya pasti akan berada di sana untuk donghua YKHT di masa depan,Entertaiment,,
"TEMAN-TEMAN, AKU AKHIRNYA MENDAPATKAN DIA",Entertaiment,,
"Baca Juga: Di Tengah Pelemahan Rupiah dan Koreksi IHSG  Menteri Keuangan Purbaya Yudhi Sadewa angkat bicara terkait kekhawatiran krisis seperti tahun 1998. Ia menegaskan  kondisi perekonomian Indonesia saat ini masih dalam kondisi pertumbuhan. ""Kita tidak berada di 8/14150791/purbaya-pastikan-kondisi-indonesia-berbeda-dengan-krisis-1998-meski-rupiah?utm_campaign=twitter_newsplay",Economy,,
Jika Anda ingin mengetahui keadaan perekonomian sebenarnya  jangan melihat garis kopinya. Coba lihat ini:  Rupiah di Rp17.500 terlemah sepanjang sejarah  PMI Manufaktur Indonesia di bawah 50 artinya sektor produksi terkontraksi  PHK massal di sektor tekstil elektronik,Economy,,
Saya suka hal semacam ini.,Entertaiment,,
3 HP Ultra Terbaik 2026 Sudah Resmi di RI  Kamera dan AI Juara,Technology,,
Apakah kita seharusnya tahu acara apa ini.,Entertaiment,,
Dia tertipu trik tertua dan diculik,Entertaiment,,
Sam Altman Sebut Elon Musk Gila Kontrol  OpenAI Buktinya,Technology,,
Bocoran Galaxy Z Fold8 dan Fold Wide: Upgrade Baterai dan Kamera,Technology,,
Sejauh ini saya berada di volume 5 novel dan izinkan saya memberi tahu bahwa musim 2 akan menjadi musim terbaik,Entertaiment,,
Teknik pengecatan kulit terungkap,Entertaiment,,
Banyak yang baru sadar setelah kejadian. HP lemot  akun kena hack,Technology,,
Bisakah saya memiliki ini sebagai wallpaper PC?,Entertaiment,,
"Ini bagus buat ngumpulin coral dibanding di senjata, barangkali ada yg tipe senjata harus sign jadi mending gacha ini",Entertaiment,,
Lebih Murah! Ini Harga AirTag 2 Paket 4 Pack di Indonesia,Technology,,
Di COMPUTEX 2026  SK hynix menghadirkan produk-produk memori AI utama yang mendukung platform NVIDIA.,Technology,,
Mulai dari perangkat keras terbaru hingga kolaborasi eksklusif yang menakjubkan  MSI menampilkan perlengkapan gaming terkini.,Technology,,
selang waktu satu menit!,Entertaiment,,
Google Ubah Android Jadi 'Agen' AI yang Bisa Bertindak Sendiri,Technology,,
Animasi sangkar Ling sepenuhnya ada di Tiongkok.,Entertaiment,,
sudah di singgung  pemerintah gak pingin kita jadi negara kaya penghasil  pencipta  karena mereka semua rangkap pengusaha importir  biaya pencari dan selisih harga impor. Bajingan,Economy,,
Pulau Kue Utuh,Entertaiment,,
Teroris Rekrut Anak Lewat Chat Game  Ini yang Mesti Dilakukan Ortu,Technology,,
Ini gila! Visualnya benar-benar menakjubkan!,Entertaiment,,
ketika iShowSpeed âââditangkapâ dan juru kameranya duduk di kursi belakang bersamanya,Entertaiment,,
Sepertinya saya menemukan sesuatu yang baru untuk ditonton,Entertaiment,,
Apple Umumkan Fitur Aksesibilitas Baru Berbasis AI,Technology,,
Musim apa ini? Kalau saya telusuri season pertama tayang tahun 2019 dan season terakhir tahun 2025.,Entertaiment,,
Mahasiswa RI Juarai Kompetisi Apple  Bongkar Pelacakan Rahasia Internet,Technology,,
Tidak akan menjadi 5 teratas di rezero s4,Entertaiment,,
Jadwal MPL ID S17 Week 8 Hari Ini: Dewa United Esports Vs Onic,Technology,,
Dang ini terlihat seperti api,Entertaiment,,
apakah musim 2 ini akan datang?,Entertaiment,,
Ini kalau gak bisa rebound sih emang permasalahannya pada pemerintah kita sendiri  gak bisa membangun kepercayaan. Bikin kebijakan seenak udel dan ngomong didepan masyarakat juga seenak udel. Masa bursa asia pada ijo kita sendiri yg terkapar?,Economy,,
Nama?,Entertaiment,,
Bulan Terus Menjauh dari Bumi  Bahaya Nggak Nih?,Technology,,
Dengan kecepatan yang sama dengan pesawatâ¦,Entertaiment,,
Namanya?,Entertaiment,,
Peringatan dari S&P Global menunjukkan betapa besarnya pengaruh lembaga keuangan global terhadap negara berkembang seperti Indonesia. Ancaman penurunan rating atau pandangan negatif saja sudah cukup untuk menekan rupiah  mengguncang pasar  dan mempengaruhi kepercayaan investor,Economy,,
"ANIME TV Drama Fantasi Baru ""Apakah Anda Ingin Menjadi Tanuki?"" PENGUNGKAPAN TEASER",Entertaiment,,
Supermicro baru saja meluncurkan platform server generasi berikutnya yang dioptimalkan untuk prosesor @intel ® Xeon® 6+ yang baru.,Technology,,
sepertinya mesinnya tidak nyata haha,Entertaiment,,
Usai Batasi Usia   Komdigi Akan Wajibkan Akun Medsos Pakai Nomor HP,Technology,,
bobot adegan ini tidak nyata. Reaksi Sakura dan Kakashi terhadap kematian Naruto sangat mengejutkan.,Entertaiment,,
"Anda membuat nama Anda terlalu tidak jelas, Tuan",Entertaiment,,
Sudah waktunya untuk mengakui bahwa Donghua secara resmi mengungguli Anime modern dalam hal arahan seni. MAPPA dan Ufotable akhirnya bersaing secara nyata.,Entertaiment,,
yo apakah ini bagus,Entertaiment,,
Episode khusus,Entertaiment,,
EPISODE TAHUN INI?,Entertaiment,,
"Zenitsu menggunakan teknik Hinokami Tanjiro dan memadukannya dengan pernapasan gunturnya untuk menciptakan bentuk ketujuh yang baru, Sungguh Gila!",Entertaiment,,
aku sih soalny ga perlu wp standard,Entertaiment,,
"Apa nama acaranya, di mana menontonnya di India dan apakah ini dalam bahasa Inggris atau dengan subtitle",Entertaiment,,
Baca Juga: Selama 34 Tahun  Dugaan Praktik Under Invoice Disebut-sebut merugikan negara hingga Rp 15.400 triliun. Temuan ini menjadi salah satu alasan pemerintah mendirikan PT Danantara Sumberdaya Indonesia (PT DSI). CEO Danantara Rosan 1/160638426/bos-danantara-bumn-baru-cegah-under-faktur-janji-transparan?utm_campaign=twitter_newsplay,Economy,,
Tahun ini lebih dari sekadar acara tahunan besar bagi industri teknologi. Ini juga merupakan peringatan 10 tahun yang monumental dari seri ASRock Taichi!,Technology,,
Microsoft Mau Bangun Data Center  Presiden Ketar-ketir,Technology,,
bukan ini saya.......,Entertaiment,,
Ohh jadi kita mendapatkan season 2 secepat ini?,Entertaiment,,
Penarikan Terbatas F2P Tahunan,Entertaiment,,
Tapi saya tidak tahu mengapa Donghua di luar Tiongkok ini diremehkan.,Entertaiment,,
Bank menaikkan suku bunga sebesar 50bps menjadi 5 0.25  yang merupakan langkah terbesar dalam beberapa tahun terakhir. Tapi apakah itu cukup untuk mempertahankan Rupiah? Peringatan Spoiler: Kurang tepat! Solusi moneter tidak dapat menyelesaikan masalah kredibilitas fiskal dan ketidakpercayaan terhadap arah kebijakan pemerintah. Sekarang BI sudah cukup,Economy,,
Perbanding iPhone 17e vs 16e: Serupa Tapi Ada Bedanya  Perlu Upgrade?,Technology,,
Nama pembawa acara,Entertaiment,,
Apa betul wahai penduduk asli Solaris WuWa! ???,Entertaiment,,
"Rupiah tembus Rp17.700. Cadangan devisa makin tipis. Pengangguran tertinggi se-ASEAN. Namun pejabat kita masih dengan santai mengatakan: ""Fundamental kita kuat."" Yuk kita cek benaran pakai angka bukan basa-basi. Pertama  ""fundamental"" itu sebenernya",Economy,,
omong kosong ini benar-benar terlihat puncak bro!!,Entertaiment,,
Platform apa itu?,Entertaiment,,
Mantan Rekan Kerja Bilang Omongan Sam Altman Tak Bisa Dipegang,Technology,,
Data OpenAI Dibobol Hacker  Bagaimana Nasib Pengguna ChatGPT?,Technology,,
Samsung Buka Pendaftaran One UI 9 Beta  Ini HP yang Bisa Jajal,Technology,,
Aduh! Ini beneran weaponnya phrolo bisa jadi senjata alternatif buat denia?,Entertaiment,,
Pertama di RI  Fitur Diabetes Risk Study Hadir di HUAWEI Watch Fit 5,Technology,,
