No,News Title,Category
56167,"Bonds Rise As Iraq Unrest, U.S. Economy Lift Demand",Economy
63793,Michaels Stores Inc (MIK) Trades Sideways Following IPO,Economy
58130,Citigroup Settles Mortgage Securities Inquiry for $7 Billion,Economy
32708,Award-winning children's author Walter Dean Myers dies,Entertainment
2245,"IU baseball vs Michigan State; Sunday, April 20, 2014",Entertainment
16588,Intel Given New $40.00 Price Target at Jefferies Group (INTC),Economy
8383,Album Review: Robin Thicke - 'Paula',Entertainment
20037,Michaels Confirms Hackers May Have Gotten Info from 2.6 Million Cards,Economy
10985,India is one of BlackBerry's top 10 markets: John Chen,Technology
48889,Entertainer Harris convicted of indecent assaults,Entertainment
23089,Craig Ferguson says he's leaving 'The Late Late Show',Entertainment
50606,West Coast Port Talks to Extend Past June 30 Contract Expiration,Economy
62230,Kevin Smith Reckons Star Wars Episode VII Is Way Better Than Batman V  ...,Entertainment
11306,Gisele Bundchen's LA Mansion Is Up For Sale… And You Won't Believe For  ...,Entertainment
27582,Symantec fires second CEO in less than two years,Economy
57520,Twenty First Century Fox Inc. (NASDAQ:FOXA) Appoints Lachlan Murdoch as a  ...,Economy
21096,Yahoo Reports 1Q Beat as Display Sales Hold Steady,Economy
40607,German business optimism slips,Economy
9902,Robin Thicke on CBS Sunday Morning,Entertainment
51543,Horror director to helm Marvel's Doctor Strange,Entertainment
41309,ACA International Attends Democratic Attorneys General Policy Forum,Economy
34227,"How much will shift to green energy slow growth? Not much, says UN.",Technology
33436,Wal-Mart has exclusive to sell low-cost Wild Oats organics,Economy
63284,Nintendo Losses Worse than Expected,Technology
4321,The article requested cannot be found! Please refresh your browser or go back  ...,Entertainment
4908,'He Still Cares About Her': Liam Hemsworth 'Reaches Out To Miley Cyrus' As  ...,Entertainment
45041,Faithful reflect on Good Friday's meaning as processions in North Jersey mark  ...,Entertainment
63984,"Twitter COO, Media Head Resign Via Tweets",Economy
56750,Found: Earth-like planet in two-sun system. Are there more? [VIDEO],Technology
19951,'Dancing with the Stars' returns: 5 new things you'll see,Entertainment
54916,BlackBerry's Securesmart acquisition almost complete,Technology
30611,Ryanair will bid for Cyprus Airways,Economy
13425,"Twitter's Mute Feature Reaches iOS, Android, And Web",Technology
38672,GM adds 2.18 lakh subcompact cars to growing recall list,Technology
29532,"Queen's Birthday Honours List: Awards For Angelina Jolie, Daniel Day-Lewis  ...",Entertainment
43172,The Lytro Illum Is Where Light Field Technology Meets Real Photography,Technology
51503,Ansel Elgort 'The Fault in Our Stars' Movie Actor Shirtless on Instagram PHOTOS  ...,Entertainment
57131,Supermoon season: first of three massive moons can be seen tonight,Technology
62993,Charlotte's Douglas International Airport Wins Award For Most Consistent Data  ...,Technology
63132,Shares of Sprint and T-Mobile rise after reports of merger talks,Economy
41365,Hackers Seek Ransom After Remotely Locking Mac And iOS Devices In Australia,Technology
46171,GM recalling Camaros from 2010 to 2014 for ignition switch problem,Technology
2931,Caesars vies with Genting in bidding for New York casinos,Economy
44095,Draghi can be pleased with himself - BBH,Economy
30059,Kim Kardashian and Kanye West Step Out in Paris Prior to Wedding,Entertainment
1773,Who Won Dancing With The Stars? The Winner Is...,Entertainment
3482,Stars let loose on MTV Movie Awards red carpet,Entertainment
898,Will Smith Reacts to Controversial Photo of 13-Year-Old Daughter,Entertainment
5833,Adobe launches Voice for iPad to make storytellers of us all (Video),Technology
2210,Life after Joffrey -- now what?,Entertainment
34451,"'Gone Girl' trailer arrives, and it's loaded",Entertainment
5520,"Angelina Jolie talks about Maleficent, her mastectomy and kidnap victims",Entertainment
21698,BlackBerry wins keyboard ruling,Technology
12911,8 Things You Didn't Know About Apple's New iOS 8,Technology
43483,Asian shares slip after Wall Street losses,Economy
60918,Bills Pending Propose $195M State Lump Sum Payment To Detroit,Economy
32370,Coldest and Faintest White Dwarf Star Discovered,Technology
64951,Nicki Minaj Praises Snake Bitten Dancer,Entertainment
11226,"T-Mobile, Sprint Stocks Halted on Report of Buyout by France's Iliad",Technology
56648,"Obama, Michigan in talks to aid Detroit deal",Economy
29713,'Girls Gone Wild' founder Joe Francis arrested,Entertainment
47801,AAA projects 41 million to travel during holiday,Economy
32643,Help a redditor Develop a Way to Get Proper iOS Notifications for Glass,Technology
32202,"Tom Hanks, Steven Spielberg set to reunite for Cold War thriller",Entertainment
6038,Cygnus spacecraft launches to International Space Station,Technology
1068,Carmel Valley teen scientist Eric Chen wins top national competition,Technology
22469,Robin Thicke Apologizes Again to Estranged Wife Paula Patton at BET Awards  ...,Entertainment
35068,"U.S. jobs grow by more than 200000 for 6 months in row, the longest stretch  ...",Economy
15242,Miranda Lambert Tackles Tabloid 'Craziness' In New Song 'Priscilla',Entertainment
29575,Powdered alcohol has arrived,Entertainment
30044,Rolf Harris: 12 Women Seeking Compensation,Entertainment
60910,Tavern Taxi will offer free rides on Cinco De Mayo,Entertainment
15112,"Mounties charge teen with Heartbleed tax agency attack, seize computer",Technology
31995,Power snag hits Channel services,Economy
60981,Meet the Regulators Trying to Make Sure Self-Driving Cars Are Safe,Technology
46453,Bank of England Governor: Interest rates will rise 'sooner than markets expect',Economy
16516,Best & worst: 42 Met Gala looks,Entertainment
28683,Oculus halts sales in China to stop resellers from hawking development kits,Technology
28773,"'Amazing Spider-Man 2' a weird, wonderful ride",Entertainment
24516,Earth's Bacteria on Mars' Surface!,Technology
29123,Users of Android devices at risk of 'Heartbleed' bug,Technology
8553,Samsung Gear Solo standalone smartwatch won't require a smartphone to make  ...,Technology
35539,Gymnast Kacy Catanzaro Absolutely Crushes 'American Ninja Warrior' Obstacle  ...,Entertainment
55836,Justin Bieber's Fair Fire To Seth Rogen: 'Sorry I didn't bow down',Entertainment
60350,Jared Leto May Be Wanted For Doctor Strange,Entertainment
58543,Lower prices at the pump to greet Labor Day travelers,Economy
18441,AP News in Brief at 5:58 am EDT,Economy
36420,Spectacular meteor shower: What you need to know,Technology
56539,When and where to buy the HTC One M8,Technology
60568,Walmart Going After GameStop with Used Games Push,Economy
6588,Gold Remains Below $1275 before Fed,Economy
28131,"Harry Potter is Back, But He is Going Grey in New JK Rowling Story",Entertainment
38154,"Jennifer Lopez, Keith Urban, Harry Connick Jr. returning for trimmed 'American  ...",Entertainment
57676,"Twitter Takes a Page From Facebook, Announces App Install Ads",Technology
4683,"University: Poet, author Maya Angelou dies at 86 - 2 Hours Ago",Entertainment
49201,Top UN court orders Japan to end Antarctic whale hunt,Technology
17056,Oil prices rise on signs of stronger US economic growth,Economy
16050,Plane escorting PM trip breaks down,Economy
58322,Report: Apple on the verge of buying Japanese chip maker: But why?,Technology
48412,Harrison Ford injured on set of new Star Wars film,Entertainment
11353,Mozilla And The Right-Wing Media's Persecution Complex,Technology
59577,Facebook launches controversial video ads in Australia,Technology
430,Jet Magazine to Shift to Digital Publishing Next Month,Economy
47317,Who wore it best? Kim steals Kylie's teeny-tiny black bikini,Entertainment
54102,Two new actors join the Star Wars ranks,Entertainment
28765,Facebook Tinkered with Users' Emotions in Experiment,Technology
50784,Rolls-Royce to return £1 billion to shareholders,Economy
28945,James Franco Throws Lindsay Lohan's Sex List Into Doubt With 1 Comment,Entertainment
64193,Japan trade deficit quadruples on-year in March to USD 14 bn,Economy
19680,Hugh Jackman talks about combining casts for the latest 'X-Men' movie,Entertainment
13371,Google I/O 2014 schedule is now available,Technology
48305,National Roundup: Microsoft and Apple targeted by China,Technology
7981,Cast and Poster Revealed for Jem and the Holograms,Entertainment
36544,Kristen Stewart Debuts New Two-Toned Cropped Hair As She Watches Kendall  ...,Entertainment
421,Richardson-based Fossil to make smart watches with Google,Technology
28317,Yellen: Economy Improving But Rates To Remain Low,Economy
51410,"BHP Studies To Simplify Portfolio, To Focus On Iron Ore, Copper, Coal, Petroleum",Economy
61243,"US Gas Prices Drop 3.5 Cents, May Continue To Drop",Technology
58064,Kesha Goes For Glam In A Goth-Inspired Gown At The 2014 Billboard Music  ...,Entertainment
49174,"Eminem apologizes to mom on Mother's Day with release of ""Headlights"" video  ...",Entertainment
20398,Netflix Confirms Third Season for 'Orange Is the New Black',Entertainment
54965,"Android ""L"" Feature Spotlight: Battery Menu And Lockscreen Now Show You  ...",Technology
54138,'Fifty Shades Of Grey' Star Rita Ora Reveals She Used Earpiece With Someone  ...,Entertainment
18899,Gas Prices Continue to Drop,Technology
53099,Can $7.6 billion valuation take Candy Crush to next level?,Economy
28674,"Google 'forgets' stories on BBC, UK newspaper sites",Technology
26651,YouTube To Release New Creator Studio App On iOS In 'Coming Weeks',Technology
47169,Kate Middleton re-wears dress from Australia trip for day at Wimbledon with  ...,Entertainment
62919,16 Wonderful Things Google Glass Has Made Possible,Technology
1980,Windows Phone is getting folders — just like all the other mobile OS platforms  ...,Technology
7223,New York Times publisher calls former top editor Jill Abramson bad manager  ...,Entertainment
50123,China-based web company Baidu wins right to censor search results,Technology
25386,Alps says no complaints from GM over ignition switches,Technology
24927,Robert Downey Jr.'s son arrested on cocaine possession charges,Entertainment
22924,Grain Markets to Trade Up Monday,Economy
26354,"Ford To Name Fields CEO, Succeeding Alan Mulally: Report",Economy
50437,"Facebook, Oculus, And Businesses' Thirst For Virtual Reality",Technology
35176,Facebook bets $2bn on Oculus winning virtual reality race,Technology
9372,European stock markets end up,Economy
35816,Population declines in Clinton County,Economy
17814,"Dublin's upbeat assessment of banks 'at odds with ECB', says FF finance  ...",Economy
53308,"Gotham: See young Batman, Penguin, Commissioner Gordon and more in  ...",Entertainment
59111,Jodie Foster Privately Gets Married to Girlfriend Alexandra Hedison,Entertainment
29025,Dutch police detain Greenpeace saboteurs,Economy
57823,"Report: Man Charged with Credit Card Abuse in TX, Possibly Linked to Target  ...",Economy
65485,No penalty for below minimum balance: RBI,Economy
7488,Paycheck Fairness Act has already failed twice. Will the third time be the charm?,Economy
26716,Bearded drag queen competing at Eurovision has a message for her critics  ...,Entertainment
61943,Nokia Lumia 630 and Nokia Lumia 635: What you need to know,Technology
55722,'Planes: Fire and Rescue' screening Sunday night to benefit firefighters,Entertainment
27435,AT&T Warns FCC It Might Skip 600 MHz Auction Over Spectrum Rules,Technology
30471,"The Voice Season 6 Episode 7 Recap: Sisaundra Lewis, Do What U Want!",Entertainment
20511,Diddy Is No More As Sean Combs Becomes Puff Daddy… Again,Entertainment
65387,How to do everything with the Samsung Galaxy S5,Technology
35576,"'Bachelorette' Contestant Chris Soules Deserves Better than Andi Dorfman, Fans  ...",Entertainment
7556,Celebrity Odds & Ends,Entertainment
40555,Highlights from the 1964 New York World's Fair,Entertainment
53221,Beyonce and Jay Z unveiled footage of their wedding for the first time last night  ...,Entertainment
22015,Miley Cyrus is my best friend: Liam Hemsworth,Entertainment
19712,Marlton's Christina Grimmie comes in third on 'The Voice',Entertainment
13496,Cannes Film Festival announces official 2014 competition lineup,Entertainment
3416,"Rob Kardashian skips Kimye's wedding, Kim K rocks custom Givenchy dress",Entertainment
33593,Winner announced: Samsung Galaxy S5 and Samsung Gear Fit contest,Technology
59485,"So what, exactly, is up with the 'Guardians of the Galaxy' post-credits scene?",Entertainment
23418,More Theories But Still No Sign Of Missing Malaysian Jet,Economy
22074,"Film Clips: May 8, 2014",Entertainment
57115,"Beyonce, Jennifer Garner support 'Ban Bossy' campaign",Entertainment
63775,"Chris Colfer not fired from 'Glee,' manager says the actor's Twitter was hacked",Entertainment
4948,Apple iOS 8 Features Make Several Jailbreak Tweaks Obsolete With Custom  ...,Technology
19276,Herbalife under investigation by FBI: report,Economy
65087,Terence Corcoran: How low corporate tax rates are driving Big Pharma takeovers,Economy
59776,Kim Kardashian likely to re-launch pop career,Entertainment
27042,"Apple boasts of improved cameras, enhanced performance in re-released 'iPad 4'",Technology
14205,"Another Great EJ Event: Free Screening of “Dawn of the Planet of the Apes"" on  ...",Entertainment
15901,DMV: take off the make-up!,Technology
9130,Joss Whedon releasing 'In Your Eyes' for $5 digital download,Entertainment
21716,Climate Change is Risky For Business,Economy
45420,Icahn Calls For Ebay To Spin Off 20% Of PayPal In An IPO,Economy
34777,Microsoft Xbox One Console Rolls Out in China in Fall,Technology
43188,Jenny McCarthy goes on island holiday after being axed,Entertainment
21930,Beyonce leaves hotel with sister after Solange attacks Jay Z,Entertainment
36785,'X-Men' sequel tops 'Avatar' as Fox's biggest global debut,Entertainment
48492,Foursquare launches Swarm to take on Facebook Nearby Friends and Yelp,Technology
39890,Netflix announces content agreements with several cable companies,Entertainment
57092,AstraZeneca takeover: Nick Clegg turns up the heat on Pfizer,Economy
33555,"WWE Monday Night Raw: 14th April, 2014 - Superstar Ratings",Entertainment
2902,Twitter (NYSE:TWTR): Shuffling Strategies For Gaining Pace,Economy
55393,Dow plunges as multiple worries vex investors - KTVN Channel 2 - Reno Tahoe  ...,Economy
15945,"NASA Developing a Flying Saucer to One Day Carry Astronauts, Equipment to  ...",Technology
25940,Miami Real Estate Market Continues to Stabilize Despite Strong Demand,Economy
37280,"WATCH: Gov. Chris Christie, Jimmy Fallon on 'The Evolution of Dad Dancing'",Entertainment
52688,"'Octomom' keeps watch over eggs for more than four years, MBARI scientists find",Technology
21690,Aegis Ashore System Fires SM-3 Missile at Target During MDA-Navy Flight Test,Economy
13888,"RPT-UPDATE 6-Japan, Australia clinch trade deal as US-Tokyo talks heat up",Economy
9617,Wearables and BYOD: Exposing the enterprise,Technology
16006,A St. Patrick's Day Greeting From The Muppets,Entertainment
27808,Justices rule for broadcasters,Technology
45807,The Girlfriend Experience Anthology Series Is Coming to Starz,Entertainment
10515,Google's Modular Smartphone Gets a January 2015 Launch Date,Technology
46248,"After Amazon, Google launching Android TV",Technology
10288,One Direction vid allegedly shows drugs,Entertainment
62932,Tom Hanks Could Re-Team With Steven Spielberg On A Cold War Thriller,Entertainment
33031,"Amazon teams with HBO, snares “The Wire,” “Veep”",Entertainment
30383,Scientist Offers $10000 To Anyone Who Can Disprove Climate Change,Technology
32449,Mick Jagger: Chadwick Boseman an 'excellent' choice for James Brown biopic,Entertainment
47442,Orlando Bloom and Erica Packer Seen Hugging After Ibiza Fight,Entertainment
51268,Why Apple and Google Ended Their Thermonuclear Rift,Technology
54313,Researchers Discover New Type Of Dust In Mars' Atmosphere,Technology
29060,Amazing Spider-Man 2 Director Marc Webb Would Love Crossover With X-Men,Entertainment
57814,Fox reality series I Wanna Marry Harry will trick women into competing for Prince  ...,Entertainment
48678,Game of Thrones' Maisie Williams: 'Arya's misfortune is frustrating',Entertainment
48407,"Health care, tech names lead decline in US stocks",Economy
46855,"X-men: Days of future past, south east asian premier, Singapore",Entertainment
10314,North Texas Student Under Fire For Hunting And Killing Animals In Africa,Entertainment
39692,PR Newswire,Technology
61466,'The Hunger Games' Releases Trailer For Next Movie. Spoiler Alert!,Entertainment
19590,"Stocks To Buy In The Mobile Gaming Sector [Glu Mobile Inc., King Digital  ...",Economy
57152,8 stylish celeb couples we love at the Met Gala 2014,Entertainment
6061,Whitney Houston's biopic to be released in 2015,Entertainment
39360,"Don't Be Silly, Hello Kitty Is a Cat",Entertainment
36976,Dinosaur Tracks Soon to be opened for Public Viewing,Technology
28971,A Fair American Flat Tax,Economy
64483,Director charged with on-set death,Entertainment
7344,Airlines' ride in 2014 not so smooth says IATA,Economy
15919,'SNL' host Lena Dunham calls 'Girls' spoof 'one of the best things' ever,Entertainment
13647,U.S. job growth eases but tops 200K for a 6th month,Economy
61635,Near-naked Rihanna flashes more boobs than ever at CFDAs,Entertainment
46606,Microsoft Bumps OneDrive Storage to 1TB for Office 365 Subscribers,Technology
61848,"Lawmakers, FCC chairman urge arbitration over Dodgers channel",Technology
65503,Wal-Mart Forecast Misses Estimates as Sales Slump Lingers,Economy
6667,China/Hong Kong: Make Report Reflect Democracy Demands,Economy
65136,Install DVU1AND2 Android v4.4.2 KitKat Software for Samsung Galaxy S5 SM  ...,Technology
42527,"Why You Should Be Careful What You ""Like"" on Facebook",Economy
16406,Pregnant Kunis and Kutcher 'talking about kids for a year',Entertainment
10030,UPDATE 3 (Day 16): MISSING MH370: Plane search widens on new images of  ...,Economy
19843,Google to sell limited number of Glass devices to public,Technology
34082,Heartbeat Heartbleed Bug Breaks Worldwide Internet Security Again (And Yahoo),Technology
60994,Dr Dre says Apple/Beats deal makes him 'the first billionaire in hip-hop',Technology
33428,Brunei becomes first east-Asian country to adopt Sharia,Entertainment
21869,Captain America: The Winter Soldier's Chris Evans and Sebastain Stan Ring  ...,Entertainment
38209,Taylor Swift Interrupts Seth Rogen During 'SNL' Monologue: Watch,Entertainment
3254,"GoPro jumps into action-packed IPO (and yes, they filmed it)",Economy
39546,Credit Suisse says not found anything materially untoward in its forex trading,Economy
60702,"Allergy, Asthma and Immunology Center relocates to bigger site with eye on  ...",Technology
50481,"White House unveils dire warning, calls for action on climate",Technology
22243,Madison churches announcing Easter-related activities,Entertainment
40158,Valeant Pharmaceuticals And William Ackman's Pershing Square Hedge Fund  ...,Economy
53696,Striking food workers create job for NYT ex-editor Jill Abramson,Economy
7997,"MOVIES: McCarthy lets it all hang out, and then pulls it back in, as 'Tammy'",Entertainment
60542,SiriusXM Fires Anthony Cumia After Twitter Rant,Entertainment
55927,GM adds 218000 subcompacts to growing recall list - KCTV5,Technology
48207,Hologram Outfit Couldn't Stop Jacko's Show,Entertainment
1220,A law by any other name would smell as sweet,Economy
16811,5 Killer Reasons Why You Should Wait For Nexus 6,Technology
46768,WATCH: Robin Thicke 'Still Madly Crazy' Music Video Features Cute Children at  ...,Entertainment
14187,Why Jennifer Lawrence Doesn't Trust Women,Entertainment
31428,Darren Aronofsky Calls 'Noah' The 'Least Biblical Film Ever Made',Entertainment
56988,Tumblr now lets you customize your blog theme from its iOS app,Technology
56869,"Mortgage Rates Improve at TD Bank, US Bank and BMO Harris Bank (March 12)",Economy
31341,Full NC House gives initial OK to tax legislation,Economy
57718,France protests at US's 'unreasonable' BNP Paribas fine,Economy
16232,Hospital Corporation of America Named One of Ethisphere Institute's World's  ...,Economy
13577,Sikorsky lands contract to build rescue chopper,Economy
36203,The Black Keys Confirm Fall North American Tour,Entertainment
4822,Residents stand on their roof to watch a wildfire burn near their home in  ...,Technology
47445,Rumor: Live Game Streaming Platform Twitch Has Accepted A $1 Billion Google  ...,Technology
25462,AAA: Pain at the pump for summer road trips,Technology
61626,Prince Releasing Two New Albums At The End Of September,Entertainment
49066,Majesty Rose York: Her American Idol 2014 Journey [VIDEO],Entertainment
19062,Ivan Reitman Will Not Direct GHOSTBUSTERS 3,Entertainment
37166,eBay Inc: Carl Icahn Now Calling For Just Partial PayPal IPO,Economy
63800,Brace Yourself: Top 10 Terrifying Impacts of Climate Change,Technology
29062,"Microsoft profit slips; software, Surface help sales",Economy
22458,Zendaya is Aaliyah no more!,Entertainment
10818,This is the Amazon Fire Phone,Technology
46900,"IMF trims growth outlook for emerging markets, sees risks",Economy
14323,"FCC reportedly set to update ""fast lane"" proposal",Technology
14057,World's biggest dinosaur bones found in Argentina,Technology
42702,Intel Corp (NASDAQ:INTC) Shares Hits Ten year Highs with Express Inc (NYSE  ...,Economy
28799,UPDATE 4-Bulgarian central bank says banking system under attack,Economy
32226,Asia declines on Mid-East violence,Economy
31126,Cargo Spacecraft Arrives at International Space Station: NASA TV Broadcasts  ...,Technology
31879,Help celebrate 40 years of music in style,Entertainment
45669,IBM to spend bn aiming for computer chip breakthrough,Economy
33219,America Ferrera responds to Cannes red carpet prank,Entertainment
7299,Las Vegas Sands Vs. Melco Crown in Macau: Which Is Your Best Bet Now?,Economy
55975,"Dancing with the Stars Results 2014 - Tonight's Finale, Who Won Season 18?",Entertainment
8380,Robert De Niro Remembers His Gay Father,Entertainment
62228,Amazon breaks silence in contract dispute with Hachette,Economy
60658,"Tiffany & Co.'s Sales +7%, Profit +16% to $124M",Economy
44207,Crucify Them! Lessons from Holy Week on Capital Punishment,Entertainment
40427,Apple to Acquire Dr. Dre's Beats,Technology
43811,Interactive Rubik's Cube Google Doodle marks the puzzle toy's 40th anniversary,Technology
12169,Airline industry celebrates its centennial in the black,Economy
15402,Review - 'Tammy' Is A Winner,Entertainment
13344,George Clooney's engagement 'confirmed' by girlfriend's law firm,Entertainment
40920,EL James Debuts First Look At Jamie Dornan As Christian Grey,Entertainment
40493,"Ford, Fisher, Hamill cast of 'Star Wars 7'",Entertainment
20020,"A politician, paedophile and doctor have already asked Google 'to be forgotten  ...",Technology
47115,'Walking Dead': Who Is Gareth? Our Three Best Theories,Entertainment
17134,Twitter says TV strategy will spur growth,Economy
45369,Android Wear Notifications Will be Sent to Google Glass,Technology
43781,Nike Fires Majority of FuelBand Team,Technology
32698,Colin Firth no longer the voice of Paddington,Entertainment
25802,Jonah Hill Apologizes For Homophobic Slur On 'Howard Stern Show',Entertainment
12106,"Weekend Box Office Wrap Up: July 6th, 2014",Entertainment
44671,Before Bedtime: Are Adam Sandler and Drew Barrymore the Mass-Market Ethan  ...,Entertainment
35125,Gold spikes as airliner shot down in Ukraine,Economy
49009,Angelina Jolie Can't Stop Gushing Over Elle Fanning,Entertainment
39321,Chrysler accelerates Jeep recall repairs from 2018 to March,Technology
27050,"Now, try 'dummy' Google Glass sets for free in your home",Technology
10016,"Scandal Season 3 Finale Spoilers: Rowan Pope, Harrison Die as Bomb  ...",Entertainment
44330,Twitter Web Profile Design Goes #Facebook,Technology
38507,Guest editorial: The science is clear: Humans have caused climate change,Technology
31185,"Fed, in wait-and-see mode, unlikely to shift course this week or signal time for  ...",Economy
19749,"US stocks: Wall Street edges higher, investors look to earnings",Economy
40389,Google takes its same-day delivery service to New York and LA,Economy
64205,Watch LA's Mayor Humiliate NYC After His City's Big Stanley Cup Win,Entertainment
6155,"Fan TV Coming to Time Warner Cable, Without DVR, Major Streaming Services",Technology
4854,Google to take center stage in after hours trade,Economy
4298,Craig Ferguson leaves The Late Late Show: his best bits in clips,Entertainment
22418,"Chrysler, Ford, Toyota and Nissan report better March sales; GM data delayed",Economy
30748,"Chiefs' Aaron Murray says bro, 'Bachelorette' very happy",Entertainment
57276,Jerk or Not Jerk? U.S. regulators say website deceived consumers,Economy
6619,Microsoft job cuts suggest company cultural shift,Technology
41005,Czech Manufacturing Activity Slows In June,Economy
28952,Freddie Prinze Jr. is done being polite about Kiefer Sutherland's antics,Entertainment
44846,AC/DC to call it quits over sick band member: report 0,Entertainment
34209,"In Case of Emergency, You Can Now Text 911 for Help",Technology
36084,'Godfather of House Music' Frankie Knuckles dead at 59 in Chicago | The Republic,Entertainment
11048,Rumor: YouTube is going to buy Twitch for $1 billion,Technology
63889,"Folkie Jesse Winchester dies of cancer, aged 69",Entertainment
46895,Robert Pattinson: 'I Like to Do Weird Things' While on Film Locations,Entertainment
27040,The Windows Apocalypse: Here's why Microsoft is releasing Office for the iPad,Technology
64417,Rihanna Rocks Drake's OVO For Her Trip Back Home!,Entertainment
25921,Twitter shares soar 35 per cent on back of user growth,Economy
52662,HTC One M8 vs Sony Xperia Z2 vs Samsung Galaxy S5 – Specs Overview and  ...,Technology
