No,News Title,Category
11628,Brent up near $113 on supply worries as Iraq violence rises,Economy
39778,James Franco Crashed Seth Rogen's SNLMonologue + 4 More Sketches That  ...,Entertainment
62284,Bank of America to pay $1.3bn fine to US,Economy
10079,Kim Kardashian And Kanye West Spotted In Paris Again! Are They Getting  ...,Entertainment
50638,Robert Pattinson and Kristen Stewart Onscreen Reunion: Report Suggests  ...,Entertainment
30833,AT&T Buying DirecTV for $48.5B (T),Economy
24641,Katy Perry Almost Accidentally Got Miley Cyrus' Homeless VMA Date Drunk,Entertainment
52875,"Xbox One Ships 5 Million, PlayStation 4 Takes Top Spot In March",Technology
42052,Angelina Jolie spreads her wings,Entertainment
32756,Durable goods rise but capital spending plans weak,Economy
19587,Facebook share price: Social media giant buys video ad company LiveRail,Technology
12153,"When It Comes to Uber, Cab Drivers Have a Public Relations Problem",Economy
44514,Lucasfilm Officially Addresses 'Star Wars' Expanded Universe,Entertainment
44414,China manufacturing improves: HSBC,Economy
10202,Met Ball 2014: Stars do pale and interesting on fashion's biggest night,Entertainment
25026,Gains at Monday open,Economy
46506,NASA plans test launch of new 'flying saucer' spacecraft,Technology
60845,Black Box Detector Joining Malaysia Plane Search,Economy
24385,The Earnings Parade Accelerates,Economy
32116,Five ways we're killing ourselves with climate change,Technology
43699,Why Apple Inc. Needs Its iWatch Sooner Rather Than Later,Technology
8864,Critical lashing doesn't stop Transformers,Entertainment
58151,AstraZeneca shares dive as it rejects 'final' Pfizer offer,Economy
49195,BlackBerry launches BBM Protected for enterprise messaging,Technology
6886,Microsoft Offering Free Office 365 Subscription for One Year If You Bring Your  ...,Technology
9506,France awaits new government as Hollande struggles,Economy
48835,Xbox One hits 26 new markets in September,Technology
42507,The 'Rumours' Are True: Christine McVie Rejoins Fleetwood Mac for World Tour  ...,Entertainment
29001,Project Morpheus: Sony Unveils Virtual Reality Headset for Playstation 4,Technology
55528,Homeless enjoy fancy free lunch,Economy
62628,FreedomPop launches refurbished iPhone 5 on its calling plans,Technology
16204,PlayStation Network Hacked as Bomb Threat Grounds Sony Exec's Plane,Technology
5302,Mark Carney says Bank of England needs more power,Economy
51812,A Coffee Machine That Works In Space!,Technology
31792,Target shares drop after CEO steps down,Economy
13469,Protesters arrested in pay fight at McDonald's headquarters,Economy
6509,"Medicare will be solvent until 2030; Social Security until 2034, report says",Economy
33849,"J.C. Penney Company, Inc. Stock Soars 25% On Sales Jump",Economy
18693,Cities shamed over quality of air,Technology
33659,JPMorgan profit falls 20%,Economy
39825,Chris Colfer Fired From 'Glee' After 5 Years For 'Personal Issues'?,Entertainment
27504,"Prince Reissuing Purple Rain, Promises New Music Under New Warner Bros. Deal",Entertainment
21196,Kate Mulgrew Is in a Doc that Argues the Sun Revolves Around the Earth,Entertainment
8084,A Million Dollar App That Only Says YO!,Technology
35532,Jobless rates fell in 21 states last month,Economy
62459,"New York sues Barclays for fraud over ""dark pool"" trading",Economy
58678,Kellogg's Kashi cereals will drop 'all natural' labeling,Economy
3163,"Marchand, Chara and Hamilton on . . .The Tonight Show?",Entertainment
22330,US Airways investigating pornographic tweet,Entertainment
31086,Galaxy S5 vs Nexus 5 specs comparison,Technology
30862,"For the first time ever, astronauts will be able to drink “good, hot and steaming  ...",Technology
23491,BUSINESS BRIEFING Tesla Handing Over the Keys to Its Technology,Technology
49849,Federal Reserve: 29 of 30 big banks could survive another economic crash,Economy
29302,"MARKET WATCH: US light, sweet crude narrows price gap with Brent",Economy
22448,"Buns, eggs & bunnies",Entertainment
57574,"Alibaba Picks US For IPO Over Hong Kong, Singapore",Economy
15968,Search for missing Malaysia plane spreads across Australia-sized zone,Economy
30667,HBO to co-produce JK Rowling's BBC miniseries The Casual Vacancy,Entertainment
7761,Mercedes Teams With Infiniti on $1.4 Billion Mexico Plant,Technology
19391,Google kicks off always encrypted Gmail service,Technology
32054,Joss Whedon releasing In Your Eyes for digital download,Entertainment
57009,Price hike at Disneyland causes parents to feel sharp pinch,Entertainment
22700,Google gets the jump on April Fools with new “Pokémon Master” job listing,Technology
25535,Horrific repeat of history as Peaches' children lose mum,Entertainment
51058,Poland keeps eye on coal amid scramble for energy,Economy
53628,High temps well below average Sunday afternoon,Economy
52364,Fans back One Direction over cannabis video,Entertainment
49819,Robin Williams Enters Treatment To 'Fine Tune' His Commitment To Sobriety,Entertainment
10275,Ford to recall 434000 vehicles mainly in North America,Technology
8957,Phil Spencer Gets Promoted To Head Of Xbox Division,Technology
12255,UPDATE 4-US agribusiness ADM to acquire Wild Flavors for $3 bln,Economy
10913,Fishing in TV's Deadpool: Yahoo's Risk-Averse Community Revival,Entertainment
33880,Marketing Expert Ivy Ross Was Just What Google Glass Needed,Technology
28493,'The Voice' Season 6 Playoffs Recap: Team's Shakira and Adam take the  ...,Entertainment
10487,ECB the focus in light week for data,Economy
46593,'Star Wars: Episode VII' Leaked Footage From Set Is Fake [VIDEO],Entertainment
48612,"Avril Lavigne's Latest Video isn't Racist, But It is Disappointing",Entertainment
50286,RPT-GLOBAL ECONOMY WEEKAHEAD-Europe fears deflation as Ukraine  ...,Economy
28259,US Federal Reserve Chairman Janet Yelland warns that US jobs market is  ...,Economy
8049,Milsap among inductees to Country Music Hall of Fame,Entertainment
640,"Market Basket CEOs, 'Artie T' supporters, on collision course with walkout  ...",Economy
8247,"Whopper Reason Shareholders Should Hate Inversions? (Hint, It's Not About  ...",Economy
23063,Dimon's Cancer Has 90% Cure Rate With Demanding Therapy: Health,Economy
31202,Report: OKCupid conducted secret experiment on users,Technology
45147,"US futures flat, but Netflix jumps",Economy
37240,A New Internet Explorer Security Flaw Leaves One-Quarter Of Web Browsers  ...,Technology
45531,Mad Men 7.02 Review: “A Day's Work”,Entertainment
45443,Numericable insists its SFR offer is the 'most compelling',Economy
56331,AT&T: DirecTV deal can help shape TV's future,Technology
17845,Asteroid Glass Study Could Open Doors in Studying Mars' Environmental History,Technology
7758,"Ohio Earthquakes Linked To Fracking, A First For Region",Economy
58551,GM Reportedly Investing $450 Million in Two Michigan Plants,Economy
56787,Google Street View Becomes Time Machine,Technology
27348,Apple Gains After Hours and Lorillard Tumbles,Technology
10892,"Mick Jagger pays tribute to L'Wren Scott, fires back at split report",Entertainment
51053,"Palcohol, the latest food invention to be approved for use in the US",Entertainment
21197,Wall Street falls broadly ahead of earnings,Economy
31511,Assassin's Creed: Unity announce trailer,Technology
11324,RECALL: Chrysler alerts minivan owners about window switch,Technology
31060,Freeway reopens after beams fall into lanes,Economy
20209,Angela Bassett to direct Whitney Houston biopic,Entertainment
46209,'The Hunger Games: Mockingjay' – Part 1: Teaser Trailer Reveals 'Game Of  ...,Entertainment
36344,Global release of Samsung Galaxy S5,Technology
4731,'Indian Money in Swiss Banks Rises to Over Rs 14000 Crore',Economy
36641,Adobe Systems (ADBE) Launches 14 New Versions of CC Desktop Apps,Economy
23399,Solange Knowles “Overreacted” to Jay Z's Comment,Entertainment
33981,Jurassic World Sequels Looking Likely,Entertainment
64567,Beyonce tops Forbes Top 100 Celebrities list for 2014,Entertainment
48810,Review: Chris O'Dowd shines in 'Of Mice and Men',Entertainment
51546,BNP Paribas close to $9 billion settlement with US authorities,Economy
23757,PHOTOS: West New York PBA takes ALS ice bucket challenge,Entertainment
54941,Movie Dope,Entertainment
48141,Brick Mansions: The RZA on Paul Walker and Curry Goat,Entertainment
14256,Captain America: The Winter Soldier breaks April box office record for opening  ...,Entertainment
31720,Shipwreck off Maltese coast yields 2700-year-old ancient Phoenician artifacts,Technology
109,"Bob Geldof pays tribute to ""beautiful"" Peaches",Entertainment
8819,Panel: Climate trouble is here,Technology
46089,Massive dirt pile may have led to bridge closure - NBC29 WVIR Charlottesville  ...,Economy
42296,What You Can Do With Facebook's 'I'm a Voter' Button,Technology
38396,'Godzilla' opens with smashing $93.2 million - WNEM TV 5,Entertainment
58780,Pope Francis cold call: Argentinian woman claims pontiff phoned with message  ...,Entertainment
34904,Pa. museum receives rare footage of FDR walking,Entertainment
24801,Oculus VR acquires game-networking engine RakNet -- and makes it open-source,Technology
49600,Morocco bans daring online news website,Economy
33074,Jay Z and Beyonce Release Trailer to 'Run' [VIDEO],Entertainment
59999,Ebay posts better-than-expected first-quarter profit,Economy
62487,US industrial output rises in May,Economy
4385,Case tests limits of post-Snowden privacy,Technology
30359,Beyonce vs. Rihanna beef intensifies amid viral Jay-Z & Solange Knowles  ...,Entertainment
61808,Central New Yorkers attend Sunrise and Oncenter Easter services,Entertainment
3403,Sharp rise in gas prices now easing,Technology
43763,Marvel Comics Rewrites Thor Into A Woman,Entertainment
15975,Zach Galifianakis Comedy Lands At FX,Entertainment
54352,The Obama administration ever-so-slightly loosens the US crude oil export ban  ...,Economy
50564,The Most Liked Late-Night TV Hosts,Entertainment
10430,"WRAPUP 1-For Goldman Sachs and Morgan Stanley, boring is beautiful",Economy
33693,"US stocks manage tiny gains, end week lower",Economy
61884,The cheapest dress at the CFDAs? Target exec wins style points for wearing $90  ...,Entertainment
24760,The 2014 BET Awards' 9 Most Memorable Moments,Entertainment
43660,Demi Lovato Twitter Unfollows Selena Gomez: 'Neon Lights' Singer Calls Justin  ...,Entertainment
29371,Daniel Radcliffe will definitely read new `Harry Potter` follow-up,Entertainment
52289,NET-A-PORTERCOM Launches Google Glass For US Customers,Technology
7712,Halle Berry on Extant script: 'I couldn't put it down. It's different',Entertainment
2485,"Our Love: Remembering Frankie Knuckles, 1955-2014",Entertainment
43539,Nest recalling 440000 smoke alarms for safety risk,Technology
10319,"Asiana, Boeing express mixed feelings about crash report",Economy
6367,Argentina 'won't be brought to our knees' over debt,Economy
11751,Rice Bucket Challenge will Match Donations Dollar for Dollar until August 31st,Entertainment
36605,'Game of Thrones' slays finale ratings record,Entertainment
4255,Melissa McCarthy's Cements Her Hands & Feet At Hollywood's Chinese Theatre,Entertainment
22937,'Mining pool' of computing power threatens Bitcoin,Economy
5267,Google Explores Offering Glass Outside The US,Technology
30023,Out of control actor Shia LaBeouf arrested at Broadway theatre show,Entertainment
37359,Botox maker Allergan ready to take Valeant offer to shareholders,Economy
24151,Gregg Allman Takes Legal Action to Stop Biopic,Entertainment
23999,"Kim Kardashian, Kanye West Marriage Falling Apart? Kanye Accused of  ...",Entertainment
55491,"Threes creators express puzzlement, sadness over 2048 and rampant cloning  ...",Technology
62623,Surface Pro 3: Microsoft Holds First Surface Pro Cafe Event in Toronto,Technology
4452,Google to build prototype of truly driverless vehicle,Technology
40039,Venture capitalist buys 30000 bitcoins in US government auction,Economy
23305,Khloe Kardashian's Birthday Gift From French Montana,Entertainment
57658,Rival car makers roll out top models at Auto China show,Economy
51427,GRAINS-US soybean prices climb on rising Chinese imports,Economy
16440,US stocks drop ahead of Q2 earnings,Economy
63732,22 Jump Street tops US box office,Entertainment
26669,No breakthrough as S. African engineers strike bites,Economy
50708,'Arrow' season 2 episode 20 preview and photos: Roy loses control,Entertainment
63959,Bieber Is Sorry for Telling That Racist Joke,Entertainment
15077,How to Date Jesus' Wife,Entertainment
10273,Grand Central: Friday Inflation Data Could Further Disappoint Fed Officials,Economy
34726,Tiffany & Co.: Tiffany Reports Fourth Quarter And Full Year Results  ...,Economy
20922,"Yes, the Galaxy S5 can survive a dunk in the toilet",Technology
28299,Heartbleed threatens mobile users,Technology
46227,Mad Men Recap in 10 GIFs: 'A Day's Work',Entertainment
41152,"Loach, Leigh, Cronenberg and (gasp!) Godard in Cannes Competition",Entertainment
21669,"Christians celebrate Palm SundayPublish Date: Apr 13, 2014",Entertainment
51750,Film academy invites 271 to join in the Oscar vote,Entertainment
50995,Why Microsoft's new Surface Pro 3 tablet could be worth waiting for,Technology
45980,LG offers fresh look at G Watch in new promo images,Technology
17629,BOX OFFICE: 'Godzilla' ($93M) has monster weekend — but can't top 'Captain  ...,Entertainment
40549,"UPDATE 1-""Gentleman's Guide"" musical tops Broadway's Tony nominations",Entertainment
40053,Lionsgate Releases Second 'The Hunger Games: Mockingjay' Teaser Trailer,Entertainment
52297,"Korean messaging app KakaoTalk to merge with Daum, the country's second  ...",Economy
40993,"Gov't: Airlines should disclose bag, seat fees",Economy
27936,"Zillow said to be in talks to purchase rival Trulia, create home-search behemoth",Economy
48319,"Ford recalls nearly 700000 SUVs, cars to fix air bags that won't deploy",Technology
64297,Love in a time of unreality,Entertainment
65341,More whales may help oceans deal with climate change,Technology
46483,"Marco Rubio, ready to run",Technology
55890,"IPCC: Climate Change Increasing Risk of Hunger, Thirst, Disease, Refugees  ...",Technology
9951,Net Neutrality Ruling 2014: As Mozilla Petitions The FCC For Better Consumer  ...,Technology
6165,Indian government made 2513 requests for user information to Google in the  ...,Technology
53183,Let's have a look on Android TV and Android Auto,Technology
61105,"'The Voice' finale: Did Christina Grimmie, Josh Kaufman or Jake Worthington  ...",Entertainment
63414,Ryan Gosling's Bonkers Directorial Debut Booed at Cannes,Entertainment
43988,WATCH: Drake impersonates Manny Pacquiao in 'Let it Go' cover,Entertainment
56942,China's economy grows at 7.4 percent in first quarter,Economy
24006,Facebook is creating a parallel internet in emerging markets,Technology
43589,Captain America: The Winter Soldier breaks box office records,Entertainment
51422,'Cut The Rope' Developer Challenges King's 'Candy' Trademark in Europe,Economy
23495,Spacewalk may be needed to fix computer breakdown on International Space  ...,Technology
19668,Arts & Life Features,Entertainment
16066,FTC Advises Facebook On WhatsApp Privacy Policies,Technology
56947,A Stumble in Tech Stocks Drags US Indexes Lower 3/24/14,Economy
29495,Kanye West and Kim Kardashian to Wed in Secret Ceremony in Los Angeles  ...,Entertainment
40826,What Do the New AdWords Changes Mean for Small Businesses?,Technology
55936,"Nokia-Microsoft Deal to Close Friday, With a Couple Tweaks",Technology
46413,2014 Coachella Music and Arts Festival,Entertainment
20550,Ban on Internet fast lanes proposed,Technology
37391,"The past 100 years, June 3, 2014",Economy
64889,A laptop with trade-offs,Technology
57005,Burger King Criticized for Proud Whopper,Economy
61377,Plague Inc will soon be getting an update featuring Dawn of the Planet of the Apes,Entertainment
22686,"Apple's Acquisition of Beats Could Be Delayed Because of Valuation, Roles, and  ...",Technology
54416,"MTV'S ""REAL WORLD: EXPLOSION"" DELIVERS HIGHEST-RATED SEASON IN  ...",Entertainment
25056,"Cargill to Close Milwaukee Beef Plant Friday, Lay-off 600 Workers",Economy
19385,Here's Your First Good Look at 'Spider-Man 2's Green Goblin,Entertainment
16249,Ray-Ban maker clinches Google Glass deal,Technology
23823,Here's Why I Won't Boycott Amazon over Its Fight with Hachette,Economy
24321,Reverse Heartbleed: Individual Users Left Vulnerable to new OpenSSL Attack,Technology
12711,Paul Walker's Brothers Taking Over 'Fast & Furious' Role,Entertainment
62444,Google Glass Haters Strike Again in San Francisco,Technology
65265,Stephen Colbert in Twitter trouble for racial joke,Entertainment
41576,FTC broadsides T-Mobile over “bogus charges”,Technology
59536,I Just Watched The Notebook and Am Here to Ruin It for All of You,Entertainment
2535,Nigerians differ with FG on new GDP -Daily Independent,Economy
28311,"The Godfather Of Soul, In Charge And All Alone",Entertainment
60525,"Miranda Kerr Would Have Sex With a Woman, Wants You to Grade Her Sex Skills",Entertainment
12018,"Popular DJ Kasem, 82, Dies On Father's Day",Entertainment
28886,Miley Cyrus belts out 'Wrecking Ball' Broadway style and it's flippin' hilarious  ...,Entertainment
34731,"Peeps marshmallow candy to inspire movie, TV project",Entertainment
15724,USDA reports 84 percent of Iowa corn crop planted,Economy
13941,TIME Magazine Just Named Beyoncé One of Its Most Influential People,Entertainment
26903,"Watch New ""Hunger Games"" Trailer: 'The Mockingjay Lives'",Entertainment
62397,Iceland lowers warning level over volcano,Technology
30237,Inside Details: Jessica Simpson And Eric Johnson Pre-Wedding Barbecue,Entertainment
61508,Shire Agrees To £32bn AbbVie Takeover Deal,Economy
58314,Keep the charge in your mobile device,Technology
3309,Today is 2014's first Spare the Air alert of the summer season,Technology
20241,Leaky video pits HTC One (M8) against the original flagship,Technology
45077,Sterling falls against euro on UK data,Economy
24014,France seeks better offers from Alstom suitors,Economy
58288,Amazon Wants More Binge Watchers,Entertainment
54900,Dead air: The lung association and its gross simplification,Technology
43121,Ousted American Apparel CEO increases stake,Economy
57239,Order by Obama brings end to Pennsylvania transit strike,Economy
48343,Smartphone 'Kill Switches' on the Way,Technology
37877,After Bill Murray crashes stag do: More celebrities surprising strangers at parties  ...,Entertainment
22360,"Happy, happy, joy, joy: Books, apps bubble it up",Entertainment
24134,"Jennifer Lopez Receives Icon Award, Performs 'First Love' at the 2014 Billboard  ...",Entertainment
64438,GBP Rate – No Push Higher – Yet,Economy
41032,FACTBOX: Gabriel García Márquez,Entertainment
9509,ECB's Christian Noyer says 'not happy' with euro's rise,Economy
29254,South Africa's Credit Rating Cut to One Level Above Junk by S&P,Economy
58574,Amazon prepared to fight FTC over in-app purchases dispute,Technology
8893,Only 4 Teslas have ever been stolen in U.S.,Economy
57218,Big Bang Theory postponed amid contract negotiations,Entertainment
38961,"What are the biggest issues with Wii U, PS4, Xbox One?",Technology
29562,Timberlake tops Billboard Award winners,Entertainment
18677,Neil Patrick Harris thinks coming out improved career,Entertainment
54456,"No bank 'above the law', Holder says",Economy
60628,World Wrestling Entertainment (WWE) Is Losing Ground On Barron's Comments,Technology
43224,Ukraine resumes reverse gas imports from Europe,Economy
28934,White House to share climate data with businesses and local governments,Technology
34380,'X-Men' Director Bryan Singer Accused Of Sex Abuse,Entertainment
8834,Fed chief not worried about a financial bubble,Economy
59429,George Clooney and fiancée Amal throw dinner party to celebrate engagement,Entertainment
41226,"John Milhiser, Noël Wells axed from 'SNL'",Entertainment
11890,Sid Meier's Civilization: Beyond Earth screenshots,Technology
27222,"ECB holds fire on rates, June steps under scrutiny",Economy
40561,What is the likely path of Fed interest rates?,Economy
28809,"War, hunger, disease… and worse to come: The impact of climate change all  ...",Technology
4478,Brangelina's 10-year itch,Entertainment
33116,Markets on High Alert Ahead of July 4 Holiday,Economy
351,"Gold HTC One (M8), Samsung Galaxy S5 flaunted by T-Mobile CEO John Legere",Technology
60701,'Once Upon a Time' Season 3 finale: 'Frozen' princess arrives in Storybrooke,Entertainment
51440,Hollywood Director Behind Terrifying New Exorcism-Themed Film Reveals  ...,Entertainment
62517,Toyota $1.2 Billion Deal Approved as Judge Says Fraud Kills (2),Technology
12210,White House Science Fair Will Focus On Girls In STEM,Technology
25268,"Temples played 'Fallon' (watch), free River Rocks and Surf Lodge shows are  ...",Entertainment
22506,Study reveals bleak prospects for 3.8 million people who have been jobless  ...,Economy
50631,Driverless car trials could be running on UK roads by next year,Technology
34110,"Based on History, Existing-Home Sales Underperforming",Economy
61093,FBI to probe high-frequency trading,Economy
29315,US dollar holds gains against euro,Economy
49458,"Pharrell Crying Tears Of Joy On Oprah Is The Saddest, Happiest, Most Moving  ...",Entertainment
15439,Asheville Beer Week continues with cornhole and carnival,Entertainment
41940,That time Chris Pratt flashed Amy Poehler on the 'Parks and Recreation' set,Entertainment
29093,Can Netflix Keep Growing?,Technology
30364,Sideshow: No politics for Jolie,Entertainment
63090,Prince's polo play date — on first Father's Day,Entertainment
6096,American Fashion Designer Diane Von Furstenberg Collaborates With Google  ...,Technology
21632,"FED FOCUS-For eventual tightening, Fed to signal slow rate rises",Economy
22053,Lana Del Rey Performs at Kim & Kanye's Wedding Rehearsal,Entertainment
37732,Emanuel confident he'll win court fight over Lucas museum,Entertainment
37250,Action Camera Maker GoPro Files For $100 Million IPO,Economy
61921,"BlackBerry restructuring shows early signs of recovery in Q4 results, but revenue  ...",Economy
16180,In Brief: PA gets low score for safety,Economy
8411,Gas prices in central Indiana drop to $3 a gallon,Technology
7888,"Bank of America 30 and 15 Year Mortgage Rates Today Jun 29, 2014",Economy
62883,Obama tries weather outreach on climate,Technology
13704,HBO Classics Coming to Amazon Prime,Entertainment
7975,Xbox One and PS4 are energy guzzlers,Technology
34229,Federal judge sentences SAC Capital in $1.8b fraud deal,Economy
3933,Episode Review: True Blood - Almost Home,Entertainment
17287,Best 'Tonight Show' Entrance EVER! Kevin Bacon Recreates 'Footloose',Entertainment
21125,Google and Intel Unveil a New Generation of Powerful Chromebooks,Technology
16686,Johnny Depp dismisses romance rules,Entertainment
8427,Cena reigns supreme for the 15th time at WWE Money In The Bank,Economy
50064,Usher and contestant Josh Kaufman hit a high note as winners of 'The Voice  ...,Entertainment
58298,America's Favorite Bosses,Economy
21067,China Rejects Report It May Soon Be No. 1 Economy,Economy
19306,US stocks fall despite solid data,Economy
6243,"Film review: Melissa McCarthy's 'Tammy' is one big, messy comedy sketch",Entertainment
9906,"PHH, PNC Mortgage Rate Deals Monday Mar 17",Economy
65511,"Diane Sawyer Stepping Down From ABC's 'World News', David Muir Tapped as  ...",Entertainment
51756,Kim Jong Un wants the US to stop making fun of him in movies like 'The Interview',Entertainment
24410,Roche to pay up to $1.7 billion for US biotech firm Seragon,Economy
27096,Local Radio Operators Prepare for the Worst,Technology
54173,US inflation data sees Asian markets mixed in early trade Wed,Economy
6207,China bans use of Windows 8 on government computers,Technology
52018,Obamacare Enrolls 6 Million People Just 4 Days Before Deadline,Economy
2110,"Fannie Mae, Freddie Mac Conservatorship Leader DeMarco To Leave FHFA",Economy
4094,"Flight Attendant Turns Safety Demonstration Into Comedy Routine, Because  ...",Entertainment
44461,Angela Bassett to Direct Movie About Whitney Houston for Lifetime,Entertainment
48006,EURO STOCK MARKET News - European Stocks End Mixed During Mid-Day  ...,Economy
56366,SNS apps blocked amid massive democracy rally in Hong Kong,Economy
46599,Bloody Outrage! Rosie O'Donnell Has Signed Deal to Return to 'The View',Entertainment
33892,"Lea Michele is not pregnant, but she is second 'Glee' star Twitter hacked",Entertainment
64279,This Is Not a Barbie Doll. This Is an Actual Human Being.,Entertainment
22432,"UPDATE: German trade slumps; exports, imports fall more than forecast",Economy
25166,Alien: Isolation DLC Will Reunite Sigourney Weaver and the Original 'Alien' Cast,Entertainment
36827,"BlackBerry Ltd Stock Tumbles After News of Apple, IBM Deal",Technology
32026,"Meet Android Wear, LG G Watch and Samsung Gear Live: Price, Specs  ...",Technology
28149,"Cuba says 50 cars, 4 motorcycles sold in 6 months since new law scrapped  ...",Technology
48397,"Eminem's ""Headlights"" Video: Watch",Entertainment
42249,World Trade Organization talks begin on almost $1 trillion green goods,Economy
49099,Regulators To Vote On Final Bank Leverage Rules,Economy
5985,"Report: NSA Knew of, And Exploited, Heartbleed Bug for Two Years",Technology
57071,Report: Climate change is here now,Technology
64265,"Kim Kardashian, Kanye West Vogue Cover 2014: See How the Internet Reacted",Entertainment
63924,'Unstoppable' loss of West Antarctic Ice Sheet prompts sea-level warning,Technology
21221,Inside Politics: D-Day for Obamacare,Economy
57526,"Sandra Bullock saw intruder from her bedroom door, affidavits say",Entertainment
26365,'Game of Thrones' recap: Tyrion Lannister on trial,Entertainment
5298,Stocks start the week with a lift,Economy
27267,Windows Phone 8.1: Microsoft finally gets it right,Technology
26086,"Netflix Orders Comedy Series with Jane Fonda, Lily Tomlin",Entertainment
