No,News Title,Category
49814,Robert Downey Jr.'s Son Arrested in WeHo for Cocaine Possession,Entertainment
37731,Workers in tech case likely to get $4K each,Technology
23691,"'Oculus,' 3.5 stars",Entertainment
6030,"Apple unveils cheaper 8GB iPhone 5c, brings back the iPad 4 and finally kills off  ...",Technology
36021,Archie Andrews shot to death,Entertainment
20035,Attorney general announces nearly $200 million settlement with Citigroup,Economy
24011,"American students are bad with money, and no one knows how to fix it",Economy
6000,"GLOBAL MARKETS-Shares trim losses, dollar dips after jobs report",Economy
53627,Anti-China riots: Over 3000 Chinese nationals evacuated from Vietnam,Economy
9798,Beyonce & Jay Z: It's Fantastic You Showed Your Commitment To Your Marriage,Entertainment
63593,WWDC 2014: five key points from Apple's address,Technology
29881,Judge jails 'remorseless' Rolf Harris for five years and nine months,Entertainment
50173,Here's Brad Pitt Tossing A Beer To Matthew McConaughey After Realizing They  ...,Entertainment
56467,Miley Cyrus granted restraining order against crazed fan,Entertainment
54156,"Iraq, Ukraine fighting keeps markets on edge",Economy
59164,Trade deal may make new cars cheaper,Economy
42348,Cellphone towers take on different disguises,Technology
27251,The Future of Football From the Couch: A Look at Virtual Reality,Technology
16839,Russia turns off the gas to Ukraine after failing to reach deal sparking EU price  ...,Economy
20982,"Verizon ends data for Chromebook Pixel, Google covers up",Technology
61235,"Barnes & Noble, Google team to offer same-day delivery",Economy
60729,Comet Making Its Five Year Loop Around Earth,Technology
6954,Harrison Ford's Injury From 'Star Wars: Episode VII' Filming Reportedly Worse  ...,Entertainment
36310,Eric Hill of 'The Bachelorette' passes away after accident,Entertainment
19815,Facebook drones to beam internet from the sky,Technology
3298,Harvard alum creates 3D makeup printer,Technology
1539,Watch These Instead:,Entertainment
31154,Canton man stuck in Vegas airport films Celine Dion music video,Entertainment
47089,Samsung announces breakthrough in graphene technology,Technology
13815,"As Apple buys Swell, here's 3 ""car tricks"" they can learn from the founding designer",Technology
37939,Apple said to be close to acquiring Beats for $3.2 billion,Economy
60735,Rolling Stones supporting Mick Jagger,Entertainment
27634,Handicapping the Fed,Economy
42856,X Men star 'Hugh Jackman' is inspired by 'Sachin Tendulkar's mental strength!!,Entertainment
50915,Friends of the Lodge attend X-Men premiere,Entertainment
1101,"Numsa, employers 'close to agreement' on wages",Economy
25961,Android Wear: Google pips Apple to the post with OS designed for the smartwatch,Technology
25012,Consider leaving fireworks to the professionals,Entertainment
53346,"Court Sides with BlackBerry, Halts Sales of Typo's iPhone Keyboard",Technology
14491,AT&T-DirecTV deal could spur more consolidation,Technology
33139,Bernard Madoff employees convicted of fraud,Economy
43294,Beyonce and JayZ finally reveal why Solange attacked him,Entertainment
34511,Fields Follows a Legend Leaving Ford in Prime Condition,Economy
29125,Rolf Harris guilty: entertainer thought he was 'above the law' say police,Entertainment
16389,Delhi disputes WHO 'polluted city' finding,Technology
63226,See the many faces of the HTC One's Dot View case,Technology
30936,Review: 'Transformers: Age of Extinction' 1/2,Entertainment
38925,What To Expect From Jon Favreau's New Movie 'Chef',Entertainment
10148,Powdered alcohol approved in America,Entertainment
3431,Kim Kardashian Fashion Style 2014: Kanye West and Baby North West's  ...,Entertainment
10125,Chris Brown trial could start Friday afternoon,Entertainment
59981,"Xbox Originals To Challenge Netflix, Hulu, Amazon",Technology
47729,German Exports to Russia May Shrink by One Quarter This Year – German  ...,Economy
21443,"Galaxy S5 gets water tested, plus more",Technology
57398,'Scandal' Season 3 finale recap: President Fitz Grant wins some and loses some  ...,Entertainment
64187,Mark Carney faces MPs over forex fixing investigation,Economy
64924,'Reading Rainbow' gets hand from Seth MacFarlane,Entertainment
20726,No Saving It: Rapper Who Cut Off His Own Penis Was Unable To Have It  ...,Entertainment
51470,Oculus acquisition: Why Facebook and not Google?,Technology
4761,'The Hobbit: The Battle Of The Five Armies' Teaser Trailer Released Online [Video],Entertainment
8673,IPCC Summary for Policy Makers on Climate Change Criticized by Coordinating  ...,Technology
35222,Tablet Shipments To Overtake PCs In 2015,Technology
5808,EasyJet Share Price: H1 Performance Expected Ahead Of Guidance,Economy
9669,Adobe Releases Free Voice App for iPad,Technology
58063,China manufacture index hits 5-month high,Economy
20208,"Terry Richardson: Sex, Lies, and Lohan",Entertainment
37015,The best Sony Xperia Z2 deals,Technology
36281,Mickey Rooney to be finally buried at 'Hollywood Forever' cemetery,Entertainment
23203,Today is the 100th birthday of an ag giant,Economy
24005,US Airlines Apologizes For Porn Tweet,Entertainment
55420,Boeing awarded $2.8 billion NASA contract,Technology
4563,US consumer confidence rebounds,Economy
26821,Boris Johnson: Pfizer takeover bid for AstraZeneca must not hit UK science,Economy
34119,Mozilla CEO ousting illustrates perils of inconsistency,Technology
15960,'22 Jump Street' review: Jonah Hill and Channing Tatum do it again and do it right,Entertainment
10105,Smith & Wesson shares plunge 15%,Economy
53715,Samsung's rumored release of their Project KQ shouldn't surprise you,Technology
25631,Priceline to buy restaurant reservation company OpenTable for $2.6bn,Economy
64584,"Major Google Maps update includes robust offline maps, Uber",Technology
18659,Modi was denied visa by previous government: John Kerry,Economy
36017,"BULLETS OVER BROADWAY Set for FSLC's FROM SCREEN TO STAGE, 5/5",Entertainment
16546,Celestial double feature to star lunar eclipse and Mars,Technology
47134,PMI in China is boosting riskier assets - Societe Generale,Economy
9451,US consumer confidence slips in March,Economy
31710,The Walking Dead Season 4 Finale Breaks Finale Records With 15.7 Million  ...,Entertainment
16626,New Prince album coming under Warner Bros. partnership,Entertainment
881,"5 Nikolaj Coster-Waldau projects, For April 24 Insider",Entertainment
59431,"UPDATE: Justin Bieber Detained At LAX: What Happened, Why Did Customs  ...",Entertainment
64888,Shareholders disappointed by AstraZeneca rejection of Pfizer,Economy
42203,"The Five Biggest Issues With the Playstation 4, and How to Avoid Them",Technology
48194,"New Verizon Wireless 'XLTE' Available on iPhone 5s, Galaxy S5, More",Technology
13306,Two Bergdahl-themed movies are in the works,Entertainment
29519,Report Shows Israeli Hedge Funds Punching Above Their Weight,Economy
5004,Did Twilight Star Nikki Reed Leave Husband Paul McDonald Over 'Money And  ...,Entertainment
41633,Apple shows off iPhone 5s multimedia creation prowess in 'Powerful' ad,Technology
19808,External Storage and more coming to Xbox One Next Month,Technology
36301,Federal wildlife officials to review Florida manatee status change,Technology
3446,Thousands of Chinese evacuated from Vietnam amid deadly riots,Economy
40643,30 Year Fixed Rate Mortgage Benefits Discussed In A New Loan Love Guide,Economy
61729,GM Recalls Another 430000 Cars For More Safety Defects,Technology
22037,"As Wedding Season Approaches, AG Schneiderman Issues Consumer Alert On  ...",Economy
46082,A whole new tune for Kim Kardashian,Entertainment
48212,Express Shares Surge as Sycamore Reports Stake -- Update,Economy
43934,Extra law enforcement patrolling the water this weekend,Technology
22882,Macaulay Culkin storms off stage while performing with The Pizza Underground,Entertainment
43169,"Microsoft, Oracle, IBM still rule enterprise software: But look out, here comes the  ...",Economy
47888,Homeland Security: Avoid Internet Explorer,Technology
60293,"Three weeks to go, Windows XP users don't care",Technology
19087,US agency urges private lenders to ease automatic default rules on student loans,Economy
39094,Gas prices rise 4.6 cents in last week,Technology
45902,"Beyoncé Seen Apartment Hunting In Chelsea Without Jay Z, Further Fueling  ...",Entertainment
55471,Dollar remains mixed vs. rivals after US data,Economy
38259,NAB president to FCC: Stop favoring broadband,Technology
39559,'Big Bang Theory' Cast Still In Contract Negotiations As Production Date Nears,Entertainment
13107,Amazon launches Amazon Dash for delivery of groceries,Technology
39345,Wanna marry Prince Harry? Be a part of this new show!,Entertainment
64870,US factory output rebounded in May after April dip,Economy
47369,Google I/O 2014: All you need to know about Android TV and Android Auto,Technology
60455,Cockeysville native launches to International Space Station,Technology
61792,Kanye West blames Annie Leibovitz for edited wedding photo,Entertainment
2135,"After hung jury, immediate retrial in Family Dollar clerk's slaying",Economy
58342,"Google acquires maker of Word Lens, plans to integrate its technology into  ...",Technology
58123,Second Market outbid in U.S. Marshals bitcoin auction,Economy
25426,The First Photo Of Henry Cavill As The Man Of Steel In 'Batman V Superman  ...,Entertainment
47786,Batman v Superman: Dawn Of Justice – First picture revealed of Henry Cavill  ...,Entertainment
32884,Amateur radio group holds informational event,Technology
21989,Review Round-Up for the Week Ending April 18 ...,Entertainment
56515,Microsoft to add print function to Office for iPad,Technology
9136,North Korea's take on new U.S. movie: 'An act of war',Entertainment
34856,Social Security closing offices as demand soars,Economy
25555,Apple sued over text messaging issues related to switching away from iPhone,Technology
12904,NJ Night Sky: Find the crescent Moon near Venus,Technology
28596,Metro Opens 10-Mile Stretch Of NB 405 Carpool Lane Through Sepulveda Pass,Economy
63778,Facebook study revives privacy concerns,Technology
6723,Inflation Rises to 1.9%,Economy
64055,Target's CEO exits,Economy
43785,"Paul Walker memorable in gritty, entertaining 'Brick Mansions' film",Entertainment
41493,Trinity Church in Waltham offers Holy Week services,Entertainment
52588,Brian May confirms new Queen Forever album to follow Adam Lambert tour,Entertainment
6569,"Taylor Swift Writes Op-Ed on the Music Industry: ""Music Should Not Be Free""",Entertainment
6175,Legendary Actress Ruby Dee Dies at 91,Entertainment
36968,George Clooney rings in with a 7-carat diamond for fiancee Amal Alamuddin,Entertainment
7749,Windows XP: Era of Microsoft as bogeyman is over,Technology
21635,Samsung Galaxy Note 3 vs. Samsung Galaxy Note 4 – Comparison of Features  ...,Technology
15935,Hollywood Great Mickey Rooney Dies At 93,Entertainment
40031,"Report: Satellite TV companies Dish, DirecTV contemplate merger",Economy
22473,Residents face tax deadlines,Economy
32865,Smartphone Madness 2014: Samsung Galaxy Note 3 vs. Sony Xperia Z2,Technology
49216,30-Year Mortgage Rates: PNC Bank Mortgage Interest Rates for March 12,Economy
11417,Robin Williams maintains his sobriety with ongoing 12-step treatment in Minnesota,Entertainment
21742,Wale Held Back During WWE Fight Because Children Were Around,Entertainment
15305,Wall Street Sputters at All-Time Highs,Economy
42552,Microsoft Rushes to Fix Bug,Technology
62092,Emotion proves contagious on Facebook,Technology
6378,Game of Thrones latest episode a shocker to all and a celebration for many  ...,Entertainment
16723,June Car Sales Shatter Expectations–End First Half On A Strong Note,Economy
38399,First 'Teenage Mutant Ninja Turtles' Live Action Movie Footage Arrives [Video],Entertainment
52109,"Trending: Paisley Protestor Selfie, Golf Cliffhanger, Mariah's Park Trip",Entertainment
44771,"'Winds Of Winter' Spoilers, Release Date: George RR Martin Teases More  ...",Entertainment
42008,Microsoft Looking To Get A Piece Of The Smartwatch Pie Too,Technology
20669,'Magic In The Moonlight': Woody Allen's New Muse Emma Stone Dazzles In  ...,Entertainment
3233,Justin Bieber talks about 'joining the Klu Klux Klan' in disturbing new video,Entertainment
16689,Business Is Booming In The US,Economy
48486,Andi Dorfman's Engagement Ring Revealed & It's HUGE! (PHOTO),Entertainment
10193,TV's '24'-hour hero returns with '24: Live Another Day',Entertainment
23204,Samsung Galaxy S5 Is A Small Upgrade From Galaxy S4,Technology
19532,T. rex to arrive in DC on Tuesday morning,Technology
6877,Euro zone manufacturing PMI hits 7-month low of 51.9 in June,Economy
4584,Hilary Duff Is 'Chasing The Sun' In Her Brand New Video,Entertainment
7664,"Power restored to nuclear plant in Waterford, Connecticut after outage",Economy
64641,Homebuilder confidence surges nationally,Economy
42051,Sir Mick Jagger rejects 'horrible' claims he had broken up with girlfriend L'Wren  ...,Entertainment
47021,"Gazprom goes to China, Russia's economy rejoices",Economy
21384,'Game of Thrones' Season 4 Finale Made More Shocking By Absences,Entertainment
33024,Drone nearly collided with passenger plane,Economy
31337,Casey Kasem remembered as an island of calm in swirl of pop music,Entertainment
51741,Jeep® Brand Sets Third Consecutive Monthly Global and U.S. Sales Records,Economy
44165,Twitter reaction to concert cancellation,Entertainment
62057,Apple And Google Settle Patent Lawsuit,Technology
23379,Mary Rodgers Guettel,Entertainment
54668,Not just Rajeev Suri: Indian CEOs leading technology companies worldwide,Economy
47496,Beyonce Turns Up the Sex Factor in Buttock Baring Bodysuit for On The Run Tour,Entertainment
33836,"Visuals, action keep 'Noah' afloat",Entertainment
44624,Poll: What does Mother's Day mean to you?,Entertainment
45468,"No relief in sight as gas prices in BC, Eastern Canada reach record levels",Technology
8927,"Apple's halves iPhone 5C memory, slashes price in UK and Europe",Technology
33985,"Miley Cyrus' 'Bangerz' tour bus catches fire, no one hurt",Entertainment
38419,"PepsiCo's profit rises on snack sales, price hikes",Economy
2176,Obama: 9/11 museum 'Sacred place,Entertainment
9491,NASA approves two-year mission for planet-hunting Kepler telescope,Technology
22631,"Atlantic City casino shutdowns needed, analysts say",Economy
45173,Inflation rate drops to 7.7% –NBS,Economy
31853,Jim Cramer's Mad Dash: SYMC,Economy
8698,'Game of Thrones' screening draws throngs of fans to Brooklyn,Entertainment
6730,Robin Williams re-enters rehab to maintain his 'focus' on continued sobriety,Entertainment
40078,BBM crosses 85 million monthly active users,Economy
2202,Met cancels broadcast amidst anti-Semitism row,Entertainment
51819,How Will Credit Suisse (CS) Stock Respond As Pressure Grows For CEO  ...,Economy
62304,US Airways Tweet: 10 Worst Tweets From Company Twitter Handles,Entertainment
58532,Sneak Peek at Kim Kardashian's New Video Game [WATCH],Entertainment
8262,Flash Boys' Ends May Justify Lewis' Means,Economy
38854,Shell profit falls 3pc on lower production,Economy
14061,Snapchat valued at US$10b: reports,Economy
20295,Publicis and Omnicom Call Quits on Merger,Economy
50734,EPA Moves to Thwart Huge Alaskan Copper and Gold Mine,Economy
35199,Cisco to Invest $1 Billion in Global Cloud Network to Accelerate the Internet Of  ...,Technology
55260,LOOK! Kelly Clarkson gives birth to baby girl River Rose Blackstock,Entertainment
58699,BofA Gets Tangled Up in Wall Street Web,Economy
63785,Energy officials downgrade Monterey Shale oil reserves by 95.6%,Economy
51130,Rebound Rally: S&P Jumps 2.7% in Holiday-Shortened Week,Economy
43848,France Sees Fairer BNP Settlement as US Talks Progress,Economy
31008,Earth-like distant planet found,Technology
36618,Make Way For The Birthday Girl! How Do You Think Khloe Kardashian's Party  ...,Entertainment
98,Bond yields stick to low levels to the amazement of analysts,Economy
41391,Microsoft Officially Completes Acquisition of Nokia Devices and Services Business,Technology
29337,Fascinating fact:,Entertainment
20712,Growth in UK manufacturing activity slows,Economy
56825,Google Doodle celebrates invention of the Rubik's Cube,Technology
33099,'Game of Thrones' director explains Lady Stoneheart finale decision (book spoiler),Entertainment
58802,The Assembly trailer shows designed-for-VR Project Morpheus first,Technology
55479,Author Maya Angelou Dies At 86,Entertainment
32387,Faith calendar: April 19,Entertainment
61154,U.S. government helped fund Facebook experiment that manipulated users  ...,Technology
20173,Google's Smart Contacts Closer to Becoming a Reality,Technology
45743,"Asia Pacific Market: Stocks slip on Fed rate hike woes, poor US and China data",Economy
47481,S&P 500 closes at record after manufacturing data,Economy
23855,"Kim Kardashian, Kanye West honeymooning in Ireland?",Entertainment
52879,"VMAs' Top Moments: Miley's Homeless Man, Beyonce, More",Entertainment
28296,China's H-Shares Enter Bear Market While Yuan Weakens,Economy
14595,China trade balance signals improvement,Economy
60708,BlackBerry Ltd (BBRY) the Biggest Loser of Apple Inc. (AAPL) -International  ...,Technology
62548,"Jack White Claims ""World's Fastest Released Record""",Entertainment
60499,Sony warns of battery fire risk in Vaio PCs,Technology
53747,The Gospel of Jesus' Wife Enters the Limelight,Entertainment
9918,Barack Obama's Asia Pivot Tested by China's Bold Maritime Claims,Economy
18796,Illinois woman Julia Collins' win streak on 'Jeopardy' ends,Entertainment
31442,"US Stocks Fluctuate as GE Offsets Google, IBM Miss",Economy
46060,Pfizer Profit Drops 15% As It Continues Push For AstraZeneca,Economy
39079,London shares rise at LSE jumps after Russell deal,Economy
13919,VIDEO: George Popped the Question! Find Out What Happens Next on  ...,Entertainment
34161,Barnes & Noble Inc.: Barnes & Noble Reports Fiscal 2014 Year-End Financial  ...,Economy
29370,Shell's profits halve in Q1,Economy
11513,CBS earnings rise despite lower advertising sales,Economy
53526,Night Falls on Civilization on Earth Hour,Technology
30481,Ben Savage Talks Cory and Topanga's First Kiss — Relive the Moment!,Entertainment
23537,Marvel's Thor is now a woman and it's awesome,Entertainment
64389,BES retail clients' exposure to holding company debt cut to 651 mln euros,Economy
54214,Demi Moore Is Finally Over Ashton Kutcher All Thanks To A Little Unborn Bundle  ...,Entertainment
14143,Michaels Security Breach Affected 3 Million Card Holders,Economy
54358,Planes spot objects after search for MH370 moves north,Economy
49968,Orange Is The New Black Season 2 Trailer Is Next-Level Crazy,Entertainment
56123,Daily FX Analysis,Economy
54651,'14 elephants in weight': Remains of giant dinosaur found in Argentina,Technology
56264,Supreme Court Hampers EPA on Greenhouse Gases But It Could Have Been  ...,Economy
40953,Astronomers Spot new type of planet - 'Mega Earth',Technology
5701,Break Out The Matzo: Passover Has Begun,Entertainment
15614,SAC record $1.8-bn insider plea caps 7-year probe,Economy
55574,Toyota Settles With U.S. for $1.2B,Technology
28768,Hong Kong hits back at Chinese media over unofficial democracy poll,Economy
9018,Olivia Wilde gives birth and reveals name of newborn baby boy,Entertainment
5230,Facebook Introduces LGBT Stickers for Pride,Technology
14933,LG launches G3 Android smartphone to take on Samsung Galaxy S5,Technology
23169,"Microsoft Discontinues Android, Asha and S40",Technology
30460,Amazon offers employees up to $5k…to quit their job,Economy
95,Justin Bieber sorry for racist joke,Entertainment
8467,"Court delay for 'Shield' actor charged with murder - NewsOn6.com - Tulsa, OK  ...",Entertainment
31845,"Google have released their wearable technology device, Glass, in the UK.",Technology
48607,What is the Uber app: London black taxi cab strike explained,Economy
39362,European Stocks End Choppy Day in Black,Economy
36780,Candy Crush maker prices IPO,Economy
59773,YouTube in talks to buy game streaming service Twitch for $1B,Technology
14891,A truly special Mother's Day,Entertainment
49518,Heartbleed: Huge Internet Security Flaw Puts BTC Exchanges in Frenzy,Technology
50846,OVERNIGHT ENERGY: UN report adds urgency to climate fight,Technology
19805,Hairy Hijinks! Kim Kardashian Reveals New Blonde Look Is Actually 'Just A Wig!',Entertainment
23956,Heartbleed fixes taking longer as websites work to plug gaps,Technology
29081,Wolfson sold to US rival in £278m deal,Economy
34972,New Movies Mar. 28-30: Can 'Divergent' Hold Back 'Noah'?,Entertainment
64204,Protests of Staples postal counters will include two area locations,Economy
3471,MoMA Announces Björk Exhibition in 2015,Entertainment
54867,"Suspense, action tense in 'Mars'",Entertainment
58095,Craig Ferguson Announces He's Leaving “The Late Late Show” in December,Entertainment
4426,The article requested cannot be found! Please refresh your browser or go back  ...,Entertainment
27184,Pussy Riot Debunks Giant 'Spring Breakers' Rumor,Entertainment
17666,Justin Bieber defended by Floyd Mayweather: 'We all make mistakes',Entertainment
19048,Hirings give stocks new highs,Economy
52983,Twitter (TWTR) Stock Pops After COO Departure,Economy
10972,Google to open up wearable IT market with developer SDK release,Technology
50457,Google turns over less user data as government requests rise,Technology
55688,Sound Off: Lord & Miller's Sequel '22 Jump Street' - Your Thoughts?,Entertainment
23345,Unpacking the 'Mad Men' Premiere: Can Don Draper Ever...,Entertainment
32788,Garth Brooks statement of 'five shows or no shows' seen as blackmail,Entertainment
49560,Spacewalkers replace failed computer outside space station,Technology
30607,"First footage from The Hobbit: The Battle of the Five Armies, teaser trailer coming  ...",Entertainment
29030,CORRECTED-NY Met Opera proposes federal mediators in bitter labor dispute,Entertainment
54631,Russia says all Kiev troops are out of Crimea,Economy
53409,Mptf - Bosses Of The Night Before The Oscars Bash Join Beverly Hills Hotel  ...,Entertainment
37163,CHINA: Manufacturing output up thanks to new orders,Economy
34313,"GM Passed on Ignition-Switch Fix in 2001, Advocates Say",Economy
52038,Shia LaBeouf Admits Himself to Rehab,Entertainment
59394,Researchers find world's biggest flying bird fossil,Technology
45685,Billionaire capitalist gives away patents to save environment,Technology
35213,US economy grew at 2.6 per cent rate in 4Q as consumer spending rose faster  ...,Economy
60903,Here Are the Kim and Kanye Wedding Photos You Secretly Want to See!,Entertainment
59280,Capitalists Take on Climate Change,Economy
52266,"King profits are up from last year, but down from recent quarters",Economy
20559,Pokemon Master | Google Teases Dream Job (On April Fool's Day),Technology
3668,Auto dealers to Texas Legislature: Don't make exceptions for Tesla,Economy
8213,E3 2014: Day 2 Highlights from Electronic Entertainment Expo,Technology
28559,Russian Stocks Drop as Gazprom Slumps After Ukraine Talks Fail,Economy
33233,2014-05-23T00:33:00Z Film review: GodzillaBy BRENT NORTHUP Film Review  ...,Entertainment
19046,Amazon reportedly planning ad-supported video streaming service,Technology
14696,BlackBerry posts $423M US quarterly loss 0,Technology
45609,Facebook-WhatsApp deal cleared by FTC,Technology
58325,"BlackBerry CEO proves he's a turnaround expert, but is time running out?",Economy
18905,Girls Gone Wild Producer Arrested on Assault Charge,Entertainment
36534,Argentina on the brink as debt talks collapse,Economy
53195,"Hercules Trailer Debuts, Immediately Trends On Facebook",Entertainment
36419,"SolarCity acquires solar manufacturer Silevo for $200 million, plans multiple  ...",Economy
10749,China to double yuan trading band against dollar,Economy
56002,U.S. stocks: Standard & Poor's 500 index closes above 1900 for first time,Economy
27697,Samsung to launch 5.9-inch Galaxy Mega 2,Technology
1383,Chris Harrison Says Juan Pablo Confirmed and “Didn't Deliver” ATFR Surprise,Entertainment
20977,Apple introduces cheaper version of the iPhone 5C with 8GB storage,Technology
56251,West Orange Jewish Community Prepares for Start of Passover,Entertainment
9711,Here's One Way to Help Prevent Another Jet From Disappearing,Economy
8607,Comcast Adds 24K Video Subs in Q1,Technology
59998,Interview: 'Your Mother' Cristin Milioti talks sitcom finale,Entertainment
3568,WHAT! Pharrell Debuts A New Helmut Hat At The BET Awards!,Entertainment
8823,"Richard Attenborough dead, aged 90",Entertainment
10973,Summer TV preview,Entertainment
36540,Businessweek hijacks Samsung Galaxy S5 launch to highlight...,Technology
56525,OMB Projects Bigger Returns on Fannie and Freddie,Economy
29479,"Samsung Galaxy Spin-offs Include S5 Zoom, Mini, Prime?",Technology
10270,EXCLUSIVE: Lou Ferrigno Says He's Back To Voice THE HULK in AVENGERS  ...,Entertainment
30777,Pfizer's History in UK Offers Hope for AstraZeneca Jobs,Economy
22114,'Bachelorette' Andi goes on creepiest date ever,Entertainment
13641,Why Cosmos Can't Save Public Support for Science,Technology
29293,Get free tickets to 'Million Dollar Arm',Entertainment
65519,Video of mother bear rescuing cub from side of BC highway garners more than  ...,Entertainment
54906,[Ticker] ECB keeps key interest rate unchanged,Economy
32808,Medicare hospital fund to last four years longer,Economy
22014,"Miley Cyrus' Bangerz tour bus catches fire, everyone is safe",Entertainment
34720,Kerry Washington Talks About Hiding Her Pregnancy During Scandal Filming,Entertainment
27265,"Rajat Gupta, ex-Goldman Sachs director, starts prison term on 17 June",Economy
19592,"Fiat SpA trims share price decline, Chrysler US sales surge 20%, posts best July  ...",Economy
43678,The new high crime is disagreement,Technology
45171,Musk Plans Tesla Patent Move After Hint of Sharing With Rivals,Technology
358,Bossier City man appears in Taco Bell commercial,Economy
