No,News Title,Category
8664,China leader says debt defaults 'hardly avoidable',Economy
47838,Fans slam Kanye West over rape remark,Entertainment
61316,Ham radio enthusiasts hold Field Day this weekend,Technology
19622,JC Penney beats expectations as sales improve,Economy
34114,Angie's List new sponsor of GP of Indy,Entertainment
21701,"Johnny Depp Confirms Amber Heard Engagement: My ""Chick's Ring"" Is a ""Dead  ...",Entertainment
51033,China manufacturing improves in May: survey,Economy
35758,EXCLUSIVE CLIP: Shockers Cameron Diaz won't tell mom in Sex Tape,Entertainment
3586,Fleetwood Mac to launch North American tour with both Christine and John McVie,Entertainment
57598,Springsteen among those to fete rock hall of fame class,Entertainment
59402,Chief accepts ALS ice bucket challenge,Entertainment
38202,Samsung Releasing New Line of Tablets to Rival Apple's iPad Air and iPad Mini,Technology
38375,"Nokia unveils new CEO, starts new era with profit beat",Economy
45793,Cosmic inflation finding first predicted by JHU cosmologist,Technology
39693,Longview students showcase diversity on Cinco de Mayo,Entertainment
11083,"SpaceX Will Protest ""Monopoly"" on U.S. Government Military Satellite Launches",Technology
27615,"MTV Movie Awards will be fiery, naked, apocalyptic display",Entertainment
7715,Facebook Inc. (FB) 1 Billion Mobile Users Brought 59% Of Q1 2014 Revenue!,Economy
21741,"Miley Cyrus Jokingly Attacks Avril Lavigne -- ""Dumb F--kin' Bitch!"": Watch Here!",Entertainment
21217,Toyota's departure for Texas a major blow to regional economy,Economy
41553,Kodiak Oil & Gas Shareholder Alert - Buyout Of Kodiak Oil & Gas Corporation  ...,Economy
10027,Facebook defends secretly manipulating users,Technology
41884,US mayors to vote on climate change resolution,Technology
35852,Sopranos Creator: Tony Didn't Die,Entertainment
14730,"Rick Ross, Jeezy Lead the Charge in 'War Ready' Video",Entertainment
38509,Ag markets quiet ahead of today's big USDA reports,Economy
39823,Kanye Raps About How Awesome Kim Is On Future's 'I Won',Entertainment
52568,"Apple Introduces Less Expensive, Lower-Powered iMac",Technology
6202,"See Chris Christie, Jimmy Fallon Dance Around Testy Issues",Entertainment
7529,New Fed Chief Faces Reporters,Economy
63031,"Drone Almost Hit Airliner Over Florida in March, FAA Says",Economy
63131,The November Man Review,Entertainment
65473,"Absorbent and porous and now in 3-D, it's the trailer for a new SpongeBob Movie",Entertainment
2496,"Razer unveils its own microconsole, with a focus on games",Technology
4415,Attenborough had one more story to tell,Entertainment
24987,Draghi Drives ECB Toward Stimulus Even as GDP Grows: Economy,Economy
863,Colorado Governor signs child-resistance packaging law for marijuana,Economy
19041,Solange and Jay-Z Explain Their Elevator Fight on SNL,Entertainment
50695,'Neighbors' Spanks Spidey in $51 Million Box-Office Blowout,Entertainment
36967,Market tumble set to continue on Friday,Economy
1652,Carbon cuts possible for manageable warming: experts,Technology
14774,Watch: Random act of kindness goes viral,Economy
6929,Tesla CEO plans solar production facility for Buffalo,Economy
3784,Ann B. Davis of The Brady Bunch fame has died,Entertainment
2677,Watch As Outkast Reunites For Day 1 Of Coachella 2014 (VIDEO),Entertainment
3870,Frankie Knuckles dies aged 59,Entertainment
8408,"Fiat shareholders vote in favor of Chrysler merger, shifting center of gravity from  ...",Economy
41597,Photo Release -- NASDAQ Welcomes Weibo Corporation (NASDAQ:WB) to The  ...,Economy
46481,Rowling resurrects Potter,Entertainment
48168,Twitch arrives on Xbox One as Titanfall crashes down,Technology
65352,BREAKING: Inflation Falls to Four Year Low,Economy
60264,Microsoft too late in bringing Office to iPad?,Technology
32976,LinkedIn shares rally as results beat estimates: Live blog recap,Economy
64099,Beyonce & Jay Z After Solange Knowles Attack: 1st Appearance Since Fight Video,Entertainment
22424,First Artwork for The Walking Dead Season 5 Arrives Early,Entertainment
10970,"Apple reports $45.6 billion revenue for Q2 2014: 43.7m iPhones, 16.3m iPads  ...",Technology
31958,Heart Bleed OpenSSL Computer Virus Update: Security Bug Found by Google  ...,Technology
45600,`Chief Yahoo` David Filo returns to board,Economy
15912,UPDATE 2-'Shield' actor Michael Jace arrested for murder of wife,Entertainment
15411,Game of Thrones rape scene: George R. R. Martin says 'whole dynamic' was  ...,Entertainment
50726,Amateur sleuths can now dive in to complete MH370 data,Economy
45294,"Chris Brown, Justin Bieber granted delays in court dates",Entertainment
19393,Violence flares at QPR v Latics,Technology
8197,VIDEO: Watch FROZEN Characters Dance to Michael Jackson Classic 'Thriller',Entertainment
19384,"Chiquita, Ireland's Fyffes merge, become top banana supplier",Economy
21886,Miley Cyrus Cracks Crass Date Rape Joke That's Anything But Funny (VIDEO),Entertainment
59774,Carmakers to build $1.4 billion Mexico plant,Technology
34268,Faster production brings Boeing $965M 1Q profit - KTVN Channel 2 - Reno  ...,Economy
11727,Robert De Niro opens up about the struggles of his gay father,Entertainment
55020,Japan's Honda recalls more than 2m cars over airbag defect,Technology
37205,Listen: More brand new Michael Jackson music hits the web,Entertainment
49568,Water quality at NC beaches ranks among best,Economy
28287,Zendaya out of Aaliyah film,Entertainment
48635,Amazon Earnings: A Sneak Peek,Entertainment
59518,Obama issues dire warning on climate change,Technology
37259,"T-Mobile, Sprint merger delayed: May not happen before September",Technology
14111,See Meryl Davis and Charlie White Kill It On <i>Dancing With the Stars</i>,Entertainment
35801,All the Running Gags We Want to See on the How I Met Your Mother Finale,Entertainment
25310,Jet nearly collided with drone over Florida: FAA,Economy
47830,24-year-old woman Claire Leeson has spent thousands on plastic surgery and  ...,Entertainment
59368,First Quarter GDP Plunge A Reminder Of Perilous Economy For Millions Of  ...,Economy
43364,It's a flame retardant and it's been in your Coke! Not for much longer,Economy
40327,"Samsung Brings Galaxy S5, Wearable Devices to Nigeria With Promise",Technology
1243,RBI Open To Merger Of Banks: Rajan,Economy
12433,Transformers: Age of Extinction Has Biggest Opening Weekend of the Year,Entertainment
56195,Cast member Brooks Wheelan fired from 'SNL',Entertainment
8433,"Rapper Severs Penis, Jumps off Building in Apparent Suicide Attempt",Entertainment
7766,"At Easter, take heed of stirring of spirit",Entertainment
9039,What's a beleaguered utility do when forced by the government to close its  ...,Economy
17425,Beyonce Featured on Cover of TIME Magazine's '100 Most Influential People List',Entertainment
3982,"Tesla Beats on Earnings and Revenue, and Everything Is on Schedule",Economy
44420,'Blood Moon' Lunar Eclipse Wows Skywatchers (PHOTOS),Technology
9381,Stars come out for Peaches' funeral,Entertainment
18324,First Trailer from the new Peanuts Movie!,Entertainment
40767,Coach sales drop as handbag market heats up,Economy
47119,Stephen Colbert to Host 'The Late Show',Entertainment
2621,"Kanye, Kim Recite Vows",Entertainment
57182,Fleetwood Mac Unveils Full Reunion Tour,Entertainment
14279,Selena Gomez Ended 'Toxic Friendship With Kendall And Kylie Jenner After  ...,Entertainment
62103,This Bravo TV Star Is Dating Richard Gere! Hot Hookup Details HERE!,Entertainment
35767,Weibo (WB) Stock Rises After IPO,Economy
14282,Jolie and Pitt Might Be Working on Another Movie,Entertainment
49601,James Corden: One Direction have dealt with their mistakes much better than  ...,Entertainment
52533,Robert Downey Jr. shares first image from set of 'The Avengers: Age Of Ultron',Entertainment
59748,'Guardians Of The Galaxy',Entertainment
59126,"Leaked 'Star Wars VII' footage fake, but fantastic",Entertainment
43272,Sister of L'Wren Scott to be barred from funeral of Sir Mick Jagger's girlfriend  ...,Entertainment
42320,Unrest in Iraq drives up gas prices,Technology
60637,Affordable Care Act advocates hope March 31 individual mandate sign-up date  ...,Economy
56220,Adobe Launches New 'Photoshop Mix' App for iPad,Economy
63351,European Union leaders react to election results,Economy
61021,Microsoft challenges US on overseas data,Technology
38291,Another character bites it on 'True Blood',Entertainment
32612,IRS Decision to Treat Virtual Currencies as Property is a Mixed Blessing,Economy
4936,Waters: Majority of House Supports Renewing Export-Import Bank,Economy
61293,Mayor intentionally drops the F-Word after Stanley Cup Win,Entertainment
35159,"Fannie Mae, Freddie Mac: Johnson-Crapo First Loss Provision Analysis",Economy
54805,Microsoft Xbox One game console rolls out in China in September,Technology
49973,Officials: Complacency drives hike in water use,Economy
1625,Royal Wedding Fever! Cressida Bonas And Prince Harry Engagement Rumours  ...,Entertainment
46447,"Netflix, ARRIS stocks slide on Apple-Comcast rumours",Technology
60079,New York college offering Sociology course on Miley Cyrus,Entertainment
30160,"Recalls bring the company's total for the year to 48, covering more than 20  ...",Technology
62941,Zooey Deschanel Simply Stuns At The Met Gala!,Entertainment
34298,Indexes End Lower As Russia Sanctions Hit Stocks,Economy
11977,Miley Cyrus fans ambivalent over buying tickets again,Entertainment
43274,"Etihad, Alitalia confirm equity stake sale",Economy
15727,"Microsoft Surface Pro 3 Launched as iPad Air, MacBook Air Challenger",Technology
26797,Japanese pop group attacked by man with saw,Entertainment
47295,Malaysian tourism authority downplays MH370 disappearance,Economy
5209,"China BANS Windows 8, blames Windows XP",Technology
6137,"Microsoft earnings down, but above expectations",Economy
12498,"Apple awarded $119M, but who's winning the fight?",Technology
45783,Kim & Kanye Aren't The Only Ones! Most Expensive Celebrity Weddings,Entertainment
1688,TiVo for People without Cable,Technology
817,Goldman Turns Less Bearish On Tesla Motors – TSLA,Economy
62168,Daily Mail Apologise For Story Surrounding George Clooney's Marriage,Entertainment
31091,Samsung Wants To Use Google's Might To Battle Apple in Court,Technology
35017,Faith-based alternative to Fifty Shades Of Grey to put God deep inside you,Entertainment
25714,Ryan Lewis Asks Strangers What He Does,Entertainment
41505,F-35 Fighter Jet Fails to Debut at Farnborough Airshow Opening,Economy
15103,Twitter celebrates eighth birthday with #FirstTweet tool,Technology
20997,Ford Profits Fall But Revenue Beats Expectations,Economy
16424,Christians prepare for their holiest day,Entertainment
50033,Confirmed: Jason Momoa Will Play Aquaman in Batman v Superman: Dawn of  ...,Entertainment
56008,Apple poaches another luxury executive as iWatch nears,Technology
30567,"Mortgage Rate Improvement Today at Citibank, Wells Fargo Jun 28, 2014",Economy
21967,The Walking Dead: Rick Grimes is back,Entertainment
29921,"US employers add 209K jobs in July, black unemployment rate rises slightly",Economy
49396,VIDEO Chris Brown ordered to stay in jail until April 23,Entertainment
20976,Posted by Shoaib-ur-Rehman Siddiqui,Economy
60051,US Federal Reserve slows bond buying,Economy
43679,Bombay Bicycle Club & diss 'bizarre' One Direction & Netmums address Zayn  ...,Entertainment
18897,Guard trampled at Ultra Fest in Miami has serious injuries,Entertainment
41248,Chris Harrison: Don't Hold Your Breath For A Gay Or Chubby Bachelor,Entertainment
31122,Netflix raises new member monthly fee by $1,Technology
51642,Freebies for Tax Day 2014!,Economy
20436,Dow Jones Industrial Average Closes Above 17000 for the First Time Ever After  ...,Economy
48735,Craig Ferguson to leave 'Late Late Show' at end of 2014,Entertainment
17024,Google Buys Startup Behind Visual Translation App Word Lens,Technology
61460,"Bing implements 'right to be forgotten' ruling, asks applicants 'are you famous?'",Technology
40417,Holy Chic! Alexander Wang Announces Collaboration With H&M (DETAILS),Entertainment
1506,Twitter restores TweetDeck after security flaw,Technology
7378,"From Sexercise to Andy Cohen, the 6 Stages of Lady Gaga's 'G.U.Y.' Video",Entertainment
24888,One Bidder Walks Away with All of the Bitcoins from the Feds' Silk Road Auction,Economy
61716,Mila Kunis Pregnant: 'Jupiter Ascending' Actress Glows on the CinemaCon Red  ...,Entertainment
6707,Loose 'Brick Mansions' is split by too many cracks,Entertainment
58303,He's Here! Smithsonian's New T. Rex Arrives,Technology
62395,Maryland Votes To Adopt CT Health Exchange System,Economy
47378,Nicki Minaj vs. Iggy Azalea! Video Of BET Awards Speech Slams Rappers Who  ...,Entertainment
40014,"Facebook Adding Nearby Friends Feature To Apps For IPhone, Android",Technology
7853,Corn waste fuel 'not better than petrol',Economy
33162,Apple Reportedly Plans to Introduce Wearable Device on Sept. 9,Technology
15425,Sara Gilbert and Linda Perry Tie The Knot In Secret Oceanfront Wedding,Entertainment
34835,How to save big bucks on Office 365,Technology
1662,'The Powerpuff Girls' to return to Cartoon Network,Entertainment
61418,Toby Kebbell Chosen for Dr. Doom Role in Fox's New 'Fantastic Four',Entertainment
22383,Kim Kardashian Spending One Month In Paris To Plan Her Wedding,Entertainment
1750,UnitedHealth Group Trading Up 3.7% After Better-Than-Expected Earnings (UNH),Economy
42341,Google's latest tablet will capture images in 3D,Technology
61473,Hayden Panettiere Confirms She's Having A Girl!,Entertainment
33625,Texas huntress stirs controversy with photos of African kills,Entertainment
20217,EU widens tax investigation into multinationals: source,Economy
18386,Idina Menzel Name Flub Righted by John Travolta's Flower Delivery (Video),Entertainment
41960,Amazon bullies publishers as work on its informational dystopia continues,Technology
59297,Theron: I gave McGregor film job,Entertainment
22218,'Draft' a bit predictable,Entertainment
47335,Garth Brooks cancellation is a disaster for Dublin and decency,Entertainment
58712,Google Glass banned in UK cinemas,Technology
43594,Samsung Profits Dip by 25 Percent,Economy
28829,Smart Talk: Beyond the challenge -- what to know about ALS,Entertainment
43002,Kanye West: People Didn't Understand His Interracial Relationship,Entertainment
45313,Verizon and AT&T Argue Over Wireless Auction Rules with FCC,Technology
18709,Target boss is finally OUT five months after hackers hit 70 million customers,Economy
13714,Memorable Billboard moments,Entertainment
49822,iPhone 6 vs. Samsung Galaxy S5: Specs Comparison,Technology
27361,Why Is Lindsay Lohan Wearing a Tacky Wedding Dress?,Entertainment
63982,Danica McKellar and Val Chmerkovskiy – Cha Cha – Dancing with the Stars 18  ...,Entertainment
47120,Justin Bieber Detained For Questioning At LAX,Entertainment
2384,Georgia authorities plan heightened alerts for BUIs heading into July 4th with  ...,Technology
19504,Microsoft Games Studios' Phil Spencer Now Leading Xbox Team,Technology
25038,Beyonce & Jay Z Reportedly Plotting Joint Summer Tour,Entertainment
42179,"Barclays, StanChart and the LSE are Europe's Stocks in Focus",Economy
8314,South Central Ohio gas prices up,Technology
38300,Amateur Night,Entertainment
24392,Pricey Microsoft Surface Pro 3 Works as Tablet and Laptop,Technology
45308,Barack Obama and Bill Clinton among those paying tribute to writer Gabriel  ...,Entertainment
65225,"García Márquez, master of magical realism, dies at 87",Entertainment
37168,NY Times: Alibaba Files to Go Public in the US,Economy
37425,"Microsoft's crusade against malware advances to Kuwait, Algeria",Technology
41112,Samsung Galaxy Note 8.0 vs iPad Air: Stylus Is Deciding Factor,Technology
7155,"Amazon Streaming Service Prime Music Launches: Full of Playlists, Lacks  ...",Entertainment
61842,"Morning Buzzers - Real Goods Solar, Inc.(NASDAQ:RGSE), J.C. Penney  ...",Economy
55904,US charges FedEx with knowingly helping illegal pharmacies by delivering  ...,Economy
24358,LSE plans rights issue to fund Frank Russell bid,Economy
32483,"Not the Best Of the Muppets, But Still Pretty Good",Entertainment
60137,OKCupid protests Mozilla CEO's anti-same-sex marriage stance by denying  ...,Technology
11672,"The Zacks Analyst Blog Highlights: Yahoo, Google, Twitter, Facebook and Rovi",Economy
10286,"Miley Cyrus's homeless 'hero' accepts her Video of the Year award, celebrate  ...",Entertainment
21785,Getting Creative in a Low-Volatility Market,Economy
15695,Kate Winslet honoured on Hollywood Walk of Fame,Entertainment
36214,Candy Crush Maker King Digital Sets IPO Price,Economy
57393,Ryan Gosling's Bizarre Directorial Debut,Entertainment
6159,How Thailand's Military Coup Could Harm The Country For Years To Come,Entertainment
436,General Mills (GIS) Facebook Backlash: Could Arbitration Fairness Act Nullify  ...,Technology
22880,James Beard award nominations announced,Entertainment
502,Your smart contact lenses can measure diabetes,Technology
24859,IPhone 6 rumors could be hurting Apple phone sales,Technology
44031,"Big Win for Bees, But the Battle's Far From Over",Technology
6010,Earth to Echo Movie Review,Entertainment
12563,Cloud data storage startup Box files for IPO,Economy
12635,BP crews contain Lake Michigan oil spill,Economy
16100,"Galaxy S5 to be available in India from April 11, price starting at Rs. 51000",Technology
38009,Scientists Report Evidence for Gravitational Waves in Early Universe,Technology
55231,Kim Kardashian & Kanye West: When Will Their Wedding Be? See Itinerary,Entertainment
41116,Snow White and the Huntsman Sequel May Minimize Snow White,Entertainment
27656,Google Has Posted A Fully Functional Rubik's Cube As Today's Google Doodle,Technology
13097,Sarah Michelle Gellar Slams Kim Kardashian And The  ...,Entertainment
64474,"Liam Hemsworth, Miley Cyrus Breakup News 2014: 'Mockingjay' Actor and  ...",Entertainment
49249,Film Clip: 'A Million Ways to Die in the West',Entertainment
57798,250 New Emojis Coming this July,Technology
26410,UPDATE 1-First Horizon to pay $110 mln to settle US agency's mortgage claims,Economy
7066,AAA says Iraq Conflict triggers rising Gas Prices,Economy
2116,T-Mobile Calls For End Of Overage Fees,Technology
20454,"Stanford Follows Student-Led Petition, Says It Will No Longer Invest in Coal",Economy
52001,Animal welfare activists protest outside Liam Neeson's home,Entertainment
34916,SMBC Aviation Capital orders 115 A320 Family aircraft,Economy
3340,Jurisdiction in dispute for chemical leak lawsuits,Economy
61709,Google hires fashion veteran Ivy Ross to lead Glass team,Technology
23809,"Debt Purchases Within ECB's Mandate, Draghi Says",Economy
34786,"Malaysia says no sighting of MH370 in Maldives, people on board innocent till  ...",Economy
24016,"Quartz Daily Brief—Asia edition—Apple's earnings, Antarctic icebergs, Big  ...",Technology
65000,Angelina Jolie: I Never Thought I'd Have Children,Entertainment
47183,Michigan boy stumbles upon 10000-year-old mastodon tooth,Technology
21216,Tesla Motors Inc (TSLA) CEO Elon Musk Explains SpaceX Dragon Spacecraft  ...,Technology
61762,General Motors recall list: GM recalls 7.6 million more vehicles for ignition switch  ...,Technology
31768,The Daily Show's Jason Jones Mercilessly Mocks Google Glass Users: VIDEO,Technology
45398,AT&T Offers No-Contract Samsung Galaxy S4 for $179,Technology
44402,#Overkill? #AmazonCart Lets You Shop from Twitter,Economy
59395,Emma Watson & Douglas Booth Take 'Noah' Home to London!,Entertainment
13559,Kevin's Korner: Happy Easter!,Entertainment
3772,"Nintendo president: ""I feel deeply responsible"" for poor performance",Technology
51685,Search for MH370 could take 'decades': Malaysia Airlines,Economy
21127,"Interview: Filmmaker Scott Derrickson on Horror, Faith, Chesterton and His New  ...",Entertainment
3077,"Samsung unveils Galaxy S5 Mini, Starts shipping next month",Technology
24150,Nokia Lumia 2520 sales suspended due to issue with faulty charger,Technology
25,Apple to launch 8GB iPhone 5c tomorrow,Technology
28458,Disney to pay at least $500 million for YouTube video maker,Economy
26101,"US STOCKS-Futures tick up ahead of jobs, growth data",Economy
61285,"Actress Elaine Stritch, 'Her Own Greatest Character,' Dies At 89",Entertainment
48471,7 Things You Need To Know About George Clooney's Fiancée,Entertainment
14870,How To Unlock Watch Dogs Multiplayer,Technology
28750,Crude Nears 8-Month Highs Amid Escalating Tension In Iraq,Economy
21111,Hosts keep rotating for ABC's 'The View',Entertainment
37723,Feast Your Eyes on the Watch Dogs Launch Trailer,Technology
38665,Watch the Livestream of Today's Intel Chrome OS Event at 1pm ET/10am PT,Technology
28806,Gotham TV show gets series from Fox,Entertainment
6684,"Numericable is better fit for SFR, French fibre plan - Drahi",Economy
23152,Britain's Daily Mail sorry after Clooney slams story,Entertainment
10689,Apple to spend big bucks on Beats in $3.2 billion deal,Technology
40141,US consumer confidence rebounds in March,Economy
51931,US Treasury to sell shares in Ally,Economy
6985,'Game of Thrones': 'Burn it to the ground and all the dead with it.',Entertainment
7240,NASA announces new Mars rover specs,Technology
5066,It Turns Out Asteroids Can Have Rings. But Why?,Technology
35699,Iraq Crisis: Latest Sign of US Vulnerability to Oil Price Spikes,Economy
54815,"Robin Thicke: I Haven't Seen Paula Patton ""For Four Months,"" I Lost the ""Love of  ...",Entertainment
53781,Alibaba Could Be One of the Biggest IPOs in History,Economy
17384,FBI investigating high-frequency trading,Economy
6939,Bayer to Buy Merck Consumer Business for $14.2 Billion,Economy
30946,Feds Say New Cars Must Have Backup Cameras By Model-Year 2019,Technology
63953,US stock head lower for a third day straight,Economy
43947,PwC: How to Protect Customers From Today's Cyber Threats,Technology
5324,Dating website asks users to avoid Firefox,Technology
1705,Google's self-driving car gets better at navigating city streets,Technology
61678,"Wall St falls, Nasdaq under 50-day moving average",Economy
11017,"Intel wants to sell its chips for 'eyes, ears, wrists and torso'",Technology
10956,YouTube to Acquire Twitch,Technology
30227,China's tax revenues up 6.2% year-on-year to over one trillion yuan,Economy
29537,DECC set to review support for large-scale solar,Economy
38908,"Microsoft unveils the Nokia X2, its new Android smartphone",Technology
14914,Boulder scientist: 'The polar bear is us',Technology
51570,Is George Clooney destined for a happy ending?,Entertainment
37590,Hackers and trolls down Sony,Technology
41995,"Barclays to Credit Suisse Battling Banker Exits, US Woes",Economy
11970,Bieber surprises with performance during SXSW,Entertainment
60620,MMG-led Chinese Group To Buy Las Bambas Project From Glencore For $5.9 Bln,Economy
2592,"Liza Minnelli: 'Mickey was somebody that everybody loved, but to me he was  ...",Entertainment
10745,Hundreds of Hoosiers flock to sign up on last day for Affordable Care Act,Economy
53343,"IRS: Bitcoin is not currency, will be taxed as property",Economy
27301,Changing password after “heartbleed” bug? Here's what you need to know,Technology
25050,Zebra to spend $3.45 billion on Motorola business,Economy
2069,Latinos Wary Of All-Out Push To Sign Up For ACA,Economy
57172,Have a safe Fourth of July,Entertainment
34680,Google's got jokes: their best April Fool's day posts,Technology
5175,Maroon 5 To Release 'V' On September 2,Entertainment
65180,Federal Reserve may keep US rates low for longer,Economy
52514,Android TV Could Actually Succeed as a Game Console,Technology
39738,Woody Allen Taps Joaquin Phoenix To Star In His Next Picture,Entertainment
19324,"Overheating dolls can cause burns, store says",Economy
29403,"Watch: Arnold Schwarzenegger And Joe Manganiello Do The Nae Nae, Stanky  ...",Entertainment
34044,"B. Riley Lowers salesforce.com, inc. Price Target to $55.00 (CRM)",Economy
26056,Google praises product improvements and mobile for $15.4bn revenue in Q1,Economy
43588,Children's author and advocate Walter Dean Myers dead at 76,Entertainment
30296,Indians' money in Swiss banks rise to over Rs 14000 cr,Economy
59436,GM Reveals Pay Out Plan Amid Fresh Recalls,Technology
53310,Glass: Google sends out dummy specs in try-before-you-buy program,Technology
45457,Why Chinese stocks are poised to go on a bull run,Economy
34498,Kristen Bell anxious about Mars,Entertainment
18791,Rolling Stones are headlining concert at 2014 Roskilde Festival in Denmark,Entertainment
24583,Watch a Teaser Clip From 'The Hunger Games: Mockingjay - Part 1' [VIDEO],Entertainment
6347,"Upcoming 'Batman vs. Superman' film gets official title, logo",Entertainment
4513,Robin Thicke naming new album after estranged wife Paula Patton,Entertainment
8282,Winslet honoured with place on Walk of Fame,Entertainment
28332,Maya Angelou: A Tribute to an Icon,Entertainment
17161,Yahoo CEO 'skeptical' about merger with AOL,Economy
56407,Hubble composite image reveals colors of deep space,Technology
8513,Facebook Will Let You Edit What It Knows About You,Technology
45280,Hillary Clinton 'proud' of diplomatic accomplishments,Economy
62046,Climate models underestimate costs to future generations,Technology
16624,SAC Capital hedge fund fined $900 million for insider trading,Economy
64914,Netflix unveils movie guide for gay pride month,Technology
50276,How I Met Your Mother Finale Thoughts: Why?!?,Entertainment
25055,1 Thing Every Fannie Mae and Freddie Mac Shareholder Needs to See,Economy
39854,"New ""The Hunger Games: Mockingjay - Part 1"" teaser trailer excites fans with  ...",Entertainment
2410,No word from AC/DC as rumours swirl band is calling it quits,Entertainment
41863,Every Performance You Need To See From The 2014 BET Awards (VIDEOS),Entertainment
18019,Silk Road's legacy 30000 bitcoin sold at auction to mystery buyers,Economy
11527,Amy Adams Just Did The Classiest Thing,Entertainment
