No,News Title,Category
18451,Microsoft reveals new enterprise s...,Technology
27155,BlackBerry wins court order to halt Typo case sales,Technology
50865,"On net neutrality, the FCC's chairman increasingly stands alone",Technology
45435,Facebook teams up with Storyful to create social network generated newswire,Technology
18725,Alice of the 'Brady Bunch' actress Ann B. Davis dies in Texas,Entertainment
31707,Labor complaint filed against Market Basket,Economy
17006,Japan factory output fall underscores uneven recovery,Economy
63847,"Billboard Awards Recap: Holograms, Cheerleaders And Lorde, Oh Miley  ...",Entertainment
36072,"Gwyneth Paltrow, Chris Martin Split -- From Her Hints at Their Troubled Marriage  ...",Entertainment
47181,Pimco flagship fund is still bleeding billions,Economy
51450,Twitter adds 'mute' feature to block users,Technology
30904,TV news networks ignore 'death of net neutrality',Technology
56039,Drake Cancels His Performance at Wireless Festival,Entertainment
30342,Document details Apple's concern over growing Android competition,Technology
39353,Why was a General Motors recall delayed close to 10 years?,Technology
3968,"Mad Men takes off for final season with ""Time Zones""",Entertainment
52828,"US STOCKS SNAPSHOT-Biotech pummeled again, extending Wall St slide",Economy
31375,Blake Shelton Blasts Britney Spears During ACM Monologue -- Watch Video!,Entertainment
32189,'Transformers' Shows Worldwide Appeal as China Tops US,Entertainment
47225,MIAMI CITY OFFICIALS CALL FOR ULTRA MUSIC FESTIVAL TO BE MOVED  ...,Entertainment
49095,"Samsung against Apple: Intelligent marketing, not theft, made us leader",Technology
44555,Priceline books $2.6 bn OpenTable deal,Economy
40614,Chris Brown sends 'special' message to girlfriend from jail,Entertainment
36160,The Unreleased Film Noah is Already Banned!,Entertainment
54139,"Gordon Willis, 'Godfather,' 'Annie Hall' cinematographer, dies at 82",Entertainment
15201,Teen singer Zendaya pulls out of Aaliyah biopic,Entertainment
57232,"'Breaking Bad' Emmy Awards 2014: Series Wins Best Drama, Cranston, Paul  ...",Entertainment
31260,General Motors Company (GM) recalls over 500000 Chevrolet Camaro cars,Technology
22126,'Star Wars 7' Won't Keep Adam Driver From Shooting 'Girls' Season 4,Entertainment
26467,The Walking Dead Pool Final Round: Who Will Die at Terminus?,Entertainment
55320,One Direction Says Marijuana Smoking Video Of Zayn Malik and Louis  ...,Entertainment
28035,Actor Eli Wallach dies at age 98,Entertainment
57620,How Big Is That Titanosaur They Found In Argentina? Compare It With These  ...,Technology
9336,"Google's Q1 Revenue Misses Target, Shares Down by 5.7 Percent",Economy
55001,GM suspends sales of Chevy Cruzes,Technology
40121,"PlayStation 4 leads hardware sales in March, Titanfall top game",Technology
20861,"New floating objects seen, but still no evidence of lost jet",Economy
269,Phil Collins is Alamo fanatic,Entertainment
6335,"Colin Pillinger, space scientist behind Beagle 2 Mars probe, dies at 70 | The  ...",Technology
45821,What you need to know before markets open,Economy
3656,Toys R Us: Nothing prepared us for how big Skylanders became,Technology
53167,Gwen Stefani to coach 'The Voice' next season in Christina Aguilera's seat,Entertainment
48838,True Blood And More Added To Amazon Prime Instant Video,Entertainment
24631,UPDATE 1-GM says ignition switch linked to recall made in China,Technology
35332,Zac Efron: 'A weight has been lifted after talking about substance abuse issues',Entertainment
3978,What Google Glass Can't See,Technology
36434,Nintendo faces incredible losses this year,Technology
34981,Billy Dee Williams drops out of 'Dancing with the Stars',Entertainment
2974,UPDATED: Three arrested outside Taylor Swift's Rhode Island house,Entertainment
22656,Apple snaps up Beats for $3 billion,Technology
43810,Bank of America to Pay $9.5 Billion to Resolve FHFA Claims,Economy
33299,Barclays enlists outside help in dark pools probe,Economy
63489,Gap's 1st quarter net income declines 22%,Economy
3631,Reel Critics: 'Winter Soldier' a spring treat,Entertainment
3697,What celebrity divorces tell us about 'having it all',Entertainment
17204,Mick Jagger slammed by L'Wren Scott's sister for 'grotesquely disrespectful' antics,Entertainment
11469,Coen brothers' 'Fargo' comes to television,Entertainment
27166,LIVE REVIEW: Miley Cyrus Back With A Bang As Shocking Bangerz Tour Hits  ...,Entertainment
26841,CFPUA - Area drinking water unaffected by coal ash spill,Economy
5976,Where to buy Samsung Galaxy S5: Galaxy S5 price and UK best deals for  ...,Technology
12920,"Apple, IBM put aside differences with landmark deal",Technology
39285,"Wal-Mart slumps, Penney recovers in first quarter",Economy
4897,'Heaven Is For Real' Movie Review Roundup: Mixed Reaction From Christian  ...,Entertainment
45553,Preventing another Flight MH370: Airplanes to be fitted with remote black boxes  ...,Economy
32342,Samsung launches Galaxy S5 and Wearable series in India,Technology
23705,X-Men' filmmaker slams 'fabricated' sex attack claims,Entertainment
55599,Apple has another crack at a product ban,Technology
57313,Video: True Blood final season trailer,Entertainment
7781,US firm still in pursuit of Shire,Economy
38487,EFF urges road safety over Easter,Entertainment
37734,BlackRock to prepare firm for Fink exit,Economy
37120,CBS renews 'Big Bang' through 2016-17 season,Entertainment
28478,"Marijuana tax revenues hit $3.5 million in January, Denver takes in nearly $1  ...",Economy
20445,Lamar Odom and Khloe Kardashian Divorce Update: Khloe Has Never Felt as  ...,Entertainment
6615,Justin Bieber apologizes for racist joke controversy,Entertainment
21885,The 2014 CFDA Fashion Awards Winners and More!,Entertainment
6949,Science fiction teen drama never really takes off,Entertainment
17044,More women choosing to be stay-at-home moms,Economy
22092,Edgar Wright no longer directing Marvel Studios' Ant-Man,Entertainment
49322,Fast and Furious 7: Paul Walker body doubles may be used to finish film,Entertainment
58658,Drake will not perform at the Wireless Festival this weekend,Entertainment
20529,"Ancient 'spider' went one better than a pair of eyes, researchers find. Call it 'four  ...",Technology
44835,Microsoft XP support end Tuesday,Technology
25114,Meet Kryptodrakon: Oldest Known Pterodactyl Found in China,Technology
32878,Parrot Bebop Drone vs AR.Drone 2: What's Changed?,Technology
15555,Apple might be about to strike its biggest deal ever…with Dr. Dre,Economy
65320,US STOCKS SNAPSHOT-Wall St opens flat with data on tap,Economy
18581,Samsung touts process to commercialize graphene,Technology
26454,US Dragon spacecraft arrives at space station: NASA,Technology
3258,Jonah Hill Apologizes for Homophobic Slur: 'It's Heartbreaking For Me',Entertainment
37628,The article requested cannot be found! Please refresh your browser or go back  ...,Entertainment
37369,How the Dow Jones industrial average did Monday,Economy
176,UnitedHealth Group PT Raised to $91.00 at Cowen and Company (UNH),Economy
19492,Advice for Cressida Bonas,Entertainment
50429,EBay asks users to change their passwords after cyber-attack,Technology
59287,Controversial American Apparel CEO fired: Founder who faced NINE sexual  ...,Economy
42292,Justin Bieber 'takes Selena Gomez's frenemy Kendall Jenner to sushi dinner,Entertainment
63490,B&Q Owner Sees Bright Future,Economy
34069,Christian rapper Flame sues Katy Perry for allegedly ripping-off 'Dark Horse' song,Entertainment
7036,White House looking for new ways to penetrate polarized media,Technology
11832,Movie Review: 'Jump Street' repeats itself for laughs,Entertainment
52977,Box Office: 'Heaven Is for Real' Amasses $3.7 Mil on Wednesday,Entertainment
44258,Nissan April-June net profit jumps 37% to $1.1 bn,Economy
10711,Robert De Niro to Join Robert Pattinson in Olivier Assayas' IDOL'S EYE,Entertainment
64356,iLathys to launch TubeTrackr at VidCon,Technology
32526,BNP Paribas can absorb US fine without cash call: CEO Jean-Laurent Bonnafe,Economy
38385,Graco recalls 1.9M infant car seats following government pressure,Technology
55438,"US agrees to «fairer» penalty on BNP Paribas, French minister says",Economy
19717,Russia vows to cut gas supply to Ukraine,Economy
40935,"Poet, writer Maya Angelou dead at 86",Entertainment
39036,"Tesla Motors Inc. (NASDAQ:TSLA) Tumbled, Priceline Group Inc. (NASDAQ  ...",Economy
63134,Whitbread cashes in on strong hotel market in Q1 – UPDATE,Economy
52083,Ryanair to remove 'hidden' opt out from travel insurance menu,Economy
35313,Men's Wearhouse Finally Successful In Acquiring Jos. A. Bank,Economy
33867,'Game Of Thrones' premiere crashes HBO Go,Entertainment
60902,Fed Unclear About Rate Increases,Economy
4162,Kathleen Sebelius may have lied about paid Obamacare enrollments,Economy
38742,Powerful 4th Of July Spot For DAWN OF THE PLANET OF THE APES,Entertainment
54701,People's 2014 Most Beautiful Woman of the Year Is...,Entertainment
359,"Delta Shrugs Off Bad Weather, Cites Strong Q1 Passenger Demand DAL",Economy
28647,"Ruby Dee, legendary actress and wife of civil rights leader Ossie Davis, dead at 91",Entertainment
5961,UK 'must lead climate change fight',Technology
28002,Italy service sector PMI returns to growth in April: Poll,Economy
57153,"Apple, Google Bury the Hatchet",Technology
58193,Demi Lovato Is Decked Out In Denim On The Cover Of The 'Seventeen',Entertainment
65299,"Networks Give Obama Megaphone to Push Climate Change Alarmism, Dismiss  ...",Technology
44489,Unemployment among black Americans twice that among whites,Economy
6091,Why This Beloved Character Didn't Make It In 'Veronica Mars',Entertainment
41397,Lost Cash album shows love for good songs,Entertainment
41304,Having Faith In Apple+Beats,Technology
34187,"Options, implications in wake of Supreme Court ruling against TV-over-Internet  ...",Technology
1529,California commissioner keeps up fight for health rate authority,Economy
43347,VIDEO: Texas Man Connected To Target's Massive Data Breach,Economy
41531,Coldwater Creek store at Kent Station to close,Economy
54689,Angelina Jolie says won't change security on red carpet post Brad Pitt attack,Entertainment
34880,Songwriter Jesse Winchester Dies,Entertainment
21959,Why iPhone 6 will be 'mother lode' of upgrades: ISI analyst,Technology
50194,"Kate Middleton, Duchess Of Cambridge, Casual In Stripes With Prince George  ...",Entertainment
9856,Ancient flying bird with 24-foot wingspan sets record for size,Technology
24164,IBM to Spend $3 Billion on Chip Development,Economy
60959,'Winter Sleep' Turkish Film Wins,Entertainment
23579,Carbon Satellite 3,Technology
27816,"China retaliates, nixes Windows 8 on government PCs",Technology
35059,"Movie review: Muppets Most Wanted is all felt, no heartfelt (with video)",Entertainment
48891,Youth theater putting lots of kids in the spotlight,Economy
10172,'Guardians' rallies summer box office with $11.2 million opening night,Entertainment
18155,Rubio says humans aren't behind climate change,Technology
22461,"In 'The Purge: Anarchy,' the blood flows with a strong message: 3 stars",Entertainment
38099,"HP appoints CEO Whitman chairman, expands board",Economy
54979,Google CEO Larry Page Wants Less Hour Workweek for Everyone,Technology
23817,"JJ Abrams: Appear in 'Star Wars,' just $10 a try",Entertainment
40733,The OutKast Dictionary: 38 Terms You Should Know for the Duo's Reunion,Entertainment
42518,ECB leaves interest rates unchanged,Economy
48846,Emma Roberts reveals horror fears,Entertainment
5301,The Boy Who Lived Is Now 33 Years Old,Entertainment
6696,Christine McVie reveals she quit Fleetwood Mac due to 'fear of flying',Entertainment
5023,Samsung losing its lustre as Apple readies iPhone 6,Technology
53381,How I Met Your Mother finale recap: One last grand gesture,Entertainment
7967,Visionary or plain crazy? Zuckerberg's $2 billion Oculus buyout splits world view,Technology
9394,The Best Monetary Policy Is Strict Financial Regulation,Economy
8721,Tracy Morgan - Tracy Morgan is 'doing better' after crash,Entertainment
16587,Climate mitigation report: Key findings,Technology
912,"Final fed climate report will present dire picture - Fox29 WFLX TV, West Palm  ...",Technology
34309,Disney filed a patent for 'blimp-sized' puppets controlled by drones. But that  ...,Economy
42122,Is Zuckerberg Nuts To Spend $2B on Oculus VR?,Technology
59772,"Kim, Kanye marry in romantic Florence",Entertainment
2082,Insights from Tim Berners-Lee AMA On WWW's 25th Birthday,Technology
6326,LIVE: Janet Yellen Explains The Fed Decision,Economy
38207,'This is the largest scam of its kind that we have ever seen',Economy
62575,Angelina Jolie Prepared for 'Maleficent' with Yoga,Entertainment
42505,Download Microsoft Office Suite for Apple iPad,Technology
18841,Review: 'Oathkeeper' Makes Stalling for Time Look Good in 'Game of Thrones  ...,Entertainment
18843,"S.African labour minister to meet with strikers, employers -spokesman",Economy
12601,Apple Offering Free Battery Replacement for Select iPhone 5 Phones,Technology
53055,CBS gambles on Colbert for its 'Late Show',Entertainment
17143,Twitter rolls out 'mute' feature,Technology
5526,Tracy Morgan's Health Gets A Wonderful Upgrade! Deets On How He's Healing  ...,Entertainment
55731,Ann B. Davis - “Alice”,Entertainment
65219,"One Bitcoin group now controls 51% of total mining power, threatening entire  ...",Economy
7186,Exclusive: GM's new recall risk - the spare parts market,Technology
38428,China Crude Processing Falls to Four-Month Low on Weak Demand,Economy
30859,L'Wren Scott Funeral Location Revealed,Entertainment
3714,Target 1Q profit falls 16 percent as data breach takes toll,Economy
5965,Legendary Comic Book Character Archie Andrews Dies in Conclusion of LIFE  ...,Entertainment
48017,"VIDEO: Detroit's Accord With Police, Firefighter Retirees",Economy
2679,'Full House' Revival in the Works? Cut It Out!,Entertainment
15864,"New iPhone out in September, Nikkei says",Technology
8857,General Motors sends replacement parts to dealers in recall,Economy
46684,Angelina Jolie loses her wings in new Maleficent teaser,Entertainment
54053,Spacewalkers to replace failed computer outside Space Station,Technology
4781,UPDATE 2-Caterpillar defends taxes attacked by US Senate Democrat,Economy
32834,Turkish drama 'Winter Sleep' wins Cannes Palme d'Or,Entertainment
49486,Barclays hit with securities fraud suit in New York over 'dark pools' trading,Economy
5872,Free Ice Cream Today!,Entertainment
49924,3 arrested after mining disaster,Economy
23310,"Miley Cyrus calls Avril Lavigne a ""dumb f**king bitch"" in play-fight",Entertainment
20619,Iraq crisis and Ukraine-Russia tension pushes oil prices to near 9-month highs,Economy
14964,Presentation of joint edition of postage stamps held at Embassy of Bulgaria in  ...,Economy
35008,Ice Bucket Challenge helps change lives of kiwis with MND,Entertainment
60814,"Gwyneth Paltrow's tale of woe, you can almost hear violin music in background",Entertainment
5416,"Iggy Pop pays tribute to Stooges drummer Scott Asheton, who has died aged 64",Entertainment
13389,"New iMac: Apple introduces new, entry-level desktop",Technology
15706,US Trade With Russia Grows in March Despite Ukraine Crisis,Economy
24957,Here's the World-Class Designer Google Just Hired to Save Glass,Technology
11240,HTC 'Volantis' Tablet Could Be Upcoming Nexus 8.9 Tablet: All You Need To  ...,Technology
61654,Movie Review: Godzilla (2014),Entertainment
18424,Paul McCartney hospitalised in Japan,Entertainment
32844,SEC: Bitcoin Believers Are Ripe for Scammers,Economy
34328,Yellen: We're Pretty Familiar With This Milton Friedman Fellow,Economy
5618,The NFL Wants $16.6 Million From M.I.A. Now,Entertainment
51412,"Obama, Senate Democrats spotlight gender pay gap with executive actions  ...",Economy
46380,Homeless boo Chinese mogul after trying to crash charity lunch,Economy
29179,Tokyo stocks close down 0.36pc,Economy
45996,"Hot Stocks – Flextronics International Ltd. (NASDAQ:FLEX), GrouponInc  ...",Economy
9677,"iPhone 6, iWatch and iPad – The Latest Apple Rumors",Technology
15734,"Netflix, Inc. (NFLX) is bringing back 'The Magic School Bus'",Entertainment
51612,Euro struggles in Asia,Economy
40624,Tesla Shares Fall After Wider 2Q Loss,Technology
30651,China Economic Growth Slows To 7.4 Percent,Economy
32081,"Competition Commission slaps Rs 1 crore fine on Google for ""non cooperation  ...",Technology
19981,Microsoft Ends Support for Windows XP Today,Technology
13447,Radio Broadcaster Casey Kasem Dies At 82,Entertainment
21477,On The Books: Author of Faked Holocaust Memoir Ordered to Pay $22.5 million,Entertainment
3159,Report says Egan works with filmmaker on Hollywood sleazy underbelly,Entertainment
54512,Robotic capsule to be launched to International Space Station,Technology
13854,Why GM's Ignition Defects Couldn't Have Happened To Anyone Else,Technology
61972,"How to Unlock Hacked iPhones, iPads, Macs and Remove The Oleg Pliss  ...",Technology
56776,"Dutch girl, 14, questioned for tweet-threat on American Airlines",Entertainment
61299,Microsoft announces 18000 job cuts in reorganisation,Technology
57529,Look for Quarterback AJ McCarron's Draft Stock to Rise,Entertainment
57290,Sony PlayStation Network suffers DDoS attack,Technology
48592,April 23 Premarket Briefing: 10 Things You Should Know,Economy
13536,Royal mint unveils new pound coin,Economy
36398,NASA launches rocket to space station,Technology
26572,"No deadline to apply for Medicaid, county stresses",Economy
42786,Godzilla Stomps the Competition at Box Office,Entertainment
32600,Draft of 'Like a Rolling Stone' sells for $2 million,Entertainment
36108,"Fannie Mae, Freddie Mac: Fairholme Vs United States",Economy
14414,'Noah' hits rough religious waters on-screen,Entertainment
11943,National 'turns its back on councils over climate change',Technology
23846,Eva Mendes is reportedly pregnant with Ryan Gosling's baby,Entertainment
40921,Nate Berkus weds,Entertainment
21322,Wu-Tang Clan announce secret album with a multi-million dollar price tag,Entertainment
41788,Trace Adkins -- Divorce a Long Time Coming,Entertainment
17796,Miley Cyrus Takes A Trip On LSD For Flaming Lips' Superfreak! Watch The  ...,Entertainment
6595,Publisher: Pay had no part in editor's ouster,Economy
54233,Most Popular Stories,Economy
40978,Nigeria enjoys high rates of growth,Economy
33264,easyJet share price: First-half pre-tax loss narrows to £53 million,Economy
48229,"Harley-Davidson unveils an electric motorcycle, and worlds collide",Technology
58743,New IPCC report shows world unprepared for dangers of climate change,Technology
39696,"Chrysler's US July sales soar 20%, Ford 9.6%, GM 9.4%",Economy
34821,Britney Spears unedited vocals leak online. William Orbit defends the singer!,Entertainment
54659,International Court of Justice orders end to Japan's annual whale hunt,Technology
32428,Nigeria becomes Africa's top economy,Economy
10469,"U.S Secretary of State, John. F. Kerry visits IIT Delhi",Economy
35818,Nvidia Shield Tablet and Controller Review,Technology
19890,3D 'SpongeBob Squarepants' in trailer,Entertainment
63807,Extinct bird species had wingspan of WWI fighter plane,Technology
9903,Ex BP-employee settles US insider-trading charges related to 2010 Gulf oil spill  ...,Economy
31689,HBO's John Oliver Breaks FCC Website With Net Neutrality Plea,Technology
14537,'Scandal' Star Columbus Short Was Reportedly Involved In Bar Fight,Entertainment
23580,Mickey Rooney: A consummate showman for nine decades,Entertainment
15318,La Quinta declines in first trading day back on the NYSE,Economy
41923,New Species of Dancing Frogs,Technology
50959,Make something special for mother,Entertainment
51379,"Apple in talks to buy Beats Audio for $3.2B, deal could be announced next week",Economy
54877,Malaysia Airlines Flight 370: 'We're Still Trying To Define Where The Haystack Is',Economy
64423,UPDATE 3-Ray-Ban maker Luxottica to bring Google Glass to wider market,Technology
30975,Justin Bieber Mocks Orlando Bloom Following 'Fight' In Ibiza,Entertainment
4553,Pauley Pavilion is drying out from UCLA flood,Economy
62208,Driverless cars project launched in Nuneaton,Technology
23591,Hackers arrested over Blackshades RAT malware,Technology
21646,NC January Unemployment Rate Falls To 6.7%,Economy
8000,Chris Evans To Retire From Acting After Avengers To Focus On Directing,Entertainment
2466,"Intuit to Mobilize Quicken, Mint with Check Acquisition",Economy
23557,Jay Leno to Be Honored With Mark Twain Prize for American Humor,Entertainment
57012,Google Glass eyewear on sale in UK,Technology
12878,One Direction in N-word outrage,Entertainment
7400,Amazon Hikes Prime Fee to $99 - Analyst Blog,Economy
47647,Is General Motors too big to jail?,Technology
30133,Miley Cyrus is seriously sick: Star STILL hospitalized,Entertainment
27635,France's Hollande wants to change EU focus after far-right win,Economy
41049,Noah : A Visually Impressive Film That Is Sure To Generate Controversy And More.,Entertainment
41246,Amazon enters smartphone market with shopping-friendly device,Economy
57062,Peaches Geldof dead: Bob Geldof mourns 'funniest and wittiest' daughter in  ...,Entertainment
22510,Kim Kardashian's Vogue make-up artist: It was lovely to see Kim interact with  ...,Entertainment
44134,Lost Cash album comes out of vault,Entertainment
40371,"ODNR sets tougher standards, links Poland quakes to fracking",Economy
45260,Musk: Tesla's next 6 months will be busy,Technology
46264,Heir Apparent Revealed: Thomas W. Farley Named as NYSE Group Successor,Economy
53213,Google homes in on US solar,Economy
7214,Another GM recall covers 1.51 million cars to fix power-steering issue,Technology
60719,NFL Demands $16.6 Million From MIA for 2012 Super Bowl Fiasco,Entertainment
5012,"Austria's Erste bank expects major losses, sends stocks tumbling",Economy
62152,"BP oil spill in Lake Michigan contained, but Senators promise accountability",Economy
61919,Photographer Annie Leibovitz Dropped Out Of Kim And Kanye's Wedding? Of  ...,Entertainment
1177,Berkshire's $34B BNSF Railroad Investment Nearly Doubles In 4 Years,Economy
22449,Arnold Schwarzenegger - Arnold Schwarzenegger Trained With Swat Team For  ...,Entertainment
24238,Coachella 2014: A$AP Ferg marks Good Friday like a 'Trap Lord',Entertainment
44128,Aereo Supreme Court Ruling Gives Surprising Benefit to Streaming TV Giant  ...,Technology
46284,"Walter Dean Myers, children's author and advocate for reading, dies at 76",Entertainment
2114,George Clooney ready to move to UK with fiancee and start a family,Entertainment
62821,This Crazy Purple Cube Is 1 Giant Step for Space Agriculture,Technology
34719,Total lunar eclipse late Monday night,Technology
28849,Futures File — Soy Market Swamped,Economy
6997,Ryan Gosling's Lost River: Matt Smith in first teaser trailer - watch,Entertainment
13624,Thinspiration Post Costs TV Star,Entertainment
20330,Methane bubbling up off the East Coast,Technology
60415,Climate change: 'Clean industrial revolution needed',Technology
3896,WalMart recalls Baby Dolls due to Burn Hazard,Economy
18231,Affordable Care Act enrollment deadline Monday,Economy
42170,Robert Downey Jr. Issues a Statement Following Son Indio's Drug Arrest,Entertainment
37728,Apple to pay for e-book price-fixing,Technology
18744,Comcast's Cohen: TWC Deal Is All About Scale,Technology
49648,Facebook's Internet.org expands in Zambia with app offering basic Internet  ...,Technology
32981,Lana Del Rey's rough release week,Entertainment
41650,"Google Glass gets more memory, photo-framing viewfinder",Technology
22336,Wall Street rockets to new highs,Economy
17054,GM Recalls 3.4 Million Vehicles For Similar Ignition Switch Defect,Economy
25480,"On Obamacare deadline day, extra maintenance work on HealthCare.gov site",Economy
14217,"US economy shrank by 2.9 percent in Q1, but spring rebound predicted",Economy
57650,Rapper 'cuts off penis before suicide bid',Entertainment
29694,China slams US move to levy higher duty on PV products,Economy
4483,Who Was Eliminated From Dancing With The Stars?,Entertainment
16996,Twitter Clipped Ahead of Turkish Elections,Economy
40220,Warner Bros. Tries To Make Good On 'Veronica Mars' Download Snafus,Entertainment
8231,"Miley Cyrus hospitalised, cancels concert due to severe allergic reaction",Entertainment
22101,Product Recalls 070114,Technology
37136,"America Ferrera Says Red Carpet Prank 'Felt Like a Weird, Crazy Dream'",Entertainment
42104,No Debris Discovered in Latest Search for Missing Plane,Economy
6483,Retailers pressured on anniversary of lethal Bangladesh factory fire,Economy
16983,Citigroup Inc (NYSE:C) To Pay $7 Billion In Mortgage settlement,Economy
5635,Transcendence,Entertainment
17100,"Joby Ogwyn's Mount Everest Jump Cancelled, Discovery Issues Statement",Entertainment
53142,Kim and Kanye treating wedding guests to private tour of the Palace of Versailles.,Entertainment
44450,It's finally official: Xbox One to hit China in September,Technology
44369,Jem And The Holograms Poster Released & Cast Announced,Entertainment
63600,The Late Steve Jobs Has No New Insights into Rumored Apple Television,Technology
8818,Alicia Keys expecting second child,Entertainment
31547,The best of Angelina Jolie (VIDEO),Entertainment
30685,"The Bachelor 2014 RECAP 3/10/14: Season 27 ""After the Final Rose""",Entertainment
33674,Kim Kardashian and Kanye West Exchange Vows In Florence,Entertainment
50364,American Apparel creditor demands loan repayment,Economy
56560,Market Looking To Remain Tentative - Economic Highlights,Economy
58407,Rihanna honoured as style icon at CFDA fashion awards gala,Entertainment
22648,Heartbleed CRA social insurance numbers breach 'just the tip of the iceberg  ...,Technology
6142,Justin Bieber channels James Dean in latest Instagram picture,Entertainment
53577,A Whiff of Something Good,Technology
