No,News Title,Category
25932,Sharknado 2: Best Quotes,Entertainment
18824,"Hackers raid eBay in historic breach, access 145 mln records",Technology
32791,"Chris Christie shows support for Stephen Colbert, denounces David Letterman  ...",Entertainment
62735,If the Bills go to Toronto were going to war with Canada says Jimmy Kimmel,Entertainment
31096,Review: 'Purge' sequel gets it all out of our systems,Entertainment
32557,Sports Other Sports,Economy
465,Wells Fargo profit rises 14 percent as costs fall,Economy
52111,Job Growth In July Signals More Progress,Economy
63888,Yahoo Brings Community Back From the Dead,Entertainment
49530,Why Stephen Colbert leaving 'The Colbert Report' for 'The Late Show' is good  ...,Entertainment
3884,Business news,Economy
57907,Baby North gets her first photo spread with Kim Kardashian & Kanye West on  ...,Entertainment
17730,How Barclays trader tried to gain £1m in gold fixing - the day after Libor fine,Economy
65421,"Gwar frontman Dave Brockie aka Oderus Urungus dies, aged 50",Entertainment
36532,"Adam Sandler, Drew Barrymore grow up, but the jokes don't in 'Blended' - REVIEW",Entertainment
17306,Doom-mongers who claimed public spending would stunt economic growth  ...,Economy
33292,'True Blood' Series Finale Recap: The Shocking Death You Never Saw Coming,Entertainment
6167,He lost on Jeopardy,Entertainment
42957,Outkast reunite at Coachella music fest,Entertainment
49403,Hedge Fund Shorting Emerging Markets,Economy
42979,"Alibaba Is the Latest, Biggest Sign of Americans' Growing Interest in Chinese  ...",Economy
27747,"Construction spending falls 1.8 percent in June, biggest decline in more than 3  ...",Economy
12515,Colbert Report on Redskins' new foundation,Entertainment
946,Facebook's US govt's requests also include data on Instagram,Technology
65040,"JPMorgan's Dimon has cancer, cancels Greece visit",Economy
30277,Hosting Mayors Conference Lets Dallas Showcase the City,Technology
37140,"Kendall Jenner Gets Punk Haute Couture Makeover, Walks Runway at Chanel  ...",Entertainment
28018,Chinese embassy urges Philippines to stop provocative actions,Economy
7899,GM recalls 8.2 million cars for ignition switches,Technology
64843,US Jobless Rate At Lowest In Six Years,Economy
50261,Over One Million Cases of Cottage Cheese Being Recalled by Kraft,Economy
52245,Nick Lachey Announces Wife Vanessa's Pregnancy on Twitter,Entertainment
10817,When world politics pull up to gas pump,Economy
26378,Kim and Kanye's Wedding: All Of Her Family's Best Photos From Paris,Entertainment
20633,Jupiter's red spot is shrinking!,Technology
15594,Inequality and Democracy,Economy
13187,Full lunar eclipse 'Blood Moon' delights with clear skies,Technology
30521,"Jay-Z Disses Kim Kardashian and Kanye West's Wedding, Calls it a Big Circus  ...",Entertainment
34475,"North Korea Blasted Seth Rogen, James Franco for their Film 'The Interview'",Entertainment
44191,Hundreds take part in Easter parades,Technology
65414,Balanced View on SunPower Corp. - Analyst Blog,Economy
12443,Theater review: 'If/Then' -- 3 stars,Entertainment
61865,Eve Valkyrie preview – virtual reality dogfights too real to dismiss,Technology
44271,Let's Make Fun of Media Elite's First Tweets,Technology
3918,UPDATE 1-Barclays to pay $280 million to settle mortgage bond claims,Economy
28162,George Clooney slams British paper over 'irresponsible' mother-in-law report,Entertainment
4941,Gas prices hold,Technology
2009,"Darren Aronofsky interview: 'Noah is an odd choice for me, I admit'",Entertainment
39482,'Thefties' to help catch phone thieves,Technology
21063,"'The Bachelorette 2014' spoilers: 'Men Tell All' has surprises, lies and drama",Entertainment
48132,"Baylor, University High host Cinco celebrations",Entertainment
12860,Shield actor charged with murder,Entertainment
58116,Kerry presses New Delhi to stop opposing global trade reforms,Economy
11663,Starz orders Steven Soderbergh's 'Girlfriend Experience' anthology series,Entertainment
46161,"J.C. Penney Company, Inc. (NYSE:JCP) Reports Better 1Q Than Wal-Mart  ...",Economy
47678,U.S. situated perfectly for prime view of Tuesday morning's total lunar eclipse,Technology
18147,Ubisoft on how Chicago's AI will react to you when you have 'heat' in Watch Dogs,Technology
54021,Treasury Drop Lifts Yield to 15-Year High Versus Germany,Economy
14948,Netflix to air 'Magic School Bus' re-boot,Entertainment
14618,Bits and Bytes: iPhones get cheaper,Technology
44831,Selena Gomez warns young people of fame 'pressure' after rehab stay,Entertainment
59097,Samsung Galaxy F - Samsung Galaxy S5 Deluxe Version - Can We Afford One?,Technology
39788,Swim at your own risk: 1 in 10 US beaches is dangerously polluted,Economy
20406,Godzilla Director Will Helm the First Star Wars Spin-Off Movie,Entertainment
65444,"Ban Hails Impact of UN Climate Change Treaty, Urges Renewed Commitment to  ...",Technology
57880,Car-tech company Mobileye prices IPO above range,Economy
2263,French Company Makes a Bid to Buy T-Mobile,Technology
34122,For a stronger Europe: A weaker Euro helps,Economy
32095,Friday The 13th With A Full Moon,Technology
22720,The Guardians of the Galaxy,Entertainment
12583,"Now you can play XCOM: Enemy Unknown on Android, too",Technology
20850,Virgin America files for IPO. A good time to go public? (+video),Economy
33922,"Bill Murray crashed a bachelor party, gave an amazing speech on marriage  ...",Entertainment
8153,"Social Media Today: Facebook Milestone, FB Newswire, Instagram Gets Personal",Technology
28766,Apple is Close to Buying Beats Audio for $3.2 Billion,Economy
25818,Mickey Rooney dead: Hollywood legend's top 5 most memorable films,Entertainment
4407,Barclays to cut 19000 jobs in 'bold simplification' of business,Economy
51462,Serbian crater seen as UFO landing site,Technology
32431,"Samsung preparing stand-alone smartwatch, to debut this summer?",Technology
60796,Cinemania: Sulking Spidey is a drag in 'The Amazing Spider-Man 2',Entertainment
15533,"Gilead Sciences (GILD) Posts Quarterly Earnings, Beats Expectations By $0.63  ...",Economy
37545,Novartis to buy GSK's cancer drugs for $16 billion,Economy
31020,Iowa farmer next in line on 'Bachelor',Entertainment
14847,Chevrolet Cruze interiors for 2015 variant revealed,Technology
8928,UK's Cameron says making good progress on Pfizer guarantees,Economy
41022,James Franco on Instagram Selfies: Give the People What They Want!,Entertainment
53759,Zara baby shirt looks like concentration camp uniforms,Entertainment
46116,Buffett disapproves of Coca-Cola's pay plan,Economy
9533,Ousted American Apparel CEO increases stake,Economy
25880,"General Mills: If You Clip This Coupon, You Can't Sue Us!",Economy
8469,"Pat Sajak Blasts Global Warming Advocates as ""Unpatriotic Racists""",Entertainment
41011,Will Ferrell has a drum off with RHCP's Chad Smith on 'The Tonight Show',Entertainment
64829,"Oprah Asks Dina Lohan About Her Regrets, Failures And Fears As A Mother  ...",Entertainment
26338,Santa Clarita Amateur Radio Club Participates In 24 Hour Field Day Event,Technology
63757,Mysterious 'Magic Island' appears on Saturn moon,Technology
8264,Puppets Unveiled on Star Wars Episode VII Set,Entertainment
34957,Jobless claims drop to lowest since 2006,Economy
19914,"Alright, Alright, Alright. True Detective Heading to California",Entertainment
60044,"Can Valeant Work Its Magic On Allergan, Or Is Pearson Biting Off More Than He  ...",Economy
13513,"Lions Gate, Pandora Rally As Dow Soars 112 Points",Economy
8034,Morgan Stanley Reiterates On General Electric Following Alstom Board  ...,Economy
43185,NASA 2016 Mars Mission to Begin Building Spacecraft,Technology
14769,Mojang Won't Support Oculus Rift After Facebook Deal,Technology
7528,Arnold Schwarzenegger is tried and true to “The Tonight Show”,Entertainment
27758,Facebook Boosting Video Advertising with New Acquisition [Video],Economy
12551,Nickelodeon's Ariana Grande is new princess of pop,Entertainment
22864,iOS 8 vs iOS 7,Technology
2762,Top of the botts! Who has the sexiest celebrity bum?,Entertainment
16253,Windows XP hacked post retirement,Technology
55880,Khloe Kardashian Just Keeps on Shrinking (PHOTO),Entertainment
3514,Sony recalls Viao Fit 11A laptop units citing fire risk,Technology
41109,Burger King's gay pride Whopper (Photo: Burger King),Economy
47846,Kanye West Raps Kim Kardashian is His 'Number One Trophy Wife',Entertainment
15359,Royal Dutch Shell Plc Hikes Dividend On Cash Flow Boost,Economy
6334,Americans Lament Gov't Bills on Tax 'Freedom' Day,Economy
9203,Amazon acquiring popular digital comics platform comiXology,Economy
46733,Developer behind Heartbleed bug admits error but defends open source project,Technology
2885,Poll: What do you think of the Amazon Fire phone?,Economy
27990,"Murphy, Corker propose higher gas tax",Economy
22428,"Android Apps vs. iOS 7 Apps 2014: New Apps This Week For SXSW, Paralympic  ...",Technology
8723,Two '60s Mustangs Head from Michigan to the New York Auto Show [Video],Technology
23341,European Stocks Fall From Six-year High,Economy
40125,Aereo: Supreme Court justices weigh merits of Internet TV,Entertainment
26863,Target's CEO out after breach,Economy
13884,"Oceans' worth of water locked deep inside the Earth, say scientists",Technology
57711,"Russell Crowe, Emma Watson take dance lessons together",Entertainment
14698,Acclaimed 1990s Children's Series to Get Reboot on Netflix,Entertainment
25192,European stocks flounder after Wall Street losses,Economy
26769,Ray Fisher cast as Cyborg in Batman vs. Superman,Entertainment
23077,"With The Model X On Track, 2015 Could Be Big For Tesla",Technology
23983,ECB President Warns Of Deflation Spiral,Economy
16853,Jamie Lynn Spears files for marriage license,Entertainment
29662,New York City Grocery Bag at 10-cent Each Proposed for Growing Green  ...,Economy
39574,"No brakes, no steering wheel: Google car drives itself",Technology
9950,"Britney Spears' ""Work Bitch"" backup dancer files lawsuit against her for broken  ...",Entertainment
46808,"Hackers hit eBay database containing personal info, users asked to change  ...",Technology
61643,YouTube Buying Twitch: What It Could Mean for Gamers,Technology
5989,'Captain America' sets weekend box office record with $96.2m earnings,Entertainment
36459,'Mad Men' season premiere answers (most) burning questions,Entertainment
7265,"Bitcoin: Taxed as property, regulated as currency?",Economy
15107,Jay-Z And Beyonce's 'On The Run' Tour Is Already One Of The Most Successful  ...,Entertainment
20216,Alicia Keys & Swizz Beatz Fourth Anniversary with Second Child On Way,Entertainment
25272,Honeywell Profit Rises on Sales Growth Across Segments -- Update,Economy
64133,Burning Question: Do Kim and Kanye Have a Wedding Registry?,Entertainment
12351,"Australia, activists hail verdict on Japan's whaling hunt",Technology
15221,Tupac Shakur's last words contained expletive directed at cop,Entertainment
29078,Megan Fox Is Back & HOTTER Than Ever For A Delicious Cosmo Cover!,Entertainment
43908,UPDATE 2-Microsoft targeted in apparent Chinese antitrust probe,Technology
44932,Families' anger as jet hunt goes on,Economy
14275,10 Things You Need To Know Before The Opening Bell,Economy
28933,Khloé Kardashian Warned 'Be Careful' Of French Montana By Estranged Wife,Entertainment
40950,"Snake handler refuses treatment for snake bite, months after dad's death",Entertainment
32001,Apple Offers Free Battery Replacement For Affected IPhone 5 Devices,Technology
10429,Amazon takes 'buy' buttons off upcoming Hachette titles,Entertainment
46017,"Shaggy, Merry and more: Casey Kasem's greatest cartoon voices",Entertainment
52907,Gurgaon mommies deserve a day out!,Entertainment
30542,Obamacare 'accomplishing goal': Gallup poll,Economy
27917,Star Trek actors boost Reading Rainbow to new record,Entertainment
4066,"Bingol underscored GM's challenges, opportunities in 2012 profile",Economy
58392,Home / Federal Reserve cautious over interest rate rise,Economy
56785,'The Bachelor' Juan Pablo: 'I'm Not A Bad Guy',Entertainment
3307,Origins and Evolutions: The Sinister Six,Entertainment
37273,Royal Dutch Shell Plc's Hold Rating Reaffirmed at Investec (RDSB),Economy
54741,Case-Shiller: Home prices drop for third consecutive month,Economy
39135,Photo by OLIVIA HARRIS/REUTERS 7 hours ago,Entertainment
17903,Latest information on search in southern Indian Ocean for missing Malaysia  ...,Economy
32308,Harris facing jail after guilty verdict on 12 sex charges,Entertainment
39160,'Idol's' best (and worst) judges,Entertainment
31759,Google's 'Street View' maps add digital time capsules for visual retrospectives,Technology
13963,"Zac Efron, Michelle Rodriguez cozy up and kiss on vacation in Sardinia",Entertainment
54904,Google's new terms of service tell you that it's scanning email for ads,Technology
6543,'Fed Up' takes U.S. food industry to task,Entertainment
8,Apple & Google's Motorola end legal battle,Technology
53112,Watch Metallica's Glastonbury opening film Glastallica,Entertainment
13777,Mickey Rooney was the grandest trouper,Entertainment
55720,Here's Everything Apple Announced At WWDC Today (AAPL),Technology
32540,Study published by teen: Typeface change could save federal government money,Technology
9576,Twitter chief operating officer Ali Rowghani has resigned,Economy
63744,Flight MH370: 17 conspiracy theories after Australians say plane is NOT in  ...,Economy
37673,"US employers add 209000 jobs, rate rises to 6.2 pct.",Economy
45611,Top Ten New Species of 2014 Includes Carnivore That looks Like a Teddy Bear,Technology
59203,"Melissa McCarthy, Susan Sarandon Hit the Road",Entertainment
8398,SCANDAL Preview: The Grant Children Visit The White House,Entertainment
36183,Vietnam PM texts nation amid anti-China riots,Economy
29561,South African Nobel Prize Winner Nadine Gordimer Dies at 90,Entertainment
38179,Google and Novartis to work together on “smart” contact lens for health,Technology
15342,Greenland Ice Hides 3 Million Year-Old Landscape,Technology
2213,Obama goes to the hoop in order to score more health insurance enrollments,Economy
11424,Facebook wants to be a part of the growth story in India: Sheryl Sandberg,Technology
48401,Apple will livestream WWDC keynote to Macs and iOS devices,Technology
22313,Roche Buys Breast Cancer Specialist Seragon Pharmaceuticals,Economy
51913,"Jeep close to deal with Guangzhou Auto, reveals Renegade in New York",Technology
12298,A fitting tribute,Entertainment
24837,"Tori Spelling talks 'True Tori,' says her story may not have a happy ending",Entertainment
58490,How long should I keep old tax records?,Economy
37043,Chelsea players to wear black armbands against Everton in tribute to the late  ...,Entertainment
35669,NBC puts kids front and center,Entertainment
14246,Stephen Reacts To #CancelColbert: 'I'm Still Here!',Entertainment
62051,Facebook Is Worried The EU Will Gum Up Its $19 Billion WhatsApp Acquisition,Technology
35908,FTC Implores Whatsapp to Keep its Promises on Privacy in Facebook Deal,Technology
57680,Apple has refreshed its MacBook Air with a faster machine for cheaper,Technology
42776,Plane spots object after search for lost Malaysian jet shifts north,Economy
42406,Jimmy Fallon and Billy Joel Started a Doo-Wop Group With an iPad,Entertainment
58859,Miranda Lambert's 'Platinum' sounds golden,Entertainment
16444,Alibaba To Purchase Stakes In Singapore Post,Economy
51600,AstraZeneca rebuffs Pfizer,Economy
43836,Gas prices up 10.2 cents per gallon in the past week,Technology
39444,Traders look to Crimea vote,Economy
12681,VLC Finally Shows Some Love For Windows Tablets,Technology
62194,Chris Evans Hints 'Avengers: Age of Ultron' May Revisit Captain America's Past,Entertainment
59122,"Frank Darabont on Track to Helm Snow White and the Huntsman 2, Sans Much  ...",Entertainment
11380,In Honor of Cinco de Mayo: Where Did Meat and Queso Dip Originate?,Entertainment
12970,"TV Ratings: 'Shark Tank,' 'Barbara Walters: Her Story' lead ABC Friday",Entertainment
6144,Khloe Kardashian's 'happily ever after' photo after Kim's wedding,Entertainment
1593,Rubio says he's ready to become US president,Technology
3266,Supportive manufacturing data lifts sentiment on metals,Economy
2133,'Aladdin' Proves Its Worth on Broadway,Entertainment
3925,Watch Dogs Review - Explore and interact with the city of Chicago like you have  ...,Technology
51257,"IBM partners Apple to offer iPads, iPhones for business users",Technology
39143,Trio including Chinese painter charged in US over $41m art scam,Entertainment
52599,Little girl upset about her brother growing up,Entertainment
38645,"European Factors to Watch-Shares seen steady at open, BNP in focus",Economy
48378,Dramatic NASA satellite images show our air getting cleaner,Technology
28877,FTSE 100 movers: Shire leaps after rejecting bid from AbbVie,Economy
31789,Arrest warrant issued for Scandal star,Entertainment
63946,Right to be forgotten: Google erases British media articles from search results,Technology
22794,'How I Met Your Mother' Ends After 9 Seasons,Entertainment
29868,Google Is No Longer Accepting Glass Explorers At This Time,Technology
7198,"Avril Lavigne Channels Kesha in New Music Video for ""Hello Kitty""!",Entertainment
19016,Shire upgrades FY view as quarterly revenue rises,Economy
12779,Idina Menzel Gets Ferociously Frosted At The Met Gala,Entertainment
49939,"PHOTO: Kim Kardashian's Short, Sparkly Wedding Party Dress",Entertainment
64833,Dollar index holds near six-month peak in Asia,Economy
32686,China's Official PMI Rises To 50.3 In March,Economy
29976,"JPMorgan Chase earnings miss estimates; mortgages, trading weaker",Economy
12278,Ouch! Pregnant Mila Kunis Planning Natural Birth With No Drugs,Entertainment
32544,Quadruple murder suspect wants to get married,Economy
27097,"'Fifty Shades of Grey' trailer is more tame than expected, features mostly romance",Entertainment
61817,AC/DC Issue Statement on Malcolm Young and Their Future,Entertainment
35743,Stories of victims in California rampage,Entertainment
30671,Facebook apologises after crash,Technology
18218,VIDEO: Audra McDonald Sings Yahoo! Answers on JIMMY FALLON,Entertainment
46796,Pandora Raises Price of Ad-Free Streaming for Some Listeners,Economy
23678,Kris Jenner Cries: Opens up About her Worry Over Rob Kardashian,Entertainment
50521,"Miley Cyrus 'Tongue Tied' Video: Watch Singer Get Naked, Kinky, In Bondage  ...",Entertainment
63435,Tupac Shakur-Inspired Musical 'Holler If Ya Hear Me' To Close Sunday,Entertainment
46487,Total Lunar Eclipse Monday Night into Tuesday (April 14-15),Technology
13256,The article requested cannot be found! Please refresh your browser or go back  ...,Entertainment
11268,ECB keeping close eye on exchange rates and credit dynamics,Economy
42968,Heart of gold: Amy Adams gives up first-class seat to soldier,Entertainment
55046,FUTURES FILE: Market stops yellin' for gold,Economy
34153,HTC To Build The Next 8.9-Inch Nexus 'Volantis' Tablet: Report,Technology
46073,Garth Brooks Croke Park Dublin concerts cancelled reaction,Entertainment
6399,Marvel Announces THOR,Entertainment
325,"Justin Bieber's DUI charges dropped, after he 'finally agrees a plea bargain with  ...",Entertainment
54521,Aaron Levie owns more of Box than you think,Economy
51180,Kasem family battled for months over 'end of life' care,Entertainment
8873,"Taco Bell: 'Thank You For Suing Us, Here Is The Truth About Our Beef'",Economy
56479,'Welcome to New York' gets an orgy of publicity at Cannes premiere,Entertainment
34958,"Twitter to acquire Gnip, seeking more insight into trends",Technology
46785,"Chris Rock Skewers Donald Sterling, Jay Z, Dr. Dre In BET Awards Monologue",Entertainment
18533,Snapchat Facebook Snub Looks Smart as Alibaba Mulls Stake,Economy
57612,"Tuesday's most followed in US including Netflix, Harley-Davidson, Allergan  ...",Economy
42780,Pharrell warned about new TV movie,Entertainment
40568,George Takei takes on Westboro Baptist Church with Let It Go cover,Entertainment
18761,Feathered feat: ancient bird had largest wingspan ever,Technology
28604,Lorde: Coachella is mental,Entertainment
59573,Graco expands recall to include 1.9 million infant car seats,Technology
16817,"UPDATE 4-Emirates cancels 70-plane A350 order in blow to Airbus, Rolls",Economy
42472,Tracy Morgan's rep: 'Today was a better day',Entertainment
28737,Chrysler sales up 16.7% in best May since 2007,Technology
8541,Kiefer Sutherland Responds To Freddie Prinze Jr.'s Comic-Con SLAM! Find Out  ...,Entertainment
11177,Nike hints at deeper partnership with Apple,Technology
14011,"HTC One M8 reviews praise hardware, superb design, but unimpressed by Duo  ...",Technology
29669,UPDATE 2-BlackBerry aims to reverse emerging market slump with budget  ...,Technology
44008,Sky Watcher Alert: Meteor Shower Early Saturday Morning,Technology
39755,Toyota to pay $1.2 Billion,Technology
22600,"Ariana Grande announces new album 'My Everything,' previews 'Break Free  ...",Entertainment
39095,"'True Detective,' 'Breaking Bad' among leading contenders for prime-time Emmy  ...",Entertainment
43686,Majority of Brides Surprisingly Okay With Having Glassholes at Their Weddings,Technology
48998,Aust bonds stronger ahead of Fed testimony,Economy
3184,Mila Kunis Debuts Tiny Baby Bump on Red Carpet,Entertainment
17921,Miley Cyrus' Robbed? 'Bangerz' Singer Gets Maserati And Jewelry Stolen,Entertainment
32633,Robin Thicke's #AskThicke Twitter hashtag backfired,Entertainment
45488,"One Actress, Many Amazing Performances: Orphan Black Returns",Entertainment
31942,Kalki Koechlin launches Samsung Galaxy Tab S in New Delhi,Technology
61092,Hot Trailer: The Wachowskis' 'Jupiter Ascending',Entertainment
60163,Commissioners Want FCC to Rethink Plan to Kill Net Neutrality,Technology
36852,The Last of Us Remastered release date tipped as June 20,Technology
46288,Allegiant Is Split Into Two Movies,Entertainment
21737,"Edie Falco,Interviewed On 'Late Night With Seth Meyers'",Entertainment
20823,What Are the Risks to Watch for in Alibaba's IPO?,Technology
2118,"Apple, IBM Deal Is a Winner, No Matter How Cynical the Viewpoint",Technology
34847,Free McDonald's coffee giveaway starts Monday,Economy
942,Jay Z and Beyonce's On The Run trailer has more stars than a Hollywood  ...,Entertainment
33175,Facebook Is Killing Its Snapchat And Instagram Knockoffs,Technology
47483,SLIDESHOW: Armed robbers sentenced,Technology
35375,Ubisoft reveals more issues they fixed during Watch Dogs delay,Technology
51208,David Fincher Not Directing Latest Jobs Film,Entertainment
27191,"E-tailing on fire: Can FlipKart stop Amazon, eBay advances?",Economy
21852,Aluminum maker Alcoa posts $138 million profit in 2Q on strong products  ...,Economy
28289,Kate O'Mara dies: Former 'Dynasty' actress was 74,Entertainment
21659,Cheeky photo of Duchess Kate causes yet another royal media rumpus,Entertainment
43321,July Car Sales Soar Back To Pre-Recession Levels,Economy
49467,US economy gauge up for 3rd straight month,Economy
38134,General Motors Offers Discounts to Owners of Recalled Cars,Technology
20423,See All the 2014 CFDA Awards Red-Carpet Looks,Entertainment
5622,Posted by Shoaib-ur-Rehman Siddiqui,Technology
34905,ECB's Noyer says in favour of injecting further liquidity,Economy
10281,US GDP rose at 4% annualized rate in Q2 2014 -- GDP dipped 2.1% in Q1,Economy
45082,SNOHOMISH COUNTY SHERIFF'S OFFICE ON BOARD WITH OPERATION  ...,Technology
65317,DiCaprio's '$1 million trip to the moon',Entertainment
47190,"Frankie Knuckles, Legendary DJ, Dead at 59",Entertainment
60567,Miley Cyrus Slaps Fan with Restraining Order,Entertainment
3478,JJ Abrams releases first 'Star Wars: Episode VII' footage,Entertainment
41750,Police hit back at cyber-criminals behind GameOver Zeus virus,Technology
53138,Kim Kardashian & Kanye West Are OFFICIALLY DENIED Their Versailles  ...,Entertainment
17749,JP Morgan's Hunger Games,Economy
2803,KUWTK preview: Kim tells Rob he's 'not bipolar',Entertainment
28538,Titanfall companion app now available on iOS and Android,Technology
7226,"Stocks Plunge on Wall Street, Wiping Out July's Gains",Economy
61125,Kanye West Paid Lana Del Rey HOW MUCH To Perform At Their Wedding  ...,Entertainment
16608,Alibaba files to go public in the U.S.,Economy
53169,Meg Ryan to narrate `How I Met Your Mother` spin-off,Entertainment
36423,Meditative 'Transcendence' Also Artificially Intelligent,Entertainment
55117,Google Fit Platform preview: it's time to get healthy,Technology
62469,Daring Vision of Darren Aronofsky's Epic 'Noah',Entertainment
20100,Leonardo DiCaprio auctions space trip for $1M at amfAR,Entertainment
42330,Mass. gas prices up another 4 cents per gallon,Technology
58746,Kim Kardashian got her daughter diamond earrings for her first birthday,Entertainment
2055,Chris Hemsworth and wife Elsa Pataky welcome home twins,Entertainment
23168,Reality strikes,Entertainment
52584,WATCH: Andrew Garfield Faces The Wrath Of Beyoncé In Hilarious 'SNL' Sketch,Entertainment
5228,Robin Thicke Announces Album Title...Paula,Entertainment
4392,Report: An 8GB iPhone 5C Launches Tomorrow,Technology
16878,Challenging series doesn't have easy answers,Entertainment
61602,Elton John Will Marry Longtime Partner David Furnish In May,Entertainment
53203,Most Uninsured Don't Know Health Coverage Deadline Looms,Economy
48783,First Picture from Kim Kardashian and Kanye West's $11 Million Florence Wedding,Entertainment
46287,Emirates cancels order for 70 Airbus A350s,Economy
47437,Katy Perry throws 'Birthday' party at 2014 Billboard Awards,Entertainment
60545,Oil tanker carrying crude from Libya's Es Sider slips escort: report,Economy
18648,German museum shows off living replica of van Gogh's ear,Entertainment
34986,Peter Dinklage Talks Game Of Thrones Phone Throwing,Entertainment
2269,Roche to buy US biotech firm Seragon for up to $1.7 billion,Economy
31085,NPD Group Says PlayStation 4 Took Xbox One Out Behind The Wood Shed  ...,Technology
