No,News Title,Category
3864,US ends Toyota probe as settlement reached,Technology
18911,Today in Photos (June 26),Entertainment
43888,"5 Cannes Critics Slam, Boo And Laugh At Ryan Gosling's Made-In-Detroit Film",Entertainment
1242,Terminator Reboot Will Feature Multiple Time Travelling Robots,Entertainment
62388,"EUR/USD steady on soothing Putin words, U.S. housing numbers support",Economy
24979,New research may lead to paper-thin tablets and TV screens,Technology
7662,Cara Delevingne And Girlfriend Michelle Rodriguez Look Loved Up (Again) As  ...,Entertainment
64406,Hollywood on the Couch: Andre Johnson (aka Christ Bearer): Castrates Self  ...,Entertainment
28215,Court delay for 'Shield' actor charged with murder,Entertainment
9899,"Google: Hackers targeting journalists, news organizations",Technology
6942,Report: Ford to name Fields CEO Mulally's successor,Economy
47038,Arizona could get millions in Apple e-book settlement,Technology
24736,Alaska volcano begins erupting,Technology
48054,Inflation rises to 1.9% in June,Economy
2414,"Lenovo expects to complete IBM, Google deals by year-end",Technology
37708,Tupac Shakur wouldn't tell Vegas cop who shot him,Entertainment
28196,Emergency rules would add teeth to California water-conservation rules,Economy
12855,General Motors Doom And Boom: More Recalls But Sales Keep Rising,Technology
19672,"Federal Suit Filed Against Philly.com Over Ashton Kutcher, Mila Kunis Photo",Entertainment
22060,Ocearch Scientists make startling new discovery on great white sharks,Technology
22460,Stocks close sharply higher,Economy
17700,Robot Bartenders to Serve Drinks on Royal Caribbean's New Cruise Ship,Economy
62488,MARKET ANALYSIS: Global Growth Worries May Pressure Stocks,Economy
30324,"Honda profit beats estimates on cost cuts, Japan sales",Economy
62036,Weev reprieve: Court disowns worrying security conviction,Technology
30370,US Military Says Hypersonic Weapon Detonated after Lift-Off,Technology
12096,"Tyler, The Creator Arrested For Causing SXSW Incident",Entertainment
19681,"Joan Rivers Makes Holocaust Joke, Talks Bruce Jenner's ""Vagina"" (VIDEO)",Entertainment
50260,Twitter Is Adding an Option to 'Mute' People,Technology
15641,OnePlus One's 'CyanogenMod 11S' software revealed in leaked screenshots,Technology
54028,Jimmy Fallon challenges Colbert to dance-off,Entertainment
37932,Will Twitter #removehashtags and '@' replies?,Technology
17493,Adele Teases Her Album Title And Reveals It's Dropping Later This Year!! ZOMG!,Entertainment
23500,Mick Jagger To Receive $9 Million Estate From The Late Fashion Designer L  ...,Entertainment
21136,Tom Hanks rocks out a Bieber manger's wedding,Entertainment
34875,Facebook's 'creepy' psych experiment is just a beat-up,Technology
32690,"Internet Explorer Versions 6 to 11 Attacked by Hackers, Microsoft Responds",Technology
5815,Tesla Owner In China Tackles Lack Of Charging Infrastructure With Ingenuity+  ...,Technology
54012,Teen arrested after tweeting terror threat,Entertainment
1889,"Chipotle Mexican Grill, Inc. Announces First Quarter 2014 Results",Economy
28581,"New territory: MacFarlane, Theron blaze a fresh path with comedy Western",Entertainment
65228,Symantec Research On Adept Cyber-espionage Campaign,Technology
57428,Many Canadians power down for Earth Hour,Technology
28183,Whole Foods Market Q3 Profit Rises - Quick Facts,Economy
5289,Average Gas Prices Fall 1.8 Cents in PA,Technology
2899,Flight MH370: last message to Malaysia sent 'after communications disabled',Economy
7676,'Sabotage' review: Arnold Schwarzenegger finally finds a worthwhile project,Entertainment
38352,Barnes & Noble to split book and Nook business,Economy
41801,Game of Thrones: Who killed Joffrey?,Entertainment
44303,State AGs Investigate eBay Breach,Technology
53331,UPDATE 1-Spanish yields hit record lows on ECB's easing signals,Economy
26724,Target replaces Canadian stores head,Economy
37648,Google's Android Wear may have a serious DRM problem,Technology
26202,Deutsche Bank prepares multi-billion euro share sale - sources,Economy
45344,Aggressive' Bullish Options Activity Seen in Allergan Ahead of Tie-Up Reports,Economy
37219,Kate Middleton Attacked Down Under As Australian Media Ridicule Her 'Modesty',Entertainment
22598,Tesla Expects To Make No Profit In 2014,Economy
28728,"On climate change, US paying price for inaction",Technology
19772,"NSA allegedly used 'Heartbleed' vulnerability to gather data, agency denies report",Technology
30137,Facebook to make safer enviroment for new users,Technology
46880,Google could spend up to $30 billion acquiring foreign companies,Economy
51849,Samsung tips worse-than-expected profit drop,Economy
41330,Higher Coffee Prices Kick in at the Supermarket,Economy
27397,Batman Arkham Knight Batmobile Trailer Reveals The Game's Been Delayed,Entertainment
37323,"Lindsay Lohan Almost Bails On These 2 Broke Girls, But Thankfully Kat  ...",Entertainment
4802,Drew Barrymore Gives Birth To 2nd Daughter,Entertainment
44818,Kim Kardashian - Kim Kardashian And Kanye West Get Active On Irish  ...,Entertainment
5764,'Too big to jail' video comes after Holder meeting with Swiss finance minister,Economy
6768,"Cast and crew poster for Captain America: The Winter Soldier, plus another TV  ...",Entertainment
48103,"Ariana Grande, Nicki Minaj, Jessie J: Whose New Album Are You Most Excited  ...",Entertainment
17670,Target CEO Steinhafel out in wake of data breach,Economy
1161,"UPDATE 2-China June trade data misses forecasts, doubts over economy linger",Economy
259,Jimmy Page 'fed up' with Robert Plant's mixed messages on Led Zeppelin reunion,Entertainment
23624,Verizon Wireless outage affects payments and new phone sales,Technology
39111,Movie review: 'Neighbors',Entertainment
12139,Lohan sues over 'Grand Theft Auto V' video game,Entertainment
20636,Police called to Justin Bieber's house party: Report 0,Entertainment
44995,This Is What Beyoncé & Jay Z's Wedding Looked Like,Entertainment
32497,Toyota gives Camry a top-to-bottom makeover,Economy
644,Bitcoin News: Mt. Gox CEO Accused of Hoarding 'Stolen' Coins,Technology
38733,US to end to door-slot mail for millions,Economy
29737,George R.R. Martin Releases Teaser,Entertainment
15860,Review: Conspiracies and gunfire drive 'November Man',Entertainment
53377,Microsoft Reveals Windows Phone 8.1 Soon Getting Folders for Apps,Technology
1501,iFixit Confirms Why The HTC One M8 Ships With A Stellar Warranty,Technology
26985,North Korea Is Grumpy With Seth Rogan And James Franco [VIDEO],Entertainment
29222,"When is Passover, and how long does it last?",Entertainment
58150,Sony to Sell TV and Film Content Through Comcast,Economy
4823,Study: Plastic ocean garbage lost in unknown 'sink',Technology
43049,Google Could Expand Into eSports if YouTube Buys Twitch.tv for $1 Billion,Technology
26902,"The Big Bang Theory Season 8: Jim Parsons, Kaley Cuoco, Johnny Galecki do  ...",Entertainment
14743,Kardashian Update: Renaissance Wedding Bells for Kim Kardashian and Kanye  ...,Entertainment
56797,Jack's back in '24: Live Another Day',Entertainment
18000,"Kim, Kanye reach Ireland for honeymoon",Entertainment
701,Jenny McCarthy + Donnie Wahlberg Are Engaged - See Her Stunning Ring  ...,Entertainment
31483,Air France-KLM cuts profit forecast,Economy
22732,"BOJ keeps policy on hold, maintains upbeat view on outlook",Economy
5671,Economists Expect ECB To Loosen Monetary Policy But QE Is Off The Table,Economy
64212,"2014 Billboard Music Awards: Chrissy Teigen, Lucy Hale, & MORE Stun On The  ...",Entertainment
49146,North West's 1st Birthday Diamond Earrings Cost How Much?! This Estimation  ...,Entertainment
35337,MARKET COMMENT: UK Stocks Start Third Quarter Higher,Economy
15143,Fireworks Tips for a Happy and Safe 4th of July Weekend,Entertainment
44446,ABC says Muir replacing Sawyer at 'World News',Entertainment
26224,AT&T close to announcing acquisition of DirecTV,Economy
10523,RPat thinks Katy Perry is 'so hot',Entertainment
56252,Gwyneth Paltrow - Gwyneth Paltrow and Chris Martin split up,Entertainment
54905,"US jury hits Takeda, Eli Lilly with $9B penalty - KTVN Channel 2 - Reno Tahoe  ...",Economy
7159,Hip hop artist Rick Ross arrested in North Carolina,Entertainment
61834,'Heartbleed' bug critical internet threat,Technology
27351,Corrupting Piketty in the 21st century,Economy
27026,"Ban plastic microbeads, say citizen advisors to Great Lakes Fishery Commission",Economy
47567,"Justin Bieber Vs. Drake Bell, Who's More Famous?",Entertainment
9443,Drew Barrymore - Drew Barrymore Gives Birth To Baby Girl,Entertainment
7866,Early returns suggest Google Glass may not cut it with consumers,Technology
61199,"Hercules Trailer Starring Dwayne Johnson Debuts, Immediately Trends On  ...",Entertainment
38981,First Image of a Suited-Up Henry Cavill in 'Batman v Superman' Revealed,Entertainment
5823,We Don't Want Pfizer To Guarantee Jobs And Investment If It Buys AstraZeneca,Economy
19305,What's the Deal with America's Declining Workforce?,Economy
38563,Lupita's Braid Hat Is Everything,Entertainment
13826,Megan's foxy seduction tips,Entertainment
63165,"Apple, Comcast nod to Net TV future",Technology
50465,American Apparel Fires Controversial Founder and CEO Dov Charney,Economy
57149,"VIDEO: After All This Time, Apple's IPad Is Still The Most Beloved Tablet",Technology
53470,ECB Promotes Stimulus Measures Even as Recovery Lessens Need,Economy
55510,Google Maps Update Offers iOS and Android Users with Offline Mode Feature  ...,Technology
6059,Legislation proposes $195 million state payment to help Detroit emerge from  ...,Economy
12138,"Tom Williams, Universal Parks Chairman & CEO, reflects on the Universal  ...",Entertainment
14153,Stocks fall in Argentina as country enters default - Northern Michigan's News  ...,Economy
30082,How Apple Inc. (AAPL) and Twitter Inc (TWTR) Made Will.i.am Rich?,Technology
38289,'Captain America' fights way to top of N American box office,Entertainment
65222,Lana Del Rey angry at the Guardian,Entertainment
50155,Phone firms to add anti-theft measures,Technology
6241,Giving Workers a Reason to Quit at Amazon,Economy
2954,Anna Paquin Talks About Filming Sex Scenes For True Blood,Entertainment
17647,NKOTB at sea on your TV,Entertainment
22430,Certain Fireworks Remain Banned In WV,Entertainment
56492,BlackBerry to tempt users with Android apps from Amazon Appstore,Technology
34267,"Citizens Bank, BB&T Bank: Today's Rates for Home Mortgages Apr 15",Economy
13990,US builder confidence climbs to six-month high in July,Economy
51214,Robert Pattinson: Kristen Stewart split was 'normal',Entertainment
25244,Nexus 6 vs Samsung Galaxy S5: Competing over which is the best Android  ...,Technology
21805,Google Nexus 8: Features and Probable Release Date Revealed!,Technology
60788,"Court slows EPA on emissions, but largely backs its rules",Economy
18880,Hollywood Notebook: 'Captain America' suits Chris Evans,Entertainment
30750,Iraq poses longer-term risks to oil price: Hans van Cleef,Economy
4744,Video: Stranded Vegas flier remakes Celine Dion video,Entertainment
44090,Samsung Galaxy S4 vs Samsung Galaxy S5 Review: Which is Better Buy?,Technology
39399,Netflix reveals payment deal with Comcast and net neutrality position,Technology
5821,"Narendra Modi says Facebook a tool for governance, better interaction",Technology
8447,Never Before Seen Object Observed on Saturn's Titan,Technology
28518,"Movie review: Money, not talent, drives fourth 'Transformers' movie",Entertainment
10382,The 15 Prettiest Summer Highlights,Entertainment
30157,"Ringo Starr Looks Back On 'A Hard Day's Night': 'It Was Mad, But It Was Incredible'",Entertainment
39650,Inside Jessica Simpson's Wedding: The Details!,Entertainment
13337,Time To Pretend: Here is a suspicious 14-second clip of Leonardo DiCaprio  ...,Entertainment
23883,"iPhones killed the celebrity autograph, says Taylor Swift",Entertainment
39623,The James Brown Legacy: Soul Brother Number One – When He Was “King” Of  ...,Entertainment
61789,Video Game Giant Hits Oculus With Trade Secrets Suit,Technology
51066,TRAILER: Megan Fox is back in Teenage Mutant Ninja Turtles,Entertainment
24329,Screen Gems Movie Reviews,Entertainment
51127,Google won't call games with in-app purchases free anymore,Technology
64930,Goddess of Thunder? Thor undergoes...,Entertainment
48919,"Sling Media Introduces $150 Slingbox M1 Box, Upgraded SlingTV UI, And A  ...",Technology
28123,Internet giants slam FCC's plan for internet 'fast lanes' as the end of net neutrality,Technology
19863,Coachella Live Stream,Entertainment
33103,"US consumers pay slightly higher food, rent prices in March",Economy
14219,'Orange Is The New Black' Trailer Hits The Web [Video],Entertainment
1575,McCarthy overserved in 'Tammy',Entertainment
57571,Earnings lift S&P 500 and Nasdaq,Economy
9435,"Google Glass Released Tomorrow to Everyone, Only on Sale for One Day",Technology
65418,French gov't regroups after far right victory,Economy
22527,Budget Moto E to launch in India today: Coming exclusively via Flipkart,Technology
9954,AT&T Adds HTC One(R) (M8) to Industry Leading Device Portfolio and the  ...,Technology
16678,BlackBerry boosts security credentials with Secusmart deal,Technology
60973,Michael Jackson fans mark 5th anniversary of his death,Entertainment
48183,Angelina Jolie made an honorary Dam,Entertainment
23254,Elephants can gauge threat from human voices: Study,Technology
20136,This New Ruling on US Oil Exports Could Have a Massive Impact on Your Portfolio,Economy
4614,Microsoft under antitrust probe in China,Technology
32061,Google's Uber power play is reminiscent of the big bad Microsoft,Technology
3542,Film review: 'Neighbors' is a high-concept failure,Entertainment
24730,"Air quality in world cities worsening, Delhi most polluted",Technology
41390,Bruce Springsteen to close out NCAA music festival,Entertainment
64335,HBO Boards BBC One's 'The Casual Vacancy' As Co-Producer,Entertainment
47817,Clarification on Obamacare needed,Economy
57747,"Detroit judge dismisses lawsuit by Insane Clown Posse, fans over FBI gang report",Entertainment
26887,Neil Young - Neil Young's Kickstarter Campaign Reaches Goal In 10 Hours,Entertainment
42727,Bank of England policymakers 'surprised' that markets weren't pricing in a 2014  ...,Economy
9833,German Ifo index disappoints with fall in May,Economy
32738,'Cesar Chavez' review: Simplified version,Entertainment
56728,Investors' fears intensify over US rate hike talk,Economy
15022,"Aereo Meets ABC, Broadcasters in Supreme Court Battle Over TV and the Cloud",Entertainment
64640,"Lindsay Lohan's List of Lovers: Adam Levine, Joaquin Phoenix, Heath Ledger",Entertainment
45496,Another warmist fantasy crashes to earth,Technology
40512,The Rolling Stones Return for First Show Since L'Wren Scott's Death,Entertainment
28214,Samsung Galaxy Grand Neo vs Samsung Galaxy Core Advance: Top  ...,Technology
38991,Overnight Markets: Wall Street dips after Fed's Bullard comments,Economy
32942,"Sum 41 Singer: 'If I Have One Drink, The Docs Say I Will Die'",Entertainment
15101,47% of unemployed Americans say they've stopped looking for work,Economy
56049,Yellen Will Fail To Have Her Cake And Eat It Too,Economy
11034,"Shia LaBeouf arrested during performance of Cabaret, reportedly for smoking a  ...",Entertainment
48315,Bank of America to pay $9.5 billion in housing settlement,Economy
53073,What a Leaner Microsoft Will Look Like After the Layoffs,Technology
50467,7 Million Sign Up for ObamaCare -- or Not,Economy
37456,Barclays slides to 18-month low on US lawsuit,Economy
3402,Neil Patrick Harris is 'becoming Jared Leto manorexic' for 'Hedwig',Entertainment
38784,Netflix streaming sales top $1 billion,Economy
11664,"China gold demand to rise, World Gold Council says",Economy
131,World marks Earth Hour,Technology
6029,Film teasers and Latina bombshells at MTV Movie Awards,Entertainment
27277,Researchers Create Universe Evolution Simulation in 6 Months (WATCH HERE),Technology
53365,Actor Michael Jace charged with murder,Entertainment
6085,Hong Kong leader unveils vote reform plan amid increasing discontent,Economy
13440,Selena Gomez Zone 2014: 'Come and Get It' Singer Seen With Orlando Bloom in  ...,Entertainment
19597,The Leftovers Won't Be Like Lost—It'll Have an Ending,Entertainment
59082,"GM Issues Stop-Sale Order for 2014-2015 Trucks, SUVs",Technology
17776,Big Mac continues to take Russian rap with more closures,Economy
21123,Sony Exec Reveals Amazing Spider-Man 2 / Sinister 6 Movie Connection,Entertainment
62270,"Eta Aquarids meteor shower May 5-6, 2014: Peak times, watch NASA live stream  ...",Technology
49460,Camp Not Openly Opposing Extenders Missing in Tax Revamp Draft,Economy
21165,MTV reprising 'TRL' for one day,Entertainment
56068,Middle finger salute added to 240 new emoji for smartphones,Technology
37711,AC/DC To Split? Rumours Spread Amid Malcolm Young Reports,Entertainment
32944,Addicted to Candy Crush? You're officially smart,Economy
20452,LG G Flex receives Android 4.4.2 KitKat update with Knock Code,Technology
4203,The Voice US Season 6 Finale: Where to Watch Online,Entertainment
44227,Samsung's long-awaited Galaxy S5 now on sale in 125 countries,Technology
7671,Selena Gomez Reunites with Justin Bieber after Firing Her Parents as Managers  ...,Entertainment
54420,EU prices at their lowest level for the past five years,Economy
6264,Film Review: Mr. Peabody and Sherman (2014),Entertainment
29579,Happy Father's Day From the Lannisters – Game of Thrones Finale Recap,Entertainment
24556,"Jared Leto, Katy Perry, Leonardo DiCaprio and More Stars at Coachella Festival  ...",Entertainment
14386,Adobe issues emergency update to patch IE flaw,Technology
23290,BoE's Weale sees evidence for tighter policy,Economy
36752,TradeTheNews.com US Market Update: Equities Close Out the Week on a  ...,Economy
55497,"Allentown 'Burger King Baby,' now 27, says she's found her birth mother",Technology
33239,Bachelorette Recap: Lie Detectors in Venice,Entertainment
46783,"James Rebhorn, Veteran Character Actor and Homeland Star, Dies at 65",Entertainment
17574,"Bob Dylan's ""Like a Rolling Stone"" Draft Sells for $2M",Entertainment
52633,Marathon Survivor Dances for the First Time Since April Attack,Entertainment
59695,"US rapper Benzino shot, injured during mother's funeral procession 0",Entertainment
38881,Neil deGrasse Tyson is here to recruit you,Technology
52324,Three NFL players named in police report,Economy
27528,Colin Firth has a 'conscious uncoupling' from Paddington,Entertainment
45338,"REFILE-FOREX-Yen grinds lower as global stocks rally, dollar holds steady",Economy
34661,Android Wear from Google I/O: Australian pricing and availability,Technology
39404,NZD strengthens against euro,Economy
38988,When does Friday the 13th have a full moon?,Technology
31565,Today's Pre-Market Trading Very Positive For Chipotle Mexican Grill (CMG),Economy
51286,Randy Orton Injury: Updates on WWE Star's Head and Return,Economy
497,Euro Holding Strong Despite ECB Easing Talk,Economy
45166,'Girl Meets World' trailer ignites Ben Savage nose job rumors? Twitter fans not  ...,Entertainment
6646,Guess the only country that spends more on export finance than the US,Economy
44579,Go green with versatile and inexpensive cabbage for St. Patrick's Day,Entertainment
767,"Selena Gomez Seen Spending Independence Day In Malibu, Source Says She  ...",Entertainment
31732,"Asia stocks end mixed after upbeat China PMI, US record highs",Economy
61904,Sony not to pay bonus to senior executives for 3rd straight year,Economy
4104,PetSmart May Sell Or Merge To Increase Shareholder Value,Economy
37634,Dropbox releases Carousel app to organize and share your Dropbox photos,Technology
63742,Microsoft tightens privacy policy after admitting to reading journalist's emails,Technology
58847,Former Skype CEO Tony Bates named president of GoPro,Economy
44728,iPhone 6 design a hot topic among netizens,Technology
22261,A once-in-a-lifetime meteor shower may be on its way,Technology
58985,"'22 Jump Street' stars Hill, Tatum bring A-list power as grand marshals at Pocono  ...",Entertainment
16634,Draghi Drives ECB Easing Expectations Up,Economy
37453,Steve Perry Of Journey Performs For The First Time In Almost 20 Years! [VIDEO],Entertainment
59108,Kim Kardashian's Medical Afflictions Surface With A Vengeance In Paris! See  ...,Entertainment
6739,"The close: TSX hits highest level in 6 years, closes in on record",Economy
60588,'Captain America' demotes 'Rio 2' at the box office,Entertainment
58077,Kim Kardashian Had North West's Ears Pierced at Home for Her First Birthday,Entertainment
57753,New York to add $3 billion windfall to state budget,Economy
10571,Halo 5: That mysterious character is not Cortana,Technology
38648,Justin Bieber films Tom Hanks getting down on the dance floor to Montell  ...,Entertainment
11313,"March 27, 2014|By Rex W. Huppke",Technology
58894,"April 17, 2014, 7:17 pm",Economy
35837,'Guardians Of The Galaxy's Vin Diesel Says 'I Am Groot' In Multiple Languages  ...,Entertainment
20342,The Supreme Court Is About To Make A Decision That Could Completely  ...,Entertainment
31757,Two Amazing Space Discoveries Could Completely Rethink How We View Our  ...,Technology
50258,"Massimo Vignelli, whose graphic designs reached from the subway to the skies  ...",Entertainment
34937,Google had secret pact with Samsung over some Apple patent claims,Technology
46357,Chromecast heading to the UK 'in weeks',Technology
3314,This Weekend at the Box Office (June 13-14-15),Entertainment
26747,Yen gains in Asia after US stocks fall,Economy
28861,GM Recall: Many Victims Were Young Drivers,Technology
22001,Watch: New Trailer For Angelina Jolie's 'Maleficent' Bestows A Curse,Entertainment
17610,"Capitol Update: A look at HB 2553, opting out of Affordable Care Act",Economy
36799,Drew Barrymore Reacts After Half-Sister Was Found Dead in Car,Entertainment
36248,IBM and Apple Mean Business,Technology
60649,Stocks turn mixed ahead of economic data,Economy
53413,Deadline Looms for Troubled MD Health Insurance Exchange,Economy
56309,Starbucks to offer wireless charging — it probably won't work for your phone,Technology
2467,GM recalling Camaros for ignition switch problem,Technology
33300,Meet the future Mrs. Clooney,Entertainment
50594,CBS Names Stephen Colbert As Next 'Late Show' Host,Entertainment
50715,"Record Store Day: Hallelujah, vinyl is alive",Entertainment
64172,"US estimates Fannie, Freddie to repay $179.2bn to taxpayers",Economy
32037,It's showtime for May Camelopardalids meteor shower!,Technology
9709,Red Hat acquires French concern for $95M,Technology
7688,Matt Lauer agrees to new contract with the Today show,Entertainment
6196,Ouch! How to pay your tax bill to the IRS,Economy
31713,Lindsay Lohan's Bad Girl Antics Cause Elle Indonesia's Editor To Call Her AB  ...,Entertainment
35936,"Not hot- nor cold-blooded, dinosaurs were 'in between'",Technology
62062,Squirrel $300K damage: How DId One Squirrel Cause $300k Damage?,Economy
44366,Lana Del Rey and 'Ultraviolence' go straight to the top of the Official Albums Chart,Entertainment
46617,Astronomers identify 'Godzilla of Earths' in distant star system,Technology
64997,Miley Cyrus Instagram Dance Videos,Entertainment
34976,US corn ratings rise,Economy
38526,Chelsea Handler gives emotional speech on last 'Lately' show,Entertainment
42612,Apple hiring executives to spearhead mobile payments business: Report,Technology
25230,IBM to invest $3bn in smaller silicon chips,Economy
39320,Libya government endorses deal to end oil ports crisis,Economy
34943,Grilling with Kathy Pullin,Economy
51798,Washington's share of SunTrust Mortgage deal is $3M,Economy
55466,How to Train Your Dragon 2 stays grounded when it needs to,Entertainment
1838,Potential New Avenger! Marvel Reportedly Wants to Cast Jared Leto as 'Doctor  ...,Entertainment
22399,Jennifer Lawrence waiting for fans to get sick of her,Entertainment
21966,Warner Bros pushes the Wachowskis' Jupiter Ascending to 2015,Entertainment
46675,"'Mad Men' Finale “Set In Stone”, …",Entertainment
38726,"Jonah Hill Uses Gay Slur Against Photographer, Sparks Controversy",Entertainment
2821,"After American Apparel board ousts Dov Charney, workers left in dark",Economy
937,Lana Del Rey Confirms Split From Long-Term Boyfriend Barrie-James O'Neill?,Entertainment
38437,Oculus Review: Don't Look in the Mirror!,Entertainment
31448,Supermoon to Brighten Your Whole World Tomorrow Night,Technology
34790,Snooki's Having a Girl! See Her Reaction to the News,Entertainment
47379,Kim Kardashian: I Never Thought About Racism Until I had a Mixed-Race Baby,Entertainment
7599,OutRunner robot is one of the fastest running robots out there: It joins the Cheetah,Technology
58731,Colorado Governor: No Economic Damage From Pot Legalization,Economy
27194,Alpha announces intention to lay off 1100 surface miners,Economy
24069,"Lee Marshall, Voice Behind Tony The Tiger, Dies at 64",Entertainment
40915,Guardians of the Galaxy Opening to Test Marvel's Movie Brand Power,Entertainment
64237,BNP Paribas says has ample funding to pay U.S. fine,Economy
32320,Market breadth shows rising disappointment risk,Economy
12715,"Novartis India soars 20% on parent's deal with GSK, Eli Lilly",Economy
29817,Wear Wolves: internet commenters are howling about this week's Google Wear  ...,Technology
64568,"Lions Gate to release 'Divergent' film finale in 2 parts, following 'Twilight' formula  ...",Entertainment
56529,How Michael Jackson lives on after his death,Entertainment
55565,SD County's share of distressed home sales among lowest in state,Economy
50556,Eight Years Later Outkast Finally Reunited At Coachella Festival,Entertainment
56620,L'Wren Scott's sister praises Mick Jagger's 'kindness' for sharing her ashes,Entertainment
45782,"One planet, 36422 selfies: NASA mosaic presents a spectacular view of life on  ...",Technology
